Title,Location,Extract_date,Link,Desc,Company,CompanyLink,Salary,Job_Type1,Job_Type2,Remote,Reviews,Stars
Sr. Data Analyst (R),"London, ON",2022-04-07,https://ca.indeed.com/rc/clk?jk=75733dad142df190&fccid=2e34fbb9cb2e96bf&vjs=3,"Join our Winning Team as a Senior Data Analyst
When was the last time you bragged about where you work? At CARFAX, we do it every day. Why? Because we’re proud to work for a company with a strong mission and trusted brand. We’re proud to work with people who care about what they do and work hard every day to deliver their best. And just announced, the return of the 4-day work week from May 30th through Labour Day! We’ve created the type of company culture where the term, “work- hard play- hard” is taken to new heights. Even today, while working remotely, our culture is strong, and our team is connected!
As a Senior Data Analyst, you will be working with the Data Science Manager on high-value data projects across multiple departments. You will be working on complex research and analysis, requiring strategic thinking and strong problem-solving skills, while working cross-functionally across multiple departments and as part of a team.
The CARFAX Culture
People who work at CARFAX are happy. Team CARFAX knows their work has purpose and everyone contributes to our mission to help consumers throughout the lifecycle of buying, owning, and selling used cars. Our culture offers a unique blend of a high achieving; high-energy workforce in a casual, laid back setting and our employee-focused culture is consistently honored as a ""Best Place to Work"".
As a Senior Data Analyst your responsibilities will include:
Maintaining and improving established, advanced machine learning processes on data mining
Providing actionable ad hoc analytics insights for internal stakeholders
Designing and building recurring reports for internal stakeholders to make data-driven decisions
Identifying and implementing ways to supercharge data quality and data integrity
Using advanced analytical methods to explore and extract additional data value for existing and emerging products
Documenting analysis results and presenting value to stakeholders
Creating reusable processes to assist data evaluation and analysis across teams within the Data Services department
To be considered for this role, you will need:
3-5 years of direct experience performing advanced data analytics or a master’s degree in Statistics, Data Analytics, or related field
3+ years’ experience in SQL and R
Strong grasp of statistical modeling techniques such as linear regression, logistic regression, GLM, etc.
Experience with Natural Language Processing projects
Ability to effectively communicate analysis and insights to all levels of the organization
A passion for continuous learning
Confidence to challenge the status quo
Offers of employment may be conditional upon providing evidence of COVID-19 full vaccination.",Carfax,https://ca.indeed.com/cmp/Carfax?campaignid=mobvjcmp&from=mobviewjob&tk=1g03pb3lggsol800&fromjk=75733dad142df190,NA,Full-time,NA,Remote,NA,NA
Data Quality Analyst (Hybrid),"Montréal, QC",2022-04-07,https://ca.indeed.com/rc/clk?jk=7c53f276288e67cd&fccid=d7fc5d4aa0dfe74c&vjs=3,"Stratuscent has digitized the sense of smell. We've done for the nose what the camera did for the eyes and the microphone did for the ears. It took six years and some help from NASA, but we did it. Now it's time for us to bring it to the world.
Reporting to the Director of the Data Annotation Lab, you will be part of a multidisciplinary team of engineers and scientists and play a key role in ensuring the quality of our data. You will help automate our data quality assurance process and develop tools to maximize our data collection capabilities.
People who succeed at Stratuscent have a sense of urgency, a ton of initiative, infinite curiosity, strong internal drive, and an enthusiasm for bleeding edge tech. If you are bursting with fresh ideas and want to join a company in its journey to change the status quo, then this opportunity is for you.
Responsibilities:
Create quality metrics that ensure the quality of our data
Develop processes, standards, and tools for scalable chemical sensor data collection
Build automated test frameworks for active monitoring and post-collection analysis
Create reports, visualizations, and dashboards to evaluate internal and external data collection activities
Design and implement processes for automated data quality checks
Plan and drive projects
Experience and Qualifications:
Must have a Degree in Data Science, Computer Science, Engineering, or Mathematics
5+ years of relevant experience with data analytics with Python, SQL
Ability to perform analysis of data content and extract insights
Excellent communication and interpersonal skills
Ability to drive and push multiple projects simultaneously
Detail oriented with strong organizational skills
Prior experience writing and executing test plans
Prior experience documenting technical requirements
Prior experience developing and executing data governance strategies
What we offer:
The opportunity to join a forward-thinking company surrounded by a collaborative team of innovative thinkers
A rewarding career path with diverse opportunities for professional growth
A competitive compensation and benefits package including employer paid health and dental benefits for regular, full-time employees
A generous learning and development budget to attend conferences, classes and other events
A bunch of other perks that involve food, fun and travel",Stratuscent,https://ca.indeed.com/cmp/Stratuscent?campaignid=mobvjcmp&from=mobviewjob&tk=1g03pb4evq6gm800&fromjk=7c53f276288e67cd,NA,Full-time,NA,NA,NA,NA
Data Analyst,"Calgary, AB",2022-04-07,https://ca.indeed.com/company/Travel-Alberta/jobs/Data-Analyst-6d1359db54065a68?fccid=1a9118ede029eee8&vjs=3,"Position: Data Analyst Department:  Strategy, Research and CommunicationsPosition summaryThe Data analyst is responsible for interpretation of tourism statistics and related data to support lines of business across Travel Alberta, provincial and municipal governments, and the broader tourism industry. This includes industry performance, consumer trends, market potential, business performance, investment returns and competitive intelligence. The analyst will work with the team to develop quantitative and qualitative research and conduct forward-looking and performance measurement research studies.This position also supports the system and data management of Travel Alberta’s BI technology solutions to support data acquisition, transformation, quality assurance, storage, analysis, and visualization of a large and highly complex business intelligence system. To ensure the adoption of BI technology systems, this position is also responsible for providing training, end-user support and technical support.What you needYour dedication and passion have taken your career to this point, and now it is time to advance to a new level by stepping into Travel Alberta’s exciting working environment. Here are the qualifications required to be successful in this role:A bachelor’s or master’s degree in data analysis, data science, economics, business administration or related field or equivalent combination of education and experienceA minimum of 5 years’ experience in market research and data managementDetailed knowledge of the tourism industry, the variety of sectors and businesses that comprise the industry and their unique challenges and the tourism market data sources would be considered an assetStrong data modeling/data science experience using regression and other methods, in tools like SPSS, SAS, R, Python, etc. for data mining and predictive analyticsExperience using data collection, transformation, and visualization solutions such as DOMO, Tableau, Power BI or similar platformsDetailed knowledge of market research techniques used to collect and analyze quantitative and qualitative information is required and their specific application in tourism is an asset.Well-developed communication skills (verbal and written) to lead discussions and facilitate consensus as well as to communicate complicated tourism-related concepts and corresponding analyses through written reports, briefs, and presentationsProven research and analytical and problem-solving skills relative to determining need, analyzing options, making recommendations, and translating research results for decision-makersAbility to manage and coordinate the data gathering process and apply appropriate research methodologies to meet information and data requirements of key clientsExperience in managing third-party vendors in the delivery of research and business intelligence initiativesSound organizational, time management and priority-setting skills to assist with several high-priority projects at the same timeWhat you’ll doCollect, clean, and analyze performance data to measure outcomes, identify trends and determine gaps, provide key insights and implications concerning tourism management and developmentConduct statistical analysis and hypothesis testing to improve forecasting, targeting and performance measurementMeet with key internal clients to obtain a thorough understanding of their business objectives and goals, then guide the identification of key performance indicatorsSupport procurement through vendor selection processes, contract negotiation and documentationSupport tourism partners with assessing event economic impact using an existing model Travel Alberta subscribes toSupport measurement of travel trade investments by maintaining Travel Alberta’s proprietary modelManage projects that are undertaken in-house and by third-party vendorsSupport research studies through the design of data collection tools: surveys, evaluation forms, interview and focus group guides, secondary data sources, project tracking and monitoring spreadsheetsWork with the manager to ensure up-to-date research and statistics best practices are usedSupport the development, creation, and facilitation of presentations to convey research resultsImplementation and maintenance of analytic products that monitor data, key operations, and communication functions.System administrator of a large and highly complex business intelligence system. This requires data architecture, ETL implementation of dataflows, data visualizations and maintenance to enable the analysis of first- and third-party data and research to support key business decisions.Work with cross-functional internal teams and external stakeholders to understand and develop business requirements for performance dashboardsUphold data governance and quality assurance processes to ensure data is consistent, trustworthy and accessible across all business unitsDevelop documentation that provides a comprehensive view of data / information architecture and complex data relationships across first- and third-party data sourcesMaintain data catalogues that reflect complex business rules; develop data models and define specifications for dataset creation and reports to support internal and partner business information requirementsProvide training, end-user support and technical support for our business intelligence and data science solutionsOther informationThis position is based in Calgary, AlbertaEmployment status: Full-time permanentOvertime, evening, and weekend work might be required.Salary: $73,568 - $95,651This position offers an excellent benefits package with Sun Life Financial, including extended health and dental coverage, life insurance, travel insurance, long-term disability and a flexible spending account. This individual will also participate in a defined benefit plan with the Public Service Pension Plan (PSPP) have free and confidential access to Sun Life’s RightDirections Employee Assistance Program (EAP) and be a part of Travel Alberta’s learning and development program to support career development.Closing date: April 20th 2022If you have the qualifications to succeed in this role, submit a cover letter, resume and your salary expectations, with the title in the subject line of your email to careers@travelalberta . com. If applicable, please indicate the name of the Travel Alberta team member who referred you to this role.If you need an accommodation in the recruitment process, please let us know.About Travel AlbertaTourism is a major driver of Alberta's economy. And it's not just front-line tourism businesses that play a role. A diverse range of industries and jobs across the province benefit from travellers who come to Alberta.Travel Alberta is the destination management organization of the Government of Alberta. We promote Alberta as a desirable place to travel, live, work, play, invest and learn. Working with businesses throughout the province, we capitalize on Alberta’s breathtaking landscapes and world-class hospitality to develop memorable experiences for visitors to enjoy, in all regions, year-round. Our work directly and indirectly benefits our province, driving visitation and revenue, diversifying the economy, providing jobs, encouraging economic investment, and enhancing quality of life for Albertans and their communities.Established as a Crown corporation on April 1, 2009, we operate under the authority of the Travel Alberta Act within the Ministry of Jobs, Economy and Innovation.To learn more about Travel Alberta’s strategy and programs visit industry.travelalberta.com.If you're passionate about helping this province prosper and want to be part of an award-winning organization with strong corporate values, energetic team members and a great culture, Travel Alberta is the destination for you.We wish to express our appreciation to all applicants for their interest and advise that only candidates selected for an interview will be contacted. Any personal information submitted will be managed with the strictest of confidentiality.Job Types: Full-time, PermanentSalary: $73,568.00-$95,651.00 per yearBenefits:Company eventsCompany pensionDental careDisability insuranceEmployee assistance programExtended health careFlexible scheduleLife insuranceOn-site parkingPaid time offWork from homeSchedule:8 hour shiftCOVID-19 considerations:We have a mandatory vaccination policy in place for all employees.Ability to commute/relocate:Calgary, AB T2G 0H4: reliably commute or plan to relocate before starting work (required)Experience:market research and data management: 5 years (required)using SPSS, SAS, R, Python: 2 years (preferred)DOMO, Tableau, Power BI or similar platoforms: 2 years (preferred)",Travel Alberta,https://ca.indeed.com/cmp/Travel-Alberta?campaignid=mobvjcmp&from=mobviewjob&tk=1g03pb557gsp8800&fromjk=6d1359db54065a68,"$73,568 - $95,651 a year",NA,NA,Temporarily remote,8 reviews,3.8
Analyste de données (télétravail) / Data Analyst (Remote),"Montréal, QC",2022-04-07,https://ca.indeed.com/rc/clk?jk=8c15f59ba36cf991&fccid=c7d4f8c3890f3506&vjs=3,"Analyste de données (télétravail) / Data Analyst (Remote)
En tant qu'analyste de données chez Seedbox, vous jouerez un rôle clé pour aider l'entreprise à prendre de meilleures décisions. Votre travail se fera en étroite collaboration avec les équipes produits et l'équipe BI. Vous serez le pont entre le monde complexe des données et les décideurs.
Tu es parfait pour le poste si tu:
détiens un diplôme universitaire en informatique, en mathématiques, en économie ou dans un domaine connexe ;
as de solides compétences en langage SQL
as une expérience des outils de visualisation de données tels que Tableau.
as une expérience concrète avec au moins un langage de science des données (de préférence Python)
as de l'expérience avec des outils de recherche reproductibles tels que Databricks Notebooks, RMarkdown ou Jupyter Notebook
possèdes de solides compétences en analyse statistique
as une facilité à communiquer des concepts complexes
détiens des connaissances en informatique distribuée et en systèmes de données basés sur le cloud computing
possèdes une connaissance de base de l'apprentissage automatique (ML)
as d'excellentes compétences en communication orale et écrite en anglais
possèdes des compétences en matière d'organisation, de résolution de problèmes et d'analyse
es capables de communiquer des concepts complexes à des parties prenantes non techniques
es une personne motivée qui s'approprie son travail et est capable de travailler avec peu de supervision
as une passion pour les données
as un esprit créatif et la capacité d'innover avec des idées et des concepts
es à l'aise pour travailler dans un environnement où le rythme est soutenu.
Seedbox t’offre en retour:
une rémunération globale compétitive en fonction de tes compétences acquises et de ton expérience connexe.
une prime de performance trimestrielle.
un lieu de travail hybride : tu travailles de l'endroit qui te convient le mieux, que ce soit à 100% à distance ou à 100% au bureau, ou un mélange des deux.
un horaire de travail flexible : tu choisis le créneau horaire qui convient à ta routine - en fonction des besoins d’affaires de ton équipe bien sûr (nous te les présenterons lors d'une réunion en face à face).
un programme d'assurance collective complet, nous payons 50 % de la prime pour toi.
un REER collectif avec une contribution de l'employeur jusqu'à 3 %.
un accès à un solide programme de télémédecine (clinique en ligne).
du temps et un soutien financier pour développer tes compétences de manière continue.
et bien plus encore.
Concrètement, tes responsabilités quotidiennes seront de :
créer et maintenir des rapports dans le logiciel Tableau pour diverses parties prenantes de ton unité commerciale
effectuer des analyses de données ad hoc qui fournissent des informations vitales aux parties prenantes.
trier, transformer, calculer et vérifier l'intégrité des données utilisées pour l'analyse
développer des modèles de données réutilisables qui peuvent être utilisés pour les rapports ainsi que par diverses parties prenantes
collaborer avec les équipes de développement pour améliorer la couverture et la qualité des données en agissant comme une partie prenante importante pour les données de l'entreprise
créer des modèles prédictifs et collaborer avec les équipes de développement pour mettre en œuvre ces modèles en production.
soutenir les tests A/B de l'entreprise
recueillir les demandes des parties prenantes
gèrer ton propre carnet de projets
présenter tes résultats aux parties prenantes
offrir une expertise statistique aux parties prenantes
écrire du code en tenant compte des meilleures pratiques
Notre processus de recrutement est le suivant :
Tu nous fais savoir que tu es intéressé(e) en postulant
Nous te contactons pour apprendre à te connaître par un court appel téléphonique
Tu passe un test technique
Tu rencontres le responsable du poste
Tu passes un test psychométrique
Tu rejoins notre équipe et tu invites tes amis à rejoindre notre grande communauté !
Un petit conseil “sur le bras”
Ne rate pas cette opportunité. C'est un poste où tu auras l'occasion de travailler sur de nombreux projets différents et de travailler avec un stack technologique moderne tel que Snowflake, databricks, et plus encore.
Oh, et un autre petit truc :
Pas besoin de courir pour acheter un complet ou repasser ton pantalon. Tout le processus d'embauche se fait à distance, et en ce qui nous concerne, le port du pantalon est facultatif dans les conférences virtuelles.
Bon, dernière chose :
Si tu n'es pas sûr de répondre aux qualifications et que tu penses ne pas appliquer malgré ton intérêt, applique quand même ! Nous n'embauchons pas en fonction de mots-clés. Nous embauchons de vraies personnes qui ont une voix que nous voulons entendre. Les compétences techniques ça s’apprend !
P.S. - Partage cette offre. Ne t'inquiète pas de voir ton ami ou collègue actuel te voler ce poste. Nous avons de nombreuses ouvertures en ce moment, et nous savons être opportunistes lorsqu'il s'agit de trouver une place dans notre communauté pour des personnes sympathiques et talentueuses.
As a Data Analyst at Seedbox, you will play a key role in helping the company make better decisions. Your work will be done in close collaboration with the product teams and the BI team. You will be the bridge between the complex world of data and the decision makers.
You are perfect for this position if you:
have a university degree in computer science, mathematics, economics or a related field;
have solid SQL language skills
have experience with data visualization tools such as Tableau
have concrete working experience with at least one data science language (preferably Python)
have experience with repeatable research tools such as Databricks Notebooks, RMarkdown or Jupyter Notebook
have strong statistical analysis skills
have a facility to communicate complex concepts
have knowledge of distributed computing and cloud-based data systems
have a basic understanding of knowledge of machine learning(ML)
have excellent oral and written communication skills in English
possess organizational, problem solving and analytical skills
are able to communicate complex concepts to non-technical stakeholders
are a self-motivated individual who takes ownership of the work and is able to work with little supervision
have a passion for data
have a creative mind and the ability to innovate with ideas and concepts
are comfortable working in a fast-paced environment.
Seedbox offers you in return :
a competitive compensation package based on your acquired skills and related experience
a quarterly performance bonus
a hybrid workplace: you work from the location that suits you best, whether it's 100% remote or 100% in the office, or a mix of both
a flexible work schedule: you choose the time slot that suits your routine - depending on your team's business needs of course (we will present them to you in a face-to-face meeting)
a comprehensive group insurance program, we pay 50% of the premium for you
a group RRSP with an employer contribution of up to 3%
access to a robust telemedicine program (online clinic)
time and financial support to develop your skills on an ongoing basis
and much more.
Concretely, your daily responsibilities will be to :
create and maintain reports in Tableau software for various stakeholders in your business unit
perform ad hoc data analysis that provides valuable information to stakeholders
sort, transform, calculate, and verify the integrity of data used for analysis
develop reusable data models that can be used for reports as well as by various stakeholders ;
work with development teams to improve data coverage and quality by acting as an important stakeholder for enterprise data;
create predictive models and collaborate with development teams to implement those models in production
support the company's A/B testing
gather stakeholder requests
manage your own project backlog
present your results to stakeholders
provide statistical expertise to stakeholders
write code with best practices in mind
Our recruitment process is as follows:
You let us know that you are interested by applying
We will contact you to get to know you through a short phone call
You take a technical test
You meet with the hiring manager
You take a psychometric test
You join our team and invite your friends to join our great community!
A little free advice:
Don't miss this opportunity. This is a position where you will have the opportunity to work on many different projects and work with a modern tech stack such as Snowflake, databricks, and more.
Oh, and one other little thing:
No need to run out to buy a suit or iron your pants. The entire hiring process is done remotely, and as far as we are concerned, wearing pants is optional in virtual conferences.
Okay, last thing:
If you're not sure if you meet the qualifications and you think you won't apply despite your interest, apply anyway! We don't hire based on keywords. We hire real people who have a voice we want to hear. Technical skills are learned!
P.S. - Share this offer. Don't worry about your current friend or colleague stealing this job. We have many openings right now, and we know how to be opportunistic when it comes to finding a place in our community for nice, talented people.",Les Technologies Seedbox,https://ca.indeed.com/cmp/Les-Technologies-Seedbox?campaignid=mobvjcmp&from=mobviewjob&tk=1g03pb64iq0v1800&fromjk=8c15f59ba36cf991,NA,Full-time,NA,Remote,2 reviews,3.5
