Title,Location,Extract_date,Link,Desc,Company,CompanyLink,Salary,Job_Type1,Job_Type2,Remote,Reviews,Stars
Business Operations Analyst,"Vancouver, BC",2022-04-07,https://ca.indeed.com/pagead/clk?mo=r&ad=-6NYlbfkN0D4Zy3E48OoleVtf2O-fm6OAlwBOmsiXJ7chiOS-NigIAPmxjhshbs129-0DaLNuV_QO1ni0Z3DuFVIFcFkVohWGb1gJ9M5sMh0jLkft076UJ02Eo6g8WIuimIPzDi9gBc5bp8BOjXlxA9Jkjy6W4aOPr208_g2Uc5uwOSaJB9gT2Vx8NQ3DbF69LB9byn38eX9uEwXI0AzGTU6Tq0a5ifCtfg5tyUimtGdDiXfpFw6v5juHRguZ-95wPqGGb30wdh7YM1TXKdnQpavKknNhu5zoZNFRt_7msIUcdZxNreD8ZLog2vLuIEpHSx5c9FO5s9Z1iMHEALJ8eVbCJpqu5X7TaLhTyF9TpHAGAMweGk1nE5NdG1sqsI-JWszrpjQ0lh5dq9Z74X0WMJLFxR5L7L6riFdc_PodXbxuHheOgh6_cXJAXuS-A4v_x14bTZ3flADXxdrLbtrQeuFd7vscLZ7BT0sqL9p-7teCjoGLmz8yQ==&p=0&fvj=1&vjs=3,"Pan American Silver was created with the intention to provide investors with the best vehicle to gain exposure to higher silver prices. Our vision is to be the world’s pre-eminent silver producer, with a reputation for excellence in discovery, engineering, and sustainable development. Pan American Silver has several underground and open pit operations in Mexico, Peru, Bolivia, Argentina, Canada, and Guatemala.Pan American Silver is committed to advancing diversity and developing inclusive leadership teams that are representative of the communities we serve. The Company provides equal opportunities to all persons regardless of age, color, national origin, physical or mental disability, race, religion, creed, gender, sex, sexual orientation, gender identity and/or expression or any other characteristic protected by federal, provincial, or local law.BUSINESS OPERATIONS ANALYSTWe are looking for a Business Operations Analyst to join our finance team and help manage the financial planning, productivity and cost analysis, sustainability reporting and risk management, and insurance of Pan American Silver. The Analyst will report directly to the Manager, Finance and be in our head office in Vancouver. If you are enthusiastic about mining and finance, you are the candidate we are looking for. Please see our website for more information on what we do.Primary Responsibilities(i) Financial Planning & AnalysisSupport the annual operations budget process by consolidating, analyzing, and reporting results of the budget; and assisting with the preparation of presentations for the Senior Management group and Board of Directors.Assist with maintaining and developing the corporate long-term plan, in collaboration with COO office and Finance leadership. Support the development of strategic scenario analysis as required, and the presentation of results of long-term plans.Assist with the evaluation and implementation of business intelligence tools to improve efficiency of internal and external reporting processes.Provide support to the Capital Committee for reporting and analysis of capital allocation requests.(ii) Productivity & Cost AnalysisMaintain monthly and quarterly production and cost reports and analyze trends for mine performance (budget vs actual) and productivity metrics.Assist with designing, maintaining, and producing regular and ad-hoc reports and dashboards for analysis, forecasting and data visualization of equipment efficiency, materials consumption, maintenance downtime and other operational metrics.Provide support to mine site cost and productivity projects, task forces and ad-hoc analyses.(iii) _ Energy, Sustainability & Climate Change Reporting_Support the development of closure and decommissioning liability estimates for all mineral properties, in coordination with the Corporate Environmental team.Assist with the development of climate change disclosure.Develop analysis for economic benefit generated for stakeholders by region.Support the development and updating of energy profiles for our operations and analysis for emissions reductions projects in future years.Support the Environmental team in scope three emissions reporting and analysis based on financial information.(iv) _ Risk Management & Insurance_Assist with coordinating engineering risk review reports needed for our insurance renewals and coordinate mitigation of recommendations directly with operations group.Experience/Qualifications/Education RequiredBachelor’s degree in Mining, Metallurgical or Environmental EngineeringInterest in Finance2 years’ work experience minimumProficiency in spreadsheet development and analyticsStrong attention to detail and technical knowledgeProven analytical and critical thinking skillsExperience in Mining industry is an assetProficient in English, Spanish is an assetStrong verbal and written communication skillsTeam player and self-starter Able to prioritize and manage multiple tasks.Ability to work in a diverse groupOccasional travel may be requiredWe thank all applicants for showing interest. Only candidates under consideration will be contacted.Job Types: Full-time, PermanentSchedule:Monday to FridayApplication question(s):Are you located in Vancouver?Experience:mining, metallurgical or environmental: 2 years (required)",Pan American Silver Corp.,https://ca.indeed.com/cmp/Pan-American-Silver-Corp-1?campaignid=mobvjcmp&from=mobviewjob&tk=1g03paopmmfp3800&fromjk=57febecc3ce97a4c,NA,"Full-time, Permanent","Full-time, Permanent",NA,NA,NA
Business Data Analyst,"London, ON",2022-04-07,https://ca.indeed.com/pagead/clk?mo=r&ad=-6NYlbfkN0BthXxb7DVDkVvSou-c0I7Axu5T5XlvIpV31J68S3Rx2uvAN6_uS16C1ALu5maDZ-JMdjf7WI6iPirXZ0Z7S9MuEtFrciPF389arDK3-VmQZmc7BqM1V6VwwWqm0aAi5cDlqo-A7IreigNI9i4dTWfjINljq3AyB2Gmuuy9wvi87QhLBsg6-j3HGPYOzYTa1i_EuDbKB1kdVcU6W_DQL19uVB5cYfGThexyxe4CkuGyRWHviLeXLqm7Ds4n-4J28Ejpo4nPIDGe2HHRitpoQMZFiTyFRhdQDgylmGAuTETInS96FGxe8QjpSkc6sCIZVd1NHXRBsFGnM01e9t_lo2ljvp2iF524jTEymXDCCJNxgbk6MBoRNb5Pkbau8VteORq5AflN_aMmCVNK7n4UyCDQgOZaAMWiu8QjVNhlrIKxbmUns06QgirwLZD_KW-ERGIc-s4_LBnYHnrmAjQI1j_5InszUBA9hI1SoRqc9S8I0S0F8z81Ss_LWHg8jATKWfw=&p=1&fvj=1&vjs=3,"Express is recruiting for a direct hire Business Data Analyst for our valued insurance client in London. Our client administer multiple lines of insurance products in auto and lending marketplaces and has a solid people culture.
Why You Want the Job?

Comprehensive salary package 65-75k.
Health and Dental benefits; employee Assistance Plan.
2-3 weeks paid vacation.
Positive company culture; hands-on management team.
On site position.

Requirements of the role:

2 to 3 years of similar experience in data analytics or business analyst role.
Experience working with Microsoft SQL is required.
Knowledge of Tableau, Power BI, Data Science languages.
Bachelor’s degree in Business, Mathematics, Computer Science, or related field.
Strong analytical and communication or presentation skills required.

Primary Responsibilities: (not limited to: )

Identify trends and opportunities for growth through analysis of complex data sets.
Work closely with the management to understand needs, identifying critical metrics and KPIs.
Create and maintain interactive visualizations through data interpretation, integrating various reporting components from multiple data sources.
Develop and maintain databases by acquiring data from multiple sources.
Analyze local, national, and global trends that impact both the organization and the industry

Express SRG partners with companies that can demonstrate Covid 19 safety protocols and job site safety measures that comply with ministry guidelines to protect all workers.
Express SRG is committed to fair and equitable recruiting practices.
#IND4
Job Types: Full-time, Permanent
Salary: $65,000.00-$75,000.00 per year
Schedule:

8 hour shift",Express Employment Professionals,https://ca.indeed.com/cmp/Express-Employment-Professionals?campaignid=mobvjcmp&from=mobviewjob&tk=1g03paquhr097800&fromjk=f543e56464841181,"$65,000 - $75,000 a year",NA,NA,NA,"9,027 reviews",3.8
Data Analyst,"Ottawa, ON",2022-04-07,https://ca.indeed.com/rc/clk?jk=a6901c365e38deb2&fccid=06f0c906048a9394&vjs=3,"Requisition ID: 2411 Department: Community & Social Services Dept. Service: Comm Saf, Well-Being,Pol & Anlt Services Branch: Soc Pol, Research & Analytics Branch Employment Type: Up to 3 Full-time Temporary - Up to 2 years Work Hours: 35.00 /hours per week Affiliation: CIPP Salary Information: $74,590.88 - $90,759.76 annually (2022 rates of pay) Location: City Hall,110 Laurier Avenue West City: Ottawa, ON Job Category: Community and Social Services Application Close: 21/04/2022



 JOB SUMMARY


 The Community and Social Services department is responsible for creating a strong social infrastructure by providing support to families and individuals in need to promote their self-reliance and quality of life, in collaboration with community partners. This includes providing financial assistance, housing, childcare, employment, and long-term care.
The Social Policy, Research & Analytics Services team strives to increase the collective wellbeing of the City of Ottawa by unlocking the value of data. Our team looks at how we can leverage our existing and corporate strengths to better use data across our service areas.
As a data analyst, you will join a passionate, technical, and data driven team that is motivated to improve the availability, consistency, and accessibility of data within and across CSSD service areas. The team is committed to incorporating equity, diversity, inclusion and an Indigenous reconciliation, anti-racism, and gender-equity approach in all that we do. We want all clients to feel heard, seen, and reflected in the data collection and analysis process.
You will be responsible for extracting, cleaning, preparing and visualizing data for analysis, performance, and advance analytics on a team of socially driven professionals.
The City of Ottawa promotes the principles of diversity and inclusion and adheres to the tenets of the Canadian Human Rights Act and the Ontario Human Rights Code. We encourage applications from women, people with disabilities, Aboriginal peoples and persons of all races, ethnic origins, religions, sexual orientations, and gender identities and expressions.




 EDUCATION AND EXPERIENCE


 Completion of 4 year university degree in Statistics, Economics, Mathematics, Computer Science, Data Science, Business Intelligence, Business Administration or a related field
Minimum of 3 years of experience in the field of data and analytics




 KNOWLEDGE



General knowledge of corporate technology systems and databases, business intelligence and datavisualization tools
Data systems and statistical data collection
Survey techniques and methodologies
Database management and data handling procedures (Extraction, transformation and analysis)
Advanced skills in Microsoft EXCEL
Microsoft Office software (Word, PowerPoint and Outlook)
Records management systems
Knowledge of applicable health and safety legislation, including the rights and duties of workers
Knowledge or experience with a centre of excellence approach to enabling an organization and customersto self-serve advanced analytics is highly desirable
General API architecture knowledge
Experience with Versioning Control Systems (GIT, Azure DevOps)
General understanding of Power Platform
Knowledge of panel data





COMPETENCIES, SKILLS AND ABILITIES



Prepare and deliver technical summary reports
Data handling and statistical analysis
Analytical skills backed by proficiency in dealing with data 
Skilled with data visualization tools such as Power BI, Tableau, QlikView, or similar 
Plan, organize, and schedule work
Work professionally with technical staff, consultants, and research partners





COMPETENTCIES, SKILLS AND ABILITIES



Communicate effectively both verbally and in writing, with different stakeholders
Ability to undertake projects and tasks with minimal supervision
Ability to work in a team with technical staff
Ability to manage multiple priorities in a fast-paced, ever changing environment. 
Strong initiative, judgment and reliability 
Highly motivated and conscientious 
Diplomacy, discretion and tact 
Works well in a team environment 
Desire and flexibility to expand their knowledge base to grow their skills in adjacent disciplines
Proficient in SQL
Knowledge of Python and/or R




WHAT YOU NEED TO KNOW

Language Requirement: English oral, reading, writing
Experience and formal training combined with demonstrated performance and ability may substitute for stipulated academic requirements.
Please save a copy of the job poster. Once the closing date has passed, it will no longer be available.


 
We wish to thank all applicants for their interest and effort in applying for this position. Only candidates selected for interviews will be contacted.


The City of Ottawa promotes the principles of diversity and inclusion and adheres to the tenets of the Canadian Human Rights Act and the Ontario Human Rights Code. We encourage applications from women, people with disabilities, Aboriginal peoples and persons of all races, ethnic origins, religions, sexual orientations, and gender identities and expressions.


The City of Ottawa provides accommodation during all parts of the hiring process, upon request, to applicants with disabilities. If contacted to proceed to the selection process, please advise us if you require any accommodation.


Accessible formats and communication supports are available upon request. Please contact the HR Service Centre at 613-580-2424, extension 47411.",City of Ottawa,https://ca.indeed.com/cmp/City-of-Ottawa?campaignid=mobvjcmp&from=mobviewjob&tk=1g03parqvmfqs800&fromjk=a6901c365e38deb2,"$74,591 - $90,760 a year",NA,NA,NA,332 reviews,4.2
22-032 Business Analyst,"Saskatoon, SK",2022-04-07,https://ca.indeed.com/pagead/clk?mo=r&ad=-6NYlbfkN0Da55cD5SyBLpPH7k1CrVrulUOH2z8rmQzTVue5eMZiIb3wkNQGtKpp9xWTn85e7sn_yJBUKZ0a-U-6PAyvUBR6kHTjJOyyvRVcqubhtcNrrppzNNwqH4kuqFO0renUixY72a-ZY4iwEm3cgfz9A-QEAsWHUsrwQbojPywzxT56GlXvkhdd8tx99NxwgWMpU1HAgf6ppD1JkB2vJXryT9FYu3QH5jxDfQHsjMh_u7_NMlgALbya5DpwigC5TYyeQ4JpQ1OS0wle7yFBnz6Y36pl5VXfAVd6F_x8UTQ01n7xewgk7VOl73S-KnNdE5tKo849BLzHlYt171SHC4z9fBNxat9m_x5pSj7GrAV0qKD-u9kZdbCmR1hbPkIrHXTeqkfi-IgMUv8jjCDPnXg-VpdgbgulkkpZ3AjnoXmzQ1ptV5cQ_mNZUm84R_JbAkKrY0xUu5wFm-3I4QEPcUyyFJyX_LFYCU_eWy7cSEvtPaoc1__F_TD91_ViW_toS5rXozwj-_foXdeekxI3pH44BbPe3jYLgeyQHzHW4hsxf1B5dFVfes2sM60XwCyGdf-ypyEH6tnKIIUeJial1m73ZoqkAhTTMaT9nLVq8gHlDI_a0WCqWf8c-FEtquZ6rdIV0AYm74JT5WqeakIMFFGfNb8eulNOFuSudAFU1dYQQTDo_54tGIL6_v34WYnWEZqdN7o=&p=3&fvj=0&vjs=3,"Our client, a Canadian global leader in exploration, mine engineering, and environmental protection has an immediate need for an Intermediate Business Analyst. This is a contract position for seven (7) months. This role will start remotely with the potential to be based out of the Saskatoon office in the future.
Responsibilities:
This role will support Technical Service's transition to a data driven environment and act as a liaison between IT services while having exposure and familiarity with Technical Service's operations, systems, priorities and goals.
Report development
Analyzing/visualizing data (using Power BI or other software)
Support data centralization and modeling
Supporting optimization and automation of business processes
Gather requirements
Work with end users, SMEs and other stakeholders to define solutions
Perform user acceptance testing
Provide implementation support
Qualifications:
Experience with cloud computing platforms including Google Cloud Platform or Microsoft Azure
Experience with SQL
Familiarity with data visualization best practices
Experience creating data models
Ability to analyze and report information
Knowledge and familiarity with design thinking methodology
Propensity for thinking outside the box, researching, testing and applying new technology
A project management or construction background is considered an asset
Additional Information
Client requires proof of Covid-19 vaccination to access job site. Providing proof of vaccination is a condition of employment with Ian Martin for this opportunity.
If you're a technical professional, you know that it can be difficult to find fulfilling work that advances your career. At the Ian Martin Group, we exist to connect professionals like you with meaningful work at industry-leading companies in your field. And we walk the walk, too: as a Certified B Corporation, we believe in using business as a force for good for people, our communities, and the environment.
We value diversity and inclusion and encourage all qualified people to apply. If we can make this easier through accommodation in the recruitment process, please contact us at recruit@ianmartin.com
We encourage all qualified candidates to apply; however, only those selected for an interview will be contacted.
#WES
#MON",Ian Martin,https://ca.indeed.com/cmp/Ian-Martin-Group?campaignid=mobvjcmp&from=mobviewjob&tk=1g03patnvr0an800&fromjk=2ea3e149020be89f,NA,NA,Fixed term contract,Temporarily remote,71 reviews,4.2
