Title,Company,Location,JobLink,CompanyLink,DatePosted,ExtractDate,Description,Salary,JobType,Remote,Reviews,Stars
Supply Chain Governance Senior Analyst,McKesson Canada,"Montréal, QC",https://ca.indeed.com/rc/clk?jk=64953a543fea0f30&fccid=a7c5036618407010&vjs=3,https://ca.indeed.com/cmp/Mckesson?campaignid=mobvjcmp&from=mobviewjob&tk=1g6755573i9io800&fromjk=64953a543fea0f30,2022-06-22,2022-06-22,"McKesson requires new employees to be fully vaccinated for COVID-19 as defined by Health Canada, subject to applicable, verified accommodation requests.

 McKesson is in the business of better health and we touch the lives of patients in virtually every aspect of healthcare. At McKesson Canada, we touch the lives of 12 million Canadians every day. We carry more than 35,000 products in 12 distribution centers and ultimately provide distribution to 6,300 retail pharmacies, 1,350 hospitals, long-term care centers, clinics and institutions all over Canada. But we're so much more than a distribution company. We've automated 2,500 retail pharmacies and dispense over 100 million doses a year through our automation solutions. Manufacturers, healthcare providers and patients count on us for a full range of services that contribute to the quality and safety of care for us all.
 
 At McKesson Canada, you’ll help us carry out our mission to improve lives and advance healthcare. Working here is your opportunity to shape an industry that’s vital to us all.
 

Job Summary

 Reporting to the Senior Director, Supply Chain Management and Governance, the Supply Chain Governance Senior Analyst, is responsible to:
 

 Support the end-to-end supply chain process stream aimed at ensuring flawless execution of service level performance targets.
 Implement a LEAN governance system to drive accountability and alignment of key performance indicators.
 Implement and lead multi-disciplinary planning reviews aimed at promoting effective communication flows to ensure optimal cross- collaboration.
 Orchestrate root cause analysis and problem-solving initiatives to pro-actively manage risk and reduce potential banner related penalties.
 Work in close collaboration with various cross-functional stakeholders to drive efficiency through continuous improvement initiatives and innovation.
 Be an advocate to communicate a clear vision and need for change within the organization that generates excitement, enthusiasm, and commitment to the process.
 Conduct benchmarks and instill best in class supply chain business.
 Consolidating relevant information and synthesizing it for executive level awareness, including, making good sense of data, and performing in depth analysis, socializing challenges with Procurement Operations stakeholders.

 Key focus areas include good service levels, healthy inventory, accurate forecasts, and timing of launches (ex: promotions, new modular/planogram events, etc...) that are all in-line with the company’s financial targets.
 

Section A – Specific Responsibilities

 Governance and Communication (40%)
 

 Prepare and support governance meetings to report on results, banner contractual and internal KPIs, risks and challenges with management team.
 Understands, values, and communicates enterprise interdependencies and leverages this insight to enable informed decision making.
 Works in collaboration with key internal stakeholders including but not limited to; Promotion Planning/Demand Planning/Planogram/Supply Planning/Operations/Sales and Customer Service to drive flawless execution of Supply Chain plans.
 Liaises with the key internal and external (banner) stakeholders to ensure flawless execution of supply chain plans, customer commitments and enhance collaboration on past and forthcoming inventory quantities.
 Prepare presentations to the senior management team.

 Data analytics (40%)
 

 Monitors and masters raw service level performance and engages with key stakeholders with the goal of collaboration and commitment to improvements.
 Based on banner contractual agreement regarding penalties, analyses penalties and provides inputs on areas to further discuss with the banners and the Account Management team.
 Anticipates challenges on service levels and establishes contingency plans to address issues before they impact performance.
 Enhances reporting capabilities, in collaboration with System & Analytics team, to illustrate a clear picture of fill rate performance as part of the governance.

 Process improvements and Strategy Setting (15%)
 

 With the help of analytics and various support teams, identifies risks in the supply chain and develops the appropriate contingency plans to overcome them
 Collaborates closely with the Supply Planning team to propose inventory parameter adjustments and placing and monitoring of Rush orders where required.
 Collaborates closely with the Demand Planning team for forecast development internally and externally (suppliers and customers).
 Considers the long-term impacts of decisions and actions; spots new trends, potential problems, and opportunities early and communicates to governance team.
 Constructively challenges the standard way of doing things and helps identify areas for process improvement; applies creative problem solving and resourcefulness when everyday issues arise.
 In collaboration with internal stakeholders, leads sessions to improve processes leading to higher service levels and healthier inventory.

 Change Management (5%)
 

 Effectively engages stakeholders, minimizing risk to efficient adoption and maximizing benefits through a focus on the organizational, cultural and people aspects of business transformations.
 Applies change management principles and methodologies for stakeholder adoption.
 Generates excitement with the team to create engagement and commitment to improving.

 Other (5%)
 

 Maintains relevant business knowledge of product categories and stays abreast of market and industry trends and conditions.
 Acts as a McKesson ambassador of corporate values.


 Section B – Position Requirements

 Working Experience
 

 7+ years of experience in Supply Chain Management, Sales & Operations planning and customer service, and / or procurement.
 Retail/Wholesale experience an asset.

 Education
 

 Bachelor’s Degree in Supply chain related field, Business Administration, Operations Management, or equivalent.
 MBA or MSc, CPIM or SCMP designations are assets.
 Lean Six Sigma Green Belt is an asset.
 PMP certification is an asset.

 Personal Development and Soft Skills
 

 Demonstrates the ability to solve complex problems and create effective and innovative solutions in order to develop solid strategies
 Strong analytical skills, detail oriented, focused, rigorous, and committed to meeting deadlines
 Strong business acumen.
 Demonstrated leadership.
 High proficiency in French and English (written and spoken).
 Strong communication skills; adapts to the audience, active listening
 Comfortable interacting/presenting to a large group of individuals.
 Good change management skills.

 Technical Skills
 

 Proficiency with ERP systems and Replenishment systems an asset.
 Extensive knowledge of MS Office products (Power Point, Excel, Word, Project and Visio).
 Knowledge of process and project management.

 Other Skills and Capabilities
 

 Attention to detail, whilst maintaining a strong sense of summary and ability to synthesize.
 Ability to identify operational and strategic issues and proactively drive solutions.
 Ability to work as part of multi-functional teams.
 Minimal travel might be required.
 #LI-JT2


 Worker Type
 Regular
 

McKesson is an Equal Opportunity employer.

 The material contained herein is provided for informational purpose only. All open jobs offered by McKesson on this recruitment system are subject to specific job skill requirements. The job skill requirements, qualifications, and preferred experience are determined by a subsidiary, office or department within the company which is offering the position, and all positions are subject to local prevailing employment laws and restrictions. This would include immigration laws pertaining to work authorization requirements and any other applicable government permissions or compliance.
 
 The materials on this site are provided without warranties of any kind, either expressed or implied, including but not limited to warranties regarding the completeness of information contained on this site or in any referenced links. While McKesson attempts to update this site on a timely basis, the information is effective only as of the time and date of posting.
 
 McKesson is an equal opportunity employer and values diversity in its workforce. We encourage applications from all qualified individuals and will accommodate applicants' needs, up to the point of undue hardship, throughout all stages of the recruitment and selection process.
 
 The information on this site is for information purpose only and is not intended to be relied upon with legal consequence.
 
 Current employees must apply through internal career site.
 

Join us at McKesson!",NA,Full-time,NA,"6,577 reviews",3.5
Payroll Analyst,CarePartners,"Kitchener, ON",https://ca.indeed.com/rc/clk?jk=68c87aab39664182&fccid=4c956e9439f6f860&vjs=3,https://ca.indeed.com/cmp/Carepartners?campaignid=mobvjcmp&from=mobviewjob&tk=1g6755g7lgfpv800&fromjk=68c87aab39664182,2022-06-10,2022-06-22,"Location: 
    Kitchener, ON.
  

    Job Type: 
    Full-Time
  

    Posting Date: 
    06/10/2022
  

    Closing Date: 
    07/29/2022
  


 
Payroll Analyst
 We are currently looking for someone to join our team in the permanent role of Payroll Analyst. This position is based out of our corporate office located in Kitchener Ontario, with remote working options also available. 
Reporting to the Director of Finance, the Payroll Analyst, will be supporting the roll out and implementation of our new payroll system. This person will work closely with the payroll team and the Director of Finance to ensure a successful transition to the new system while using creative measures to troubleshoot and improve efficiencies. 
The ideal candidate will have solid experience implementing systems, has a thirst for knowledge, exceptional excel and report building skills, an enthusiastic go-getter attitude, with a strong focus on attention to detail and finding solutions.
 To apply, please email a copy of your resume to: Recruiter.Lindsay@CarePartners.ca


 WHY JOIN OUR TEAM?
 In addition to a competitive salary and access to group benefits and RRSP programs, your future colleagues want to tell you that you’ll enjoy… 

“working within a knowledgeable and collaborative team” 
“working within a learning environment and having an opportunity to gain skills” 
“work life balance and flexibility” 
“working for a company that provides essential health care and positively impacts the lives of so many Ontarians”



 WHAT THE ROLE ENTAILS:

Supporting the implementation and deployment of the new payroll system (PDS Vista)
Acting as the subject matter expert for PDS Vista and the payroll functions within
Being able to identify and map current and desired future state processes with the payroll team
Acting as the lead payroll implementation specialist to support configuration of the new system
Building and developing training materials for end-users and trainers
Guiding users to use the system to full potential while troubleshooting issues and challenges
Monitoring key indicators in the payroll processes and relaying information
Identifying areas for improvement and work collaboratively with the teams to enhance the system
In collaboration with the team, ensuring oversight on pieces that impact payroll such as government reporting, employee federal and provincial income taxes, employment insurance, workplace safety insurance, unions, benefit and pension payments
Implementing contract changes in payroll system
Assist in troubleshooting application issues, and perform enhanced trouble shooting with internal stakeholders and external partners, as required
Working with stakeholders to, document, test and monitor the system while keeping record of the changes 
Evaluate and recommend changes to applicable CarePartners’ policies and procedures
Performing other duties as assigned

WHAT YOU BRING:

1+ years related work experience in an analyst role with some background in payroll or finance
Bachelor's degree in accounting, finance, technology or a related field.
You will be a Master at Excel! You'll be analyzing data.
Excellent analytical and problem-solving skills with a strong attention to detail.
Comprehension and understanding of payroll legislation (PCP preferred). 
Strong HRIS, payroll or finance systems experience (Sage preferred).
Excellent written and verbal communication skills.
Advanced Excel skills and demonstrated ability to produce high quality reports. 
Proficiency in MS Office software applications.
Comprehension and understanding of payroll legislation (PCP preferred). 
Strong HRIS, payroll or finance systems experience (Sage preferred).
Knowledge of government funded, community home health care industry considered an asset.
Excellent interpersonal skills with demonstrated ability to build, establish and maintain collaborative relationships with the payroll team, internal and external stakeholders.



 CarePartners promotes and facilitates, as appropriate, the immunization of employees in order to provide a safe working environment for its employees, to deliver safe care to patients and to fulfill its commitment to evidence- based health promotion. In accordance with Public Health and Government directives CarePartners has implemented safety protocols to prevent the spread of infectious diseases such as COVID-19. All employees will be required to wear appropriate Personal Protective Equipment as directed by CarePartners and mandated by public health authorities. All new hires of CarePartners are required at this time to demonstrate that they have been fully vaccinated against COVID-19, in accordance with our policies and procedures.


 CAREPARTNERS IS IN YOUR COMMUNITY
 In addition to providing home-based personal support, rehabilitation and therapy, nursing and palliative care across Ontario, CarePartners also serves the community through clinics, transitional care units, and provides relief in nursing homes and shared care settings.
 Through our outreach program, we’ve been organizing medical care and clinics in countries with poor access to health care since 2009.
 CarePartners welcomes and encourages applicants from people with disabilities, accommodations are available on request for candidates taking part in all aspects of the hiring process.",NA,Full-time,NA,579 reviews,2.9
Senior Analyst – Energy Market Operations,Rodan Energy,"Mississauga, ON",https://ca.indeed.com/rc/clk?jk=f53aa679b359e317&fccid=004c21babf510f39&vjs=3,https://ca.indeed.com/cmp/Rodan-Energy?campaignid=mobvjcmp&from=mobviewjob&tk=1g6755n9tgfpv800&fromjk=f53aa679b359e317,2022-06-10,2022-06-22,"Rodan Energy is a leading North American provider of solutions that help our customers meet their goal of having a reliable, sustainable supply of power. Together, we are making sustainable, attainable!
 Rodan is recognized as one of Canada’s Top Small & Medium Employers for three years in a row! This is a terrific place to learn and grow in your career. Our team of energy analysts, engineers, and metering experts, combined with our industry-leading energy intelligence software platforms, are helping energy users and power companies navigate the energy transition.
 We have an exciting opportunity available for Senior Analyst, Energy Market Operations. Reporting into the Manager, Energy Market Operations, you will support delivery of energy solutions that provide clients with opportunities to maximize their market revenues, reduce their total energy spend, and enhance overall system efficiency. Rodan is looking for an ambitious individual who takes initiative to solve problems and meet deadlines and is looking to grow their knowledge base of the various Independent Systems Operator (ISO) electricity markets.
 This role will start your career in helping build a sustainable energy future!
 **This is a flexible hybrid role where you are required to work both remotely and in person depending on business needs. You will be required to work at our Corporate HQ in Mississauga to attend and participate in workshops, projects, or team meetings.**
 Main Responsibilities & Duties:

Manage all aspects of demand management programs for the Northeast U.S. ISO markets and utility programs (“own your market”)
Support U.S. business development activities through customer information analysis to assess suitability of clients for available monetization and savings opportunities
Responsible for Rodan portfolio performance in meeting DR/Capacity Auction program commitments
Managing all aspects of client registration, metering and data management for ISO/utility program
Develop/foster relationships with applicable ISO/utility staff.
Support development of best-in-market solutions, leveraging experience across jurisdictions
Work closely with Rodan Regulatory Affairs Team to ensure efficient transfer of knowledge, solutions and ideas
Other duties as required

Requirements:

Post-secondary education in business, engineering, project management or related field – or equivalent in training, experience and education
5+ years of in-depth understanding of energy and capacity markets, particularly in demand response activities
Quick and accurate modelling and analysis of large sets of financial and other customer data
Knowledge of electricity market rules and energy savings/incentive programs
Strong data analysis skills
Advanced computer skills (MS Office, Outlook)
Willingness to travel within North America

Qualifications & Skills:

Strong technical, analytical, and financial or mathematical aptitude
Ability to accurately summarize information
Excellent verbal and written communication skills
High level of commitment to exceptional customer service and experience
Capacity to form effective relationships with users
Highly organized and able to prioritize tasks
Proven ability to work well under pressure and meet all deadlines
Ability to adjust and be flexible to meet changing work needs and demands
Resourceful, self-starter who takes initiative to solve problems and meet deadlines
Strong organization and time-management skills
Strong analytical and problem-solving skills
Strong attention to detail
Easily liaises and interacts with all types of personalities

RODAN BENEFITS:

Competitive salary, commensurate with experience
Health benefits after probationary period (medical, dental, vision, health care spending, life insurance, LTD, AD&D,)
3 weeks vacation
RRSP annual contribution top up
Employee assistance program (24/7 benefits to address problems that are personal or work related ie. psychological, financial, legal and parental support services)
Teledoc (24/7 access to Doctors by phone, video or app)

Rodan Energy is strongly committed to diversity and equality of opportunity. We strive to create an environment that is welcoming and inclusive for everyone.
 Note: As part of the initial recruitment screening process, applicants must confirm that they are Fully Vaccinated against COVID-19. If Applicants are not Fully Vaccinated, they will be asked to identify any accommodation needs pursuant to a protected ground under the Code. If no such accommodation is identified, the Applicant will not be eligible to proceed through the recruitment process.
 We thank all applicants for their interest, however, only those selected for an interview will be contacted.",NA,NA,NA,NA,NA
Lead Security Analyst,opentext,"Mississauga, ON",https://ca.indeed.com/rc/clk?jk=ea818a9d00ebb791&fccid=c908408e676247d6&vjs=3,https://ca.indeed.com/cmp/Opentext?campaignid=mobvjcmp&from=mobviewjob&tk=1g6755sa1j4hd800&fromjk=ea818a9d00ebb791,2022-06-12,2022-06-22,"OPENTEXT - THE INFORMATION COMPANY  As the Information Company, our mission at OpenText is to create software solutions and deliver services that redefine the future of digital. Be part of a winning team that leads the way in Enterprise Information Management.

 Lead Security Analyst (Threat Hunting and Detection Engineering)
 ENABLING THE DIGITAL WORLD
 OpenText enables the digital world by simplifying, transforming, and accelerating enterprise information needs, on premises or in the cloud. We embrace all things digital and are committed to being the Best Place to Work for our Employees in over 140 locations around the world.  We obsess over our customers to ensure they are wildly successful in embracing the Digital World. Our customers entrust us with their most important information, we need to be their most trusted partner. What we do, we do well. What we create, we do purposefully to impact the world. If you believe in this and are passionate about enabling the Digital World then let OpenText turn your career vision into reality. 
 The Opportunity:
 The Threat Hunting Analyst is a key member of Open Text’s Cyber Security team and will posses strong operational and analytical experience in Threat Hunting and Detection Engineering. This position is also focused on maturing the Threat Hunting program. The successful candidate will develop threat detection and analysis techniques from Threat Intelligence, threat trends and security tools to drive improvements in security monitoring and alerting capabilities. This hands-on role requires deep technical knowledge of security monitoring, security operations, network and systems analysis, threat modeling and threat detection.

 You are great at:


 Researching and understanding Cybersecurity threats, threat actors, trends in adversary activities, attack vectors and Tactics, Techniques and Procedures (TTPs).
 Using threat modeling and attack frameworks to develop advanced detection mechanisms for a variety of security tools and technologies to identify, detect and respond to malicious activity.
 Leveraging intelligence derived from Threat Hunting to improve overall Security Operations, tool visibility, threat awareness, and detection and response.
 Driving the implementation and consistent operation of the Threat Hunting program. 
Leading security program improvements and efficiencies across security technologies, processes, and services.
 Optimizing security tools deployment and introducing scalable security services. 
Building and coordinating plans for transition and integration of an acquired company’s security operations, tools, services, and processes.
 Continually building automation and tooling capabilities for the deployment and management of our internal security services.
 Driving continuous improvement of the acquisition security integration playbook.
 Proactively search for Threats to prevent or minimize Cybersecurity attacks.
 Ability to communicate to technical and management levels.
 Interpret and analyze data from multiple sources, providing key analytics.
 Document findings in an easy-to-read format.
 Perform other duties and responsibilities necessary.


 What it takes:

 BS in Computer Science, Cyber Security, Information Assurance, or Information Security preferred.
 7+ years of experience and demonstrated success in technology leadership with emphasis on security and infrastructure and cloud.
 3+ years technical management experience, including experience leading large-scale, demanding, and information security projects.
 Technical skills with IT security components, including firewalls, UTM, ATP, TVM, IAM, security analytics, server operating systems, and other industry-standard techniques and practices.
 Hands-on experience in forensic science, data analysis, intelligence analysis, malware reversing, network and endpoint security, adversary tracking, and other security-related tasks.
 Demonstrated experience generating metrics to measure service and program effectiveness.
 Strong written and presentation skills with the ability to communicate effectively with diverse technical and non-technical groups, spanning all organizational levels.
 Must be able to work in a fast paced and changing environment while handling multiple tasks, priorities, and directives. Capable of working under pressure. 
CISSP, GCIH, CISA, CISM, or other industry certifications preferred.
 Experience with MITRE ATT&CK framework preferred.


 Work Location
 
The location for the position is in Canada, Alpharetta, GA, Brook Park, OH, other US locations.

 
OpenText's efforts to build an inclusive work environment go beyond simply complying with applicable laws. Our Employment Equity and Diversity Policy provides direction on maintaining a working environment that is inclusive of everyone, regardless of culture, national origin, race, color, gender, gender identification, sexual orientation, family status, age, veteran status, disability, religion, or other basis protected by applicable laws. Should you require accommodations during the selection process, please contact accommodationrequests@opentext.com).

 Subject to applicable laws and regulations, OpenText’s global vaccination policy requires all employees to be fully vaccinated against COVID-19 to enter an OpenText office. Accommodations may be available for specific roles.",NA,NA,NA,473 reviews,3.5
