Title,Company,Location,JobLink,CompanyLink,DatePosted,ExtractDate,Description,Salary,JobType,Remote,Reviews,Stars
"Senior Engineer, STS Business Intelligence (Charlottetown)",Invesco,"Charlottetown, PE",https://ca.indeed.com/rc/clk?jk=3ddb3b7c6e031559&fccid=61e847dda35dc377&vjs=3,https://ca.indeed.com/cmp/Invesco?campaignid=mobvjcmp&from=mobviewjob&tk=1g675c67dihle800&fromjk=3ddb3b7c6e031559,2022-06-09,2022-06-22,"Invesco is one of the world’s leading global investment managers, entrusted with managing $1.5 trillion* in assets on behalf of clients worldwide. We are the 6th largest US retail asset manager and the 13th largest investment manager globally, and our more than 8,000 employees worldwide are dedicated to delivering an investment experience that helps people get more out of life. We are purely focused on managing a comprehensive range of active, passive and alternative investment capabilities, which we draw on to provide customized solutions aligned to client needs, our most important benchmark. (*As of October 31, 2021)
 Job Purpose (Job Summary):  UNIX Systems administration experience to include significant Solaris and Red Hat Linux; requires the ability to configure and deploy Solaris/Linux-based complex infrastructure solutions; experience with Solaris system performance tuning; ability to document solutions and test them in a lab environment; and experience with Linux/Solaris disaster recovery. Design and implement Unix/Linux virtualization technologies. Also would like someone with experience in Windows Server technologies and are experienced in integrating Windows authentication with Unix / Linux. Experience with Public, Private and Hybrid cloud architectures.
 Key Responsibilities / Duties: 

Determine requirements, develop specifications, architect a solution and then implement it.
 Manage the entire lifecycle of Unix/Linux servers using off the shelf or opensource tools such as Opsware, Oracle Ops Center, Cfengine, Puppet, Chef.
 Familiar with Ontap 7mode and CDOT operating systems for Netapp.
 Performs capacity performance planning and reporting to ensure efficient use of servers and storage
 Participate in project teams to represent the UNIX group and provide input on project architectures
 Develop internal documentation and maintain existing document regarding UNIX environment processes and configurations.
 Experience developing shell scripts and others languages such as Java,Perl,Python,or Ruby as needed for the automation of UNIX system tasks
 Coordinate with application developers and Oracle DBA’s to provide UNIX environments needed to support the development and deployment of applications, databases and backup strategies
 Provide off-hours on-call support for critical systems on a rotating basis with other UNIX team members.
 Secure servers to meet federal regulated requirement for audits in Financial, Investments and Banking industries


 Work Experience / Knowledge: 

Proficient in Unix/Linux systems administration.
 Familiar with Cloud architecture and technology such as Openstack, AWS, Assure, Mesosphere, etc
 Proficient with DevOps tools such as Puppet, Chef, SaltStack, Ansible, etc.
 Proficient in NAS/SAN Storage operations
 Experience in a support environment, supporting professional clientele is required
 Knowledge of general storage technologies: iSCSI, FC, FCoE, NAS, Snapshots, SAN-SAN replication is desirable
 Design, install, configure, and maintain all UNIX virtual environments using Oracle Virtual Machine for SPARC and x86, Solaris Zones, KVM and vmware/vcenter.
 Knowledge of Unix/Linux and Windows interoperability tools such as Centrify,Likewise, Samba and CIFS shares.
 Strong understanding of networking concepts: TCP/IP, LAN/WAN, DHCP, DNS, Routing, Switching and Firewalls
 Experience in deploying servers using native tools such as satellite, kickstart, jumpstart and AI
 Deployment of patches, updates, service packs using both native and 3d party tools


 Skills / Other Personal Attributes Required: 

Interpersonal skills necessary to effectively interact and communicate with a variety of individuals at all levels is required
 Organizational skills are required to ensure compliance with corporate standards
 Strong research initiative, a self-starter at locating relevant documentation, support and process assistance
 A continuous improvement mindset with an ability to refine processes to make them more efficient and effective, making more effective use of the resources.
 An ability to think 'outside of the box' with a long term view, when recommending solutions.
 Must possess a solid understanding of software and/or hardware systems used in assigned area.
 Candidates must have an exceptional ability in diagnosing and solving information system problems, while maintaining professional and interpersonal courtesies.
 Must have the ability to manage projects, establish priorities, meet deadlines and concentrate on detailed information in a fast-paced, demanding work environment.
 The ability to influence others in a politically correct manner, so that objectives are met, is required
 Candidates must have the ability to motivate and lead others in a positive manner and ensure the group’s work gets done in a timely fashion.
 The ability to cooperate in a team environment is critical.
 A successful candidate will be required to lead and assist in efforts to research networking technologies, propose, design and implement those technologies within the company infrastructure
 The ability to cooperate in a team environment is critical.
 Supports recovery efforts in the event of systems failure or disaster


 Formal Education: (minimum requirement to perform job duties)

 A degree in Computer Science or related field.


 Working Conditions: 

A normal work environment with little exposure to excessive noise, dust and temperature.
 Intense visual concentration may be required along with the ability to lift and move objects weighing up to 50 pounds.
 Frequent sitting and intermittent walking is also required.
 Hours may include evenings and/or weekends and may include 24 hour a day on call support by pager and/or cell phone.
 Shift work or adjustable work hours are likely.


 The above information on this description has been designed to indicate the general nature and level of work performed by employees within this role. It is not designed to contain or be interpreted as a comprehensive inventory of all duties, responsibilities and qualifications required of employees assigned to this job. The job holder may be required to perform other duties as deemed appropriate by their manager from time to time.",NA,Full-time,NA,422 reviews,3.9
Senior Analyst – Energy Market Operations,Rodan Energy,"Mississauga, ON",https://ca.indeed.com/rc/clk?jk=f53aa679b359e317&fccid=004c21babf510f39&vjs=3,https://ca.indeed.com/cmp/Rodan-Energy?campaignid=mobvjcmp&from=mobviewjob&tk=1g675ceat2cgq000&fromjk=f53aa679b359e317,2022-06-10,2022-06-22,"Rodan Energy is a leading North American provider of solutions that help our customers meet their goal of having a reliable, sustainable supply of power. Together, we are making sustainable, attainable!
 Rodan is recognized as one of Canada’s Top Small & Medium Employers for three years in a row! This is a terrific place to learn and grow in your career. Our team of energy analysts, engineers, and metering experts, combined with our industry-leading energy intelligence software platforms, are helping energy users and power companies navigate the energy transition.
 We have an exciting opportunity available for Senior Analyst, Energy Market Operations. Reporting into the Manager, Energy Market Operations, you will support delivery of energy solutions that provide clients with opportunities to maximize their market revenues, reduce their total energy spend, and enhance overall system efficiency. Rodan is looking for an ambitious individual who takes initiative to solve problems and meet deadlines and is looking to grow their knowledge base of the various Independent Systems Operator (ISO) electricity markets.
 This role will start your career in helping build a sustainable energy future!
 **This is a flexible hybrid role where you are required to work both remotely and in person depending on business needs. You will be required to work at our Corporate HQ in Mississauga to attend and participate in workshops, projects, or team meetings.**
 Main Responsibilities & Duties:

Manage all aspects of demand management programs for the Northeast U.S. ISO markets and utility programs (“own your market”)
Support U.S. business development activities through customer information analysis to assess suitability of clients for available monetization and savings opportunities
Responsible for Rodan portfolio performance in meeting DR/Capacity Auction program commitments
Managing all aspects of client registration, metering and data management for ISO/utility program
Develop/foster relationships with applicable ISO/utility staff.
Support development of best-in-market solutions, leveraging experience across jurisdictions
Work closely with Rodan Regulatory Affairs Team to ensure efficient transfer of knowledge, solutions and ideas
Other duties as required

Requirements:

Post-secondary education in business, engineering, project management or related field – or equivalent in training, experience and education
5+ years of in-depth understanding of energy and capacity markets, particularly in demand response activities
Quick and accurate modelling and analysis of large sets of financial and other customer data
Knowledge of electricity market rules and energy savings/incentive programs
Strong data analysis skills
Advanced computer skills (MS Office, Outlook)
Willingness to travel within North America

Qualifications & Skills:

Strong technical, analytical, and financial or mathematical aptitude
Ability to accurately summarize information
Excellent verbal and written communication skills
High level of commitment to exceptional customer service and experience
Capacity to form effective relationships with users
Highly organized and able to prioritize tasks
Proven ability to work well under pressure and meet all deadlines
Ability to adjust and be flexible to meet changing work needs and demands
Resourceful, self-starter who takes initiative to solve problems and meet deadlines
Strong organization and time-management skills
Strong analytical and problem-solving skills
Strong attention to detail
Easily liaises and interacts with all types of personalities

RODAN BENEFITS:

Competitive salary, commensurate with experience
Health benefits after probationary period (medical, dental, vision, health care spending, life insurance, LTD, AD&D,)
3 weeks vacation
RRSP annual contribution top up
Employee assistance program (24/7 benefits to address problems that are personal or work related ie. psychological, financial, legal and parental support services)
Teledoc (24/7 access to Doctors by phone, video or app)

Rodan Energy is strongly committed to diversity and equality of opportunity. We strive to create an environment that is welcoming and inclusive for everyone.
 Note: As part of the initial recruitment screening process, applicants must confirm that they are Fully Vaccinated against COVID-19. If Applicants are not Fully Vaccinated, they will be asked to identify any accommodation needs pursuant to a protected ground under the Code. If no such accommodation is identified, the Applicant will not be eligible to proceed through the recruitment process.
 We thank all applicants for their interest, however, only those selected for an interview will be contacted.",NA,NA,NA,NA,NA
"Senior Analyst, Risk, Internal Controls and Quality Assurance",OMERS,"Toronto, ON",https://ca.indeed.com/rc/clk?jk=d20d1a19072d32fc&fccid=64d182c6fc449d3a&vjs=3,https://ca.indeed.com/cmp/Omers?campaignid=mobvjcmp&from=mobviewjob&tk=1g675ck1jj458800&fromjk=d20d1a19072d32fc,2022-06-15,2022-06-22,"As part of the Quality Assurance and Controls team within Pension Services, the Senior Analyst, Risk, Internal Controls and Quality Assurance, is responsible for recommending internal controls and process improvements related to various Pension business processes. 

 As a member of this team, you will be responsible for 
Provide risk and control subject matter expertise to internal stakeholders; 
Provide input to the development of process control functionality and reporting for system implementation; 
Recommend and document internal controls and process improvements and assist in the design and implementation of new internal controls, where required; 
Prepare compliance related reports by compiling and analyzing data obtained from other departments; 
Identify and understand root cause of compliance related issues that may require follow-up or investigation; 
Assist, where necessary, with monitoring action plans in response to audit discoveries and compliance violations; and 
Conduct reviews of pension transactions by examining business processes / risks and recommending corrective actions if required, including preparing test scripts and testing controls for design appropriateness and operating effectiveness. 

 To succeed in this role, you have 
A CPA or CA designation is required. 
University degree (Commerce, Accounting, Business Administration); 
Minimum of 3 years’ experience of documenting and evaluating business risks and controls ideally in the financial services industry or related industry; 
Strong understanding of information system risks and IT general controls; 
Knowledge of governance and controls frameworks including COBIT and COSO is an asset 
Pension experience and knowledge of related risks, processes and controls is an asset; 
Strong written and verbal communication skills; 
Focused and self-motivated; 
Able to gather, synthesize, organize and interpret data or information and formulate appropriate conclusions; 
Strong planning and organizational skills, with the ability to work independently with minimal supervision; 
Possess strong problem solving and analytical skills; 
Excellent relationship management, negotiation and conflict management skills; 
Able to deal with changing priorities; and 
Independently prioritize work and accomplish multiple tasks within established timeframes. 


Our story:
 Founded in 1962, OMERS is one of Canada’s largest defined benefit pension plans, with $121 billion in net assets as at December 31, 2021. OMERS is a jointly-sponsored pension plan, with 1,000 participating employers ranging from large cities to local agencies, and over half a million active, deferred and retired members. OMERS members include union and non-union employees of municipalities, school boards, local boards, transit systems, electrical utilities, emergency services and children’s aid societies across Ontario. Contributions to the Plan are funded equally by members and employers. OMERS teams work in Toronto, London, New York, Amsterdam, Luxembourg, Singapore, Sydney and other major cities across North America and Europe – serving members and employers and originating and managing a diversified portfolio of high-quality investments in public markets, private equity, infrastructure and real estate. 

 OMERS is committed to having a workforce that reflects the communities in which we live and work. We are an equal opportunity employer committed to a barrier-free recruitment and selection process. At OMERS inclusion and diversity means belonging. How we create a sense of belonging is through our employees and our vast network of Employee Resource Groups. Whether you are passionate about gender, pride, or visible minorities, we have groups that are focused on making a difference in all of our lives. 

 Vaccination Policy 

 At OMERS and Oxford the office or worksite is our primary place of work. We are committed to providing work environments which promote the health, safety and well-being of all employees in accordance with public health regulation and guidance. Accordingly, employees are required to provide evidence of full vaccination or have an approved exemption.",NA,Full-time,NA,55 reviews,3.4
Supply Chain Governance Senior Analyst,McKesson Canada,"Montréal, QC",https://ca.indeed.com/rc/clk?jk=64953a543fea0f30&fccid=a7c5036618407010&vjs=3,https://ca.indeed.com/cmp/Mckesson?campaignid=mobvjcmp&from=mobviewjob&tk=1g675cp14j4hh800&fromjk=64953a543fea0f30,2022-06-21,2022-06-22,"McKesson requires new employees to be fully vaccinated for COVID-19 as defined by Health Canada, subject to applicable, verified accommodation requests.

 McKesson is in the business of better health and we touch the lives of patients in virtually every aspect of healthcare. At McKesson Canada, we touch the lives of 12 million Canadians every day. We carry more than 35,000 products in 12 distribution centers and ultimately provide distribution to 6,300 retail pharmacies, 1,350 hospitals, long-term care centers, clinics and institutions all over Canada. But we're so much more than a distribution company. We've automated 2,500 retail pharmacies and dispense over 100 million doses a year through our automation solutions. Manufacturers, healthcare providers and patients count on us for a full range of services that contribute to the quality and safety of care for us all.
 
 At McKesson Canada, you’ll help us carry out our mission to improve lives and advance healthcare. Working here is your opportunity to shape an industry that’s vital to us all.
 

Job Summary

 Reporting to the Senior Director, Supply Chain Management and Governance, the Supply Chain Governance Senior Analyst, is responsible to:
 

 Support the end-to-end supply chain process stream aimed at ensuring flawless execution of service level performance targets.
 Implement a LEAN governance system to drive accountability and alignment of key performance indicators.
 Implement and lead multi-disciplinary planning reviews aimed at promoting effective communication flows to ensure optimal cross- collaboration.
 Orchestrate root cause analysis and problem-solving initiatives to pro-actively manage risk and reduce potential banner related penalties.
 Work in close collaboration with various cross-functional stakeholders to drive efficiency through continuous improvement initiatives and innovation.
 Be an advocate to communicate a clear vision and need for change within the organization that generates excitement, enthusiasm, and commitment to the process.
 Conduct benchmarks and instill best in class supply chain business.
 Consolidating relevant information and synthesizing it for executive level awareness, including, making good sense of data, and performing in depth analysis, socializing challenges with Procurement Operations stakeholders.

 Key focus areas include good service levels, healthy inventory, accurate forecasts, and timing of launches (ex: promotions, new modular/planogram events, etc...) that are all in-line with the company’s financial targets.
 

Section A – Specific Responsibilities

 Governance and Communication (40%)
 

 Prepare and support governance meetings to report on results, banner contractual and internal KPIs, risks and challenges with management team.
 Understands, values, and communicates enterprise interdependencies and leverages this insight to enable informed decision making.
 Works in collaboration with key internal stakeholders including but not limited to; Promotion Planning/Demand Planning/Planogram/Supply Planning/Operations/Sales and Customer Service to drive flawless execution of Supply Chain plans.
 Liaises with the key internal and external (banner) stakeholders to ensure flawless execution of supply chain plans, customer commitments and enhance collaboration on past and forthcoming inventory quantities.
 Prepare presentations to the senior management team.

 Data analytics (40%)
 

 Monitors and masters raw service level performance and engages with key stakeholders with the goal of collaboration and commitment to improvements.
 Based on banner contractual agreement regarding penalties, analyses penalties and provides inputs on areas to further discuss with the banners and the Account Management team.
 Anticipates challenges on service levels and establishes contingency plans to address issues before they impact performance.
 Enhances reporting capabilities, in collaboration with System & Analytics team, to illustrate a clear picture of fill rate performance as part of the governance.

 Process improvements and Strategy Setting (15%)
 

 With the help of analytics and various support teams, identifies risks in the supply chain and develops the appropriate contingency plans to overcome them
 Collaborates closely with the Supply Planning team to propose inventory parameter adjustments and placing and monitoring of Rush orders where required.
 Collaborates closely with the Demand Planning team for forecast development internally and externally (suppliers and customers).
 Considers the long-term impacts of decisions and actions; spots new trends, potential problems, and opportunities early and communicates to governance team.
 Constructively challenges the standard way of doing things and helps identify areas for process improvement; applies creative problem solving and resourcefulness when everyday issues arise.
 In collaboration with internal stakeholders, leads sessions to improve processes leading to higher service levels and healthier inventory.

 Change Management (5%)
 

 Effectively engages stakeholders, minimizing risk to efficient adoption and maximizing benefits through a focus on the organizational, cultural and people aspects of business transformations.
 Applies change management principles and methodologies for stakeholder adoption.
 Generates excitement with the team to create engagement and commitment to improving.

 Other (5%)
 

 Maintains relevant business knowledge of product categories and stays abreast of market and industry trends and conditions.
 Acts as a McKesson ambassador of corporate values.


 Section B – Position Requirements

 Working Experience
 

 7+ years of experience in Supply Chain Management, Sales & Operations planning and customer service, and / or procurement.
 Retail/Wholesale experience an asset.

 Education
 

 Bachelor’s Degree in Supply chain related field, Business Administration, Operations Management, or equivalent.
 MBA or MSc, CPIM or SCMP designations are assets.
 Lean Six Sigma Green Belt is an asset.
 PMP certification is an asset.

 Personal Development and Soft Skills
 

 Demonstrates the ability to solve complex problems and create effective and innovative solutions in order to develop solid strategies
 Strong analytical skills, detail oriented, focused, rigorous, and committed to meeting deadlines
 Strong business acumen.
 Demonstrated leadership.
 High proficiency in French and English (written and spoken).
 Strong communication skills; adapts to the audience, active listening
 Comfortable interacting/presenting to a large group of individuals.
 Good change management skills.

 Technical Skills
 

 Proficiency with ERP systems and Replenishment systems an asset.
 Extensive knowledge of MS Office products (Power Point, Excel, Word, Project and Visio).
 Knowledge of process and project management.

 Other Skills and Capabilities
 

 Attention to detail, whilst maintaining a strong sense of summary and ability to synthesize.
 Ability to identify operational and strategic issues and proactively drive solutions.
 Ability to work as part of multi-functional teams.
 Minimal travel might be required.
 #LI-JT2


 Worker Type
 Regular
 

McKesson is an Equal Opportunity employer.

 The material contained herein is provided for informational purpose only. All open jobs offered by McKesson on this recruitment system are subject to specific job skill requirements. The job skill requirements, qualifications, and preferred experience are determined by a subsidiary, office or department within the company which is offering the position, and all positions are subject to local prevailing employment laws and restrictions. This would include immigration laws pertaining to work authorization requirements and any other applicable government permissions or compliance.
 
 The materials on this site are provided without warranties of any kind, either expressed or implied, including but not limited to warranties regarding the completeness of information contained on this site or in any referenced links. While McKesson attempts to update this site on a timely basis, the information is effective only as of the time and date of posting.
 
 McKesson is an equal opportunity employer and values diversity in its workforce. We encourage applications from all qualified individuals and will accommodate applicants' needs, up to the point of undue hardship, throughout all stages of the recruitment and selection process.
 
 The information on this site is for information purpose only and is not intended to be relied upon with legal consequence.
 
 Current employees must apply through internal career site.
 

Join us at McKesson!",NA,Full-time,NA,"6,577 reviews",3.5
