Title,Company,Location,JobLink,CompanyLink,DatePosted,ExtractDate,Description,Salary,JobType,Remote,Reviews,Stars
Analyst in Immunochemistry,Charles River Laboratories,"Senneville, QC",https://ca.indeed.com/rc/clk?jk=c4aab6cdc26a9e08&fccid=b5f9cabef0362658&vjs=3,https://ca.indeed.com/cmp/Charles-River-Laboratories?campaignid=mobvjcmp&from=mobviewjob&tk=1g674tv96g2fp800&fromjk=c4aab6cdc26a9e08,2022-06-17,2022-06-22,"For 70 years, Charles River employees have worked together to assist in the discovery, development and safe manufacture of new drug therapies. When you join our family, you will have a significant impact on the health and well-being of people across the globe. Whether your background is in life sciences, finance, IT, sales or another area, your skills will play an important role in the work we perform. In return, we’ll help you build a career that you can feel passionate about.


IMPORTANT: In order to be considered for this position, a resume/CV must be uploaded and submitted during the application process. Please make sure work history and education are added correctly.
 




We are currently seeking to hire an Analyst for our Immunochemistry team located in Ville St-Laurent. 
 How will you create an impact?  The Immunochemistry department mainly analyzes serum, plasma, and tissue samples to verify the concentration, toxicity, and stability of assay substances (large molecules) in order to determine the safety and efficacy of drugs.


Why Charles River?  We offer an excellent integration program for our new employees as well as opportunities for internal growth and career development. Our other perks include:


As of Day 1:

Competitive benefits & we pay 90% of premiums (health and dental coverage).
Access to a savings and retirement program with employer contribution.
Vacation and Personal Day Policy.
Free telemedicine app for you and your family.


 
Transportation:

Shuttle service from the Sainte-Anne-de Bellevue train station and from John Abbott College to the Senneville location.
Free parking.


 
Work Schedule & Salary:

Starting salary rate of $19.50/HR.
Permanent, full-time position from Monday to Friday.
Please note that training will be conducted at our Senneville location (West of Montreal).





What will you work on?




Working in our newly renovated laboratories, you will perform sample analysis work using various assays and techniques such as ELISA, Electrochemiluminescence, hybridization, and extractions. You will also perform data analysis to determine if results are within expectations; all in accordance with Good Laboratory Practices (GLP). 
 Who are we looking for?  We are seeking a motivated individual with either a DEC in Science (Biotechnology, Medical Laboratory, or equivalent) or a BAC in Science (Immunology, Biology, Biochemistry) who works with precision and strives for quality work. A self-starter with a collaborative and positive attitude. Must be comfortable working under English conditions, bilingualism is an asset. 
 If you are interested in contributing to the well-being of our communities, not only across the country but around the world, please join us and BE THE DIFFERENCE!

 



IMPORTANT: A resume is required to be considered for this position. If you have not uploaded your resume in your candidate profile, please return to upload field and attach your resume/CV. 
About Safety Assessment Charles River is committed to helping our partners expedite their preclinical drug development with exceptional safety assessment services, state-of-the-art facilities and expert regulatory guidance. From individual specialty toxicology and IND enabling studies to tailored packages and total laboratory support, our deeply experienced team can design and execute programs that anticipate challenges and avoid roadblocks for a smooth, efficient journey to market. Each year approximately 120 investigational new drug (IND) programs are conducted in our Safety Assessment facilities.",$19.50 an hour,NA,NA,782 reviews,3.2
Business and Functional Analyst - Project Accounting,Innergex,"Longueuil, QC",https://ca.indeed.com/rc/clk?jk=d91c82610eb0bb47&fccid=7352dc16e2caf1d4&vjs=3,https://ca.indeed.com/cmp/Innergex-Renewable-Energy-Inc-1?campaignid=mobvjcmp&from=mobviewjob&tk=1g674u4apihnt802&fromjk=d91c82610eb0bb47,2022-06-15,2022-06-22,"Do you want to be part of a growing company and an emerging IT team motivated by challenges?
 Why should you join our team?
 Innergex Renewable Energy Inc. is an independent renewable energy producer with an extensive and growing portfolio of assets in Canada, the United States, France and Chile. The Corporation develops, acquires, owns and operates hydroelectric facilities, wind farms, solar farms and energy storage facilities.
 For more than 30 years, Innergex has believed in a world where abundant renewable energy promotes healthier communities and creates shared prosperity. We are convinced that generating power from renewable sources will lead the way to a better world. We remain committed to responsible growth that balances people, our planet, and prosperity. We believe in offering an engaging, inclusive and supportive work environment where each team member can thrive.
 Your contribution!
 Reporting to the Senior Director - IT, the incumbent will be responsible for analyzing, designing, documenting, and recommending solutions for business processes based on market best practices. He/she will have to understand the requirements of the company and internal customers. In addition, he/she will be responsible for the evolution of the IT systems.
 Your day-to-day!

 Responsible for understanding the business needs of internal customers and transforming them into technical solutions;
 Translate business requirements into functional specifications;
 Propose best business practices and identify value-added solutions to internal customers;
 Participate in the analysis, design, documentation and implementation phases of computerization solutions and digitalization projects;
 Responsible for the evolution of systems, i.e. managing change requests and evolution cycles by establishing project plans, schedules, cost estimates, and defining business specifications;
 Document key business processes in the form of user requirements and software specifications;
 Evaluate data conversion strategies, develop and execute data conversion plans to migrate to new applications. Assist end users in developing training plans;
 Maintain system documentation for security and access management in accordance with regulatory requirements;
 Manage assigned projects and initiatives;
 Support users in best practices for using the systems.

 Your skills, our requirements!

 College or university degree or equivalent experience;
 Studies in administration or accounting, an asset;
 Minimum of 3 years experience in IT development or in a similar position;
 Training or certification in project management is an asset;
 Experience with solutions, applications and ERP modules specifically related to accounting: general ledger, chart of accounts, accounts payable, accounts receivable, asset management, internal controls and SOX;
 Experience with systems and applications integrated with the Enterprise Resource Planning (ERP) system;
 Demonstrates in-depth knowledge of integrated enterprise systems (ERP - SAP/Oracle)
 Understanding of the IT systems development lifecycle;
 Experience in ERP implementation projects and/or project management - both traditional and agile approaches an asset;
 Knowledge of a ticketing tool is an asset (e.g. Jira);
 Experience working with accounting and finance teams an asset;
 Fluently bilingual (French and English), both verbal and written knowledge of Spanish an asset.

 Additional considerations!

 The position is based at the company’s head office located in Longueuil, steps away from the Longueuil-Université de Sherbrooke metro station.

 Our benefits!

 Opportunity to contribute to building a better world;
 Competitive wages;
 Group benefits;
 Career development opportunities;
 Ongoing training;
 Dynamic work environment;
 Work from home policy.

 Innergex is an equal opportunity employer that values each person’s unique background, diversity, experiences, perspectives and talents. Innergex is committed to providing employees with a work environment free of discrimination and harassment and bases all employment decisions on business needs, job requirements and individual qualifications. The key to our success as a global company is to recruit, develop and retain the most talented people from a diverse candidate pool.


 www.innergex.com

 Please note that only candidates selected for an interview will be contacted
 #Innergex22
 800",NA,NA,Remote,10 reviews,3.3
Master Data Analyst,Robert Half,"Calgary, AB",https://ca.indeed.com/pagead/clk?mo=r&ad=-6NYlbfkN0CkZrmoNIfNnv5K6heJNTgcHXgr0H7cYcF0-Q8gfPuoOdPpnl151udEmEu9__xuFMoqGx303fW9HZEXV_wVkN5uaLOm9moxC7WD2Edm21dE13k9Ec2UJ5RvC2MzrPFybDoaWRenpTBYypjgFClvANDMMVIy2_4LYP576ulAhIQNyok5tM26rmXG3SEpgn4NFtuqg-itdkjdFaTNJW5rXcCaLjNUEEH39D5qQjY2DjT38IAqVOYbFE7MX_YDhjGYlHPglHtLPuH0ye2u8GsPj-cLpN9-918keeQ3vxr47CaTtzoIvslatD6O9P7tA5oSOyiTIL53R2A5-oOVSClpspjnO7Ak4KZ8ozgrmJYKVtM6X6YR3X6o5KDkFJfh1K-LxGlcBKDbRdoHsYpsmpk-zAbQz63ms6tJQwdF0RYl7_qXyeuYcvbtaWGVolCv46TH-XLqy4t7xSR2RBwN4c1wH5rKTGFOIoIDdsFDSb0M7fUSY5qtAANm0z-MXjkJBWgOQAqslyXLfvjJ62jqDmIYxyTs396m5k8c9cU=&xkcb=SoBx-_M3cHB4YHwYqp0LbzkdCdPP&p=2&fvj=0&vjs=3,https://ca.indeed.com/cmp/Robert-Half?campaignid=mobvjcmp&from=mobviewjob&tk=1g674uaomg4ej800&fromjk=04f6aa28f6a51669,2022-06-16,2022-06-22,"Our fast paced client in Calgary is currently seeking a Master Data Analyst to join their task-oriented team for a contract opportunity. 

 As the Master Data Analyst your day to day responsibilities of this contract role may include, but not be limited to: 

 Working through AFE job buckets 
Maintaining master records 
Ensuring all accurate information is entered 
Maintaining list of approved requesters 
Maintaining and updating process manual 
Assisting with document workflows 
Ad hoc duties as required 

 Put your talents to the test as a Master Data Analyst with our client. The successful Master Data Analyst will possess the following: 

 1+ years of previous experience in a similar role 
Prior JDE experience 
Intermediate to advanced Excel skills 
Strong communication skills 
Ability to pick up quickly 
Ability to work in a fast-paced environment 
Excellent attention to detail 
Available to start immediately 

 To be considered for this contract role, click the “Apply Now!” link or by using the Robert Half Mobile app. Download it on the App Store or get it on Google Play! For assistance with applying, please call Robert Half at 
403-269-5387. Please reference 05000-0012331990 in all correspondence regarding this opportunity. 

 Robert Half would like to thank all applicants for their expressed interest however, only those candidates identified for interview will be contacted. 

 Robert Half is the world’s first and largest specialized talent solutions firm that connects highly qualified job seekers to opportunities at great companies. We offer contract, temporary and permanent placement solutions for finance and accounting, technology, marketing and creative, legal, and administrative and customer support roles. 

 Robert Half puts you in the best position to succeed by advocating on your behalf and promoting you to employers. We provide access to top jobs, competitive compensation and benefits, and free online training. Stay on top of every opportunity – even on the go. Download the Robert Half app and get 1-tap apply, instant notifications for AI-matched jobs, and more. 

 Questions? Call your local office at 1.888.490.3195. All applicants applying for Canadian job openings must be authorized to work in Canada. 

 © 2022 Robert Half. Québec permit number AP-2000503. By clicking “Apply Now,” you’re agreeing to Robert Half’s Terms of Use .",NA,"Temporary, Fixed term contract",NA,"12,757 reviews",3.9
Supply Chain Governance Senior Analyst,McKesson Canada,"Montréal, QC",https://ca.indeed.com/rc/clk?jk=64953a543fea0f30&fccid=a7c5036618407010&vjs=3,https://ca.indeed.com/cmp/Mckesson?campaignid=mobvjcmp&from=mobviewjob&tk=1g674ufqmis1v800&fromjk=64953a543fea0f30,2022-06-22,2022-06-22,"McKesson requires new employees to be fully vaccinated for COVID-19 as defined by Health Canada, subject to applicable, verified accommodation requests.

 McKesson is in the business of better health and we touch the lives of patients in virtually every aspect of healthcare. At McKesson Canada, we touch the lives of 12 million Canadians every day. We carry more than 35,000 products in 12 distribution centers and ultimately provide distribution to 6,300 retail pharmacies, 1,350 hospitals, long-term care centers, clinics and institutions all over Canada. But we're so much more than a distribution company. We've automated 2,500 retail pharmacies and dispense over 100 million doses a year through our automation solutions. Manufacturers, healthcare providers and patients count on us for a full range of services that contribute to the quality and safety of care for us all.
 
 At McKesson Canada, you’ll help us carry out our mission to improve lives and advance healthcare. Working here is your opportunity to shape an industry that’s vital to us all.
 

Job Summary

 Reporting to the Senior Director, Supply Chain Management and Governance, the Supply Chain Governance Senior Analyst, is responsible to:
 

 Support the end-to-end supply chain process stream aimed at ensuring flawless execution of service level performance targets.
 Implement a LEAN governance system to drive accountability and alignment of key performance indicators.
 Implement and lead multi-disciplinary planning reviews aimed at promoting effective communication flows to ensure optimal cross- collaboration.
 Orchestrate root cause analysis and problem-solving initiatives to pro-actively manage risk and reduce potential banner related penalties.
 Work in close collaboration with various cross-functional stakeholders to drive efficiency through continuous improvement initiatives and innovation.
 Be an advocate to communicate a clear vision and need for change within the organization that generates excitement, enthusiasm, and commitment to the process.
 Conduct benchmarks and instill best in class supply chain business.
 Consolidating relevant information and synthesizing it for executive level awareness, including, making good sense of data, and performing in depth analysis, socializing challenges with Procurement Operations stakeholders.

 Key focus areas include good service levels, healthy inventory, accurate forecasts, and timing of launches (ex: promotions, new modular/planogram events, etc...) that are all in-line with the company’s financial targets.
 

Section A – Specific Responsibilities

 Governance and Communication (40%)
 

 Prepare and support governance meetings to report on results, banner contractual and internal KPIs, risks and challenges with management team.
 Understands, values, and communicates enterprise interdependencies and leverages this insight to enable informed decision making.
 Works in collaboration with key internal stakeholders including but not limited to; Promotion Planning/Demand Planning/Planogram/Supply Planning/Operations/Sales and Customer Service to drive flawless execution of Supply Chain plans.
 Liaises with the key internal and external (banner) stakeholders to ensure flawless execution of supply chain plans, customer commitments and enhance collaboration on past and forthcoming inventory quantities.
 Prepare presentations to the senior management team.

 Data analytics (40%)
 

 Monitors and masters raw service level performance and engages with key stakeholders with the goal of collaboration and commitment to improvements.
 Based on banner contractual agreement regarding penalties, analyses penalties and provides inputs on areas to further discuss with the banners and the Account Management team.
 Anticipates challenges on service levels and establishes contingency plans to address issues before they impact performance.
 Enhances reporting capabilities, in collaboration with System & Analytics team, to illustrate a clear picture of fill rate performance as part of the governance.

 Process improvements and Strategy Setting (15%)
 

 With the help of analytics and various support teams, identifies risks in the supply chain and develops the appropriate contingency plans to overcome them
 Collaborates closely with the Supply Planning team to propose inventory parameter adjustments and placing and monitoring of Rush orders where required.
 Collaborates closely with the Demand Planning team for forecast development internally and externally (suppliers and customers).
 Considers the long-term impacts of decisions and actions; spots new trends, potential problems, and opportunities early and communicates to governance team.
 Constructively challenges the standard way of doing things and helps identify areas for process improvement; applies creative problem solving and resourcefulness when everyday issues arise.
 In collaboration with internal stakeholders, leads sessions to improve processes leading to higher service levels and healthier inventory.

 Change Management (5%)
 

 Effectively engages stakeholders, minimizing risk to efficient adoption and maximizing benefits through a focus on the organizational, cultural and people aspects of business transformations.
 Applies change management principles and methodologies for stakeholder adoption.
 Generates excitement with the team to create engagement and commitment to improving.

 Other (5%)
 

 Maintains relevant business knowledge of product categories and stays abreast of market and industry trends and conditions.
 Acts as a McKesson ambassador of corporate values.


 Section B – Position Requirements

 Working Experience
 

 7+ years of experience in Supply Chain Management, Sales & Operations planning and customer service, and / or procurement.
 Retail/Wholesale experience an asset.

 Education
 

 Bachelor’s Degree in Supply chain related field, Business Administration, Operations Management, or equivalent.
 MBA or MSc, CPIM or SCMP designations are assets.
 Lean Six Sigma Green Belt is an asset.
 PMP certification is an asset.

 Personal Development and Soft Skills
 

 Demonstrates the ability to solve complex problems and create effective and innovative solutions in order to develop solid strategies
 Strong analytical skills, detail oriented, focused, rigorous, and committed to meeting deadlines
 Strong business acumen.
 Demonstrated leadership.
 High proficiency in French and English (written and spoken).
 Strong communication skills; adapts to the audience, active listening
 Comfortable interacting/presenting to a large group of individuals.
 Good change management skills.

 Technical Skills
 

 Proficiency with ERP systems and Replenishment systems an asset.
 Extensive knowledge of MS Office products (Power Point, Excel, Word, Project and Visio).
 Knowledge of process and project management.

 Other Skills and Capabilities
 

 Attention to detail, whilst maintaining a strong sense of summary and ability to synthesize.
 Ability to identify operational and strategic issues and proactively drive solutions.
 Ability to work as part of multi-functional teams.
 Minimal travel might be required.
 #LI-JT2


 Worker Type
 Regular
 

McKesson is an Equal Opportunity employer.

 The material contained herein is provided for informational purpose only. All open jobs offered by McKesson on this recruitment system are subject to specific job skill requirements. The job skill requirements, qualifications, and preferred experience are determined by a subsidiary, office or department within the company which is offering the position, and all positions are subject to local prevailing employment laws and restrictions. This would include immigration laws pertaining to work authorization requirements and any other applicable government permissions or compliance.
 
 The materials on this site are provided without warranties of any kind, either expressed or implied, including but not limited to warranties regarding the completeness of information contained on this site or in any referenced links. While McKesson attempts to update this site on a timely basis, the information is effective only as of the time and date of posting.
 
 McKesson is an equal opportunity employer and values diversity in its workforce. We encourage applications from all qualified individuals and will accommodate applicants' needs, up to the point of undue hardship, throughout all stages of the recruitment and selection process.
 
 The information on this site is for information purpose only and is not intended to be relied upon with legal consequence.
 
 Current employees must apply through internal career site.
 

Join us at McKesson!",NA,Full-time,NA,"6,577 reviews",3.5
