Title,Location,Extract_date,Link,Desc,Company,CompanyLink,Salary,Job_Type1,Job_Type2,Remote,Reviews,Stars
Computer Programmer/Analyst - Geospatial Data Analyst,"Vancouver, BC",2022-04-07,https://ca.indeed.com/rc/clk?jk=320666b9c7cb0fb3&fccid=3d91f889655d303e&vjs=3,"Requisition ID: 35805

Company
Located on the traditional, ancestral and unceded lands of the xʷməθkʷəy̓əm (Musqueam), Sḵwx̱wú7mesh (Squamish), and səlilwətaɬ (Tsleil-Waututh) Peoples, Vancouver has a commitment to becoming a City of Reconciliation. Vancouver consistently ranks as one of the world’s most liveable cities and is working towards being the greenest city in the world. Named among Canada's Top 100 Employers, BC's Top Employers, and Canada's Greenest Employers, the City of Vancouver seeks colleagues who can help shape and embody our core commitments to sustainability, decolonization, equity and outstanding quality of life for all residents.
Consider joining our committed team of staff and being part of an innovative, inclusive and rewarding workplace.


Main Purpose and Function
The Geospatial Data Analyst will perform complex analytical and programming work mostly focused on database modeling and geodata management but may include all phases of computer projects including computer programming, testing and implementation; systems analysis and feasibility analysis; documentation and training. The incumbent analyzes existing and proposed data, systems and procedures, designs and develops complex scripts to create and maintain sophisticated data models and data loading procedures. The position requires developing in a networked environment using a variety of programming languages, operating systems, database and other technologies.

Specific Duties and Responsibilities
Consults with user department staff in analyzing existing and proposed data model, system procedures and requirements; recommends, designs and develops computer system solutions for problems of varying complexity
Prepares detailed specifications for and writes new geodata management process and programs and revises existing data models and programs utilizing all available and applicable software aids and languages
Provides technical assistance for and coordinates the development and integration of data and programs; prepares test data and conducts program testing and debugs programs; identifies the need for additional testing
Prepares and maintains detailed user, systems and operations documentation; prepares and provides presentations, staff orientation, training and practical guidance on the use of new or changed computer systems and software
Evaluates the need for and develops general purpose, reusable data models, programs and processes to facilitate computer system and technology implementations
Estimates time and cost of system development activities based on prevailing project management standards and reports progress against those estimates
Manages and administers databases, data, software and technical platforms such as servers and operating systems. This could include advising staff on functionality, assisting staff to locate and extract needed data, developing appropriate queries, creating SQL execution plans and creating custom programs for more complex analysis needs
Participates in planning and implementations of enterprise data management and data custodianship modeling
Provide spatial data management required to support Business Intelligence, Open Data and data analytics programs and processes
Provides technical recommendation and direction to managers, programmers or junior technical staff, clients or consultants as the course of business requires
Assists in the development of computer systems standards for system support and maintenance of various business functions
Keeps up-to-date with developments in programming techniques and languages, operating systems, database management, software, computing hardware, the current state of the Information Technology industry and industry trends, and related matters
Conducts technical and Information Technology industry research. Advises on industry trends; feasibility of technologies, products and technology alternatives relevant to the Engineering Services Department
Leverages industry best practices to design, test, implement and support solutions
Assures quality, security and compliance requirements including privacy impact assessment requirements are met
Other duties/responsibilities as assigned

Qualifications
Education and Experience:
Completion of a two year diploma course in computer programming, database administration, or systems development at a technical institute or community college plus considerable related work experience or an equivalent combination of training and experience
Completion of ESRI certification (Enterprise Geodata Management Professional 10.5) or an equivalent combination of training and experience preferred
A minimum of 3 years experience (preferably in a municipal and/or GIS environment) in the development and maintenance of computer systems in a networked environment; integration of applications and databases across platforms; using a variety of the programming languages, DBMS and other software tools

Knowledge, Skills and Abilities:
Thorough knowledge of information technology specifically web, client-server, relational, object-oriented, database and network concepts; Microsoft operating systems; office productivity software including MS Teams
Thorough knowledge of relational database concepts preferably related to Oracle 11g and above and SQL Server 2008 and above
Thorough knowledge and understanding of the use of an ESRI Geodatabase v 10.x and above with the demonstrated ability to perform the following duties:
Create and configure a geodatabase
Design a geodatabase based on business requirements
Understand the use of workflows and the impact of each on the database
Manage the data within a geodatabase or database
Perform geodatabase maintenance
Design versioning workflows
Troubleshoot geodatabase related issues
Implement distributed data workflows
Manage the ArcGIS Data Store
Create views and SQL statements to access databases directly
Implement and manage geodatabase archiving
Perform migrations and/or upgrades to a geodatabase
Strong working knowledge of ETL scripting languages or tools (Python 3.5 or newer or FME 2018 or newer)
Considerable knowledge of the programming languages and software development tools in prevailing use in the GIS and CADD Services Branch
Considerable knowledge of Geographical Information Systems (GIS) and/or Computer-Aided Drafting and Design (CADD), their use in a municipal environment and of their interaction with business processes and other systems
Working knowledge of Business Intelligence, Open Data and data analytics concepts and practices
Some knowledge of the operations, procedures and policies of various city departments
Excellent organizational, time management and self-starting skills
Ability to collect, analyze and evaluate information required for analysis and programming purposes, to develop logical solutions for assigned problems and implement them
Excellent leadership skills and ability to develop and mentor others
Ability to communicate effectively both orally and in writing on technical and non-technical matters with all levels in the organization, and with external clients
Ability to develop and maintain effective working relationships at all levels in the organization, and with external clients
Ability to work effectively with changing and competing priorities with frequent interruptions within a multiple task environment

The City of Vancouver has a COVID-19 Mandatory Vaccination Policy. All employees are subject to this policy and all new applicants applying to the City of Vancouver are required to be fully vaccinated as a condition of hire and subject to this policy as a condition of ongoing employment. Candidates may only be exempted from this requirement if they request and are approved for an accommodation based on a reason related to a Human Rights Code ground (such as disability). Such a request must be made during, not after, the recruitment process.

Business Unit/Department: IT, Digital Strategy & 311 (1070)
Affiliation: CUPE 15 Non Pks
Employment Type: Temporary Full Time
Position Start Date: May, 2022
Position End Date: October, 2023
Salary Information: Pay Grade GR-027: $43.82 to $51.78 per hour

Application Close: April 15, 2022
At the City of Vancouver, we are committed to recruiting a diverse workforce that represents the community we so proudly serve. Indigenous applicants, people of colour, all genders, LGBT2Q+ and persons with disabilities are encouraged to apply. Accommodations will be provided upon request during the selection process. Learn more about our commitment to diversity and inclusion.

Before you click Apply now
Once you start your application you can save your work and leave the applications page, however please remember to submit your profile to the specific job requisition before the posting closing date.
In addition to uploading your cover letter and resume, part of the application process may include answering application questions related to the preferred requirements of the role which may take approx.. 5-10mins. Cover letters should express interest and highlight additional information relevant to the position and resumes should include a tailored summary of skills and experience related to the position.",The City of Vancouver,https://ca.indeed.com/cmp/City-of-Vancouver?campaignid=mobvjcmp&from=mobviewjob&tk=1g03pauuopkhb800&fromjk=320666b9c7cb0fb3,$43.82 - $51.78 an hour,NA,NA,NA,NA,NA
Data Analyst - Level 3,"London, ON",2022-04-07,https://ca.indeed.com/rc/clk?jk=a2c958812f815ff2&fccid=8ff3101a1c0072d6&vjs=3,"Career Opportunity

Libro is growing – and Libro is hiring.
Our expansion plans include a series of new hires across southwestern Ontario. Take a look!
Job Opportunities With Libro Credit Union

Who We Are

Imagine working for an organization where every employee and customer is an Owner.

No matter whether a customer Owner or employee Owner, everything we do at Libro is about helping people prosper. We recruit and develop experts like you; Epic Humans who are ready to offer the best possible advice, coaching and service, when and how our Owners need it.

Libro is a progressive employer who invests heavily in the development and career ambitions of our staff. Our hiring philosophy is focused finding candidates who carry a positive attitude, a desire to learn, and a passion for helping our Owners grow financial confidence. We commit to teaching and supporting you as you learn the skills you need.

This position is eligible for flexible work arrangements including a combination of remote and in-office work , and/or flex time, with office locations in London, Essex and Caledonia.

What Opportunity Awaits?

Libro is on the quest for a passionately accountable Data Analyst - Level 3 to lead research and analytic activities to solve a wide range of business problem. They will retrieve and gather vast amounts of data, organize it and use it to reach meaningful conclusions. They will exercise their knowledge of statistical techniques, analytics skills and database analysis tools and techniques to develop strategic insights to drive business goals. Data Analyst are more excited about what they can learn with data, than they are about what is already known.- Could this be you?

What you will do - The Epic Human we are looking for will;

Create datasets for reporting in high-level analytics, including but not limited to data cubes for modeling trends, business reviews and/or analytics.

Contribute to enhancing the validity, reliability and accuracy of data and information utilized in support of business initiatives.

Be comfortable with data analysis, mining, modelling, cleansing, migration and mapping.

Be comfort manipulating and analyzing complex, high-volume, high-dimensionality data from varying sources

Be a recognized expert with one or more reporting/ visualization tool-Tableau, Power BI, power pivot/map

Understand OLAP database technology and data modeling. Techniques with MDX, DAX would be an asset

Bring strong passion for empirical research and for answering hard questions with data.

Have the ability to communicate complex quantitative analysis in a clear, precise, and actionable manner.

Have strong technical documentation skills.

What we are looking for? Could this be you ?

Minimum 5-7 years’ experience in systems analysis and programming with extensive business knowledge.

Have a graduate or post graduate university degree in Computer Science, mathematics or statistics.

Have advanced skills with MS SQL Server Management Studio including stored procedures, views, functions, and ad hoc database queries for reporting purposes

Have experience developing with and supporting Integration Services (SSIS), Analysis Services (SSAS), ETL processes, SQL Agent jobs and related tools.

Be experienced with Visual Studio.NET and VB.NET

Strong expertise in analysis techniques and coding (R, Python, etc) would be an asset.

What is in it for you? How we bring Joyful in our work :
Competitive salaries and employee pension plans

Comprehensive benefit package including health, dental, and vision

Generous vacation time

Employee wellness programs

Staff accounts and staff rates on products and services

Staff appreciation programs and awards

Career development opportunities including tuition assistance

Many great perks and rewards; fitness club discounts, technology offers, travel and entertainment deals, just for being part of our great team!

Are you ready to Be Libro ?
If you're passionate about helping your community, interested in being part of a remarkable team, and want to help grow prosperity in Southwestern Ontario - we want to hear from you!

With a purpose beyond profit, Libro Credit Union is proud to be a Certified B Corporation, joining leaders of a global movement of people using business as a force for good. Serving families, farms, and enterprises in southwestern Ontario, Libro offers an inclusive, forward thinking approach to banking – all centered on growing prosperity. Libro pursues its purpose through four key pillars – employment, financial resilience, local food accessibility, and housing. Libro is also a proud Associate Member of the Responsible Investment Association of Canada.

Libro is committed to fostering a safe, healthy and inclusive work environment that inspires respect. Following the advice of Canadian health authorities to mitigate the risk of potential spread of COVID-19 and support social distancing, all recruiting activities including interviews will be conducted virtually.

Libro will provide accommodations to employees with disabilities, upon request.

#SJ",Libro Credit Union,https://ca.indeed.com/cmp/Libro-Credit-Union?campaignid=mobvjcmp&from=mobviewjob&tk=1g03pavubg2cj800&fromjk=a2c958812f815ff2,NA,Full-time,NA,NA,22 reviews,3.7
Junior Business Analyst (AP),"Thornhill, ON",2022-04-07,https://ca.indeed.com/pagead/clk?mo=r&ad=-6NYlbfkN0DY_BlV98VGxCgvPRil4oM8Y7HFVtpzt57cjMubRbIBzF9mHt_l6KdEOh-7b4gacrVehTltjiPjTubhH7iKqXsbEJmRCwfB60szmONqGR5wdDIb2yKY1RGVUm1NdMOH8nPak7VhrtugTJFLAhbPlSKwaRYjcMDl2rgUGMYVDiuZudWj8jLwrYSVyE12_iomiZZUQnAe8QTh4v_mYd5TnAfTO3ilTL3QYee04142JYjTTrwz48OijyJDUkblrXrbJIYieeD62OO4a3rQet-5N7OzIvxXOlmOupa8DZiJq9O-uNLy-8USSS3ySjWKvhCa9wmYtV75wArcU3KoStNS-DiER6byE53k71Gtkhm82Klvl285iQEF4-FTHfy7m48m0b2tIZAUjC10uJbFWZHCDQ3g0MSCV-hDIuZdgQjm90s8j9SSEGo8kNwusINQnTQ1oomqrkV5joktgiXEoI9xJr4HOwGVdoUo4WUxFLTI1yuRT_pqdzHoH5DH&p=6&fvj=1&vjs=3,"We are hiring for Junior Business Analyst for Travel Agency. This is a Full Time Permanent Job.Location: Thornhill, OntarioSalary: $60,000 - $70,000 + benefits + parkingKey Duties:Support the on-going maintenance and continuous improvement of products. Conduct needs assessments with clients to identify business requirements to translate into features or ""user stories"".Investigate and analyze problems, business processes and requirements in order to recommend appropriate solutions.Provide direction to internal and external users and assist in the effective and efficient resolution of issues.Collaborate with our development and support teams to answer business questions using data and business analysis best practices.Document system problems and resolutions for future reference.Work as a team member with other technical staff, to ensure connectivity and compatibility between systems.Work with business and product leaders to evaluate new opportunities, products and services.May lead/manage efforts for various components of a technology projectQualificationsMust Have: 2-3 years of Travel Industry related experience.Advanced Excel skills.Demonstrated business acumen and a drive and curiosity to seek data-driven answers to operational and strategic business questions.Excellent verbal and written communication skills. Strong organizational and time management skills.A high level of attention to detailGood to have:Work experience in ecommerce is an asset.Work experience with Tableau and SQL is an assetWe thank all applicants; only those selected for an interview will be contacted.Job Type: PermanentSalary: $60,000.00-$70,000.00 per yearBenefits:Dental careExtended health careOn-site parkingSchedule:8 hour shiftMonday to FridayExperience:travel industry: 3 years (required)tableau and SQL: 2 years (required)",Staffmax,https://ca.indeed.com/cmp/Staffmax-Staffing-and-Recruiting?campaignid=mobvjcmp&from=mobviewjob&tk=1g03pb1japkot800&fromjk=d6ca516b17ec0a71,"$60,000 - $70,000 a year",NA,NA,NA,26 reviews,4.2
Enterprise Data Analyst (Perm),"Toronto, ON",2022-04-07,https://ca.indeed.com/rc/clk?jk=f339228019a3cfea&fccid=533240a6bf687c7a&vjs=3,"POSTED: March 21, 2022
DEADLINE: 4:30 p.m. April 11, 2022

osted: ____________
eadline: 4:
Enterprise Data Analyst

1 – Permanent Position
Information Technology Services

CUPE Local 4400 Unit C - Grade O (12 Month)
$42.90 per hour

The Toronto District School Board adheres to equitable hiring, employment and promotion practices.
Reporting to the Senior Specialist SAP Business Intelligence, the Enterprise Data Analyst will be

responsible for the overall support, enhancement and implementation of Business Intelligence

solutions, data preparation, data management and data analysis.

The Enterprise Data Analyst will:
Gather client requirements; provide technical advice, support senior developers/analysts, and
lead Business Intelligence design/development projects.
Make recommendations for master data management and data analysis strategies; and
Work with 3rd party developers, operational DBA’s along with SAP technical and functional
teams.
Summary of Duties:

➢ Oversee the implementation of various projects both new or enhancements to existing data
preparation, data management and data analysis systems;

➢ Oversee mapping of data sources, data movement, interfaces and analytics to ensure data quality
and data integrity;

➢ Develop specifications, information architecture, data design, dataflow and testing plans for the
enhancement or development of analytics platform;

➢ Create data mining and analytics architectures, coding standards for statistical reporting and data
analysis;

➢ Drive collection of new data and the refinement of existing data sources;

➢ Act as the lead analyst to projects including establishing scope, resources and timelines for
projects;

➢ Execute, monitor and report on project activities;

➢ Provide direction to the clients via coaching, mentoring and training;

➢ Act as an advisor and consultant to various clients and other teams by providing expert advice
related to the internal workings of Data Management, Business Intelligence and analytics

platforms;
➢ Collaborate with project managers and business unit leaders for all projects involving enterprise

data and address data-related problems in regard to systems integration, compatibility and

multiple-platform integration;
➢ Communicate with clients, ITS groups, and vendors regarding reporting tools, extract and import

interfaces, data structure and models;
➢ Monitor and tune data preparation, data management and data analysis systems;
➢ Perform data migration, write documentation, monitor interfaces, manage data flow, and schedule

linkages;
➢ Receive requests to investigate and troubleshoot Business Intelligence and Analytics platform

issues;
➢ Conduct research and make recommendations on new database technologies, analytics tools and

systems, services, protocols and standards in support of procurement and development efforts;
➢ Lead investigation and develop a course of action to mitigate any errant processes or procedures

in regard to data management systems;
➢ Implement and log corrective action and communicate to all stakeholders a status report;

➢ On an annual basis develop objectives and plans for the following year;

➢ Attend technology conferences and training seminars;

➢ Read a variety of technology journals in order to maintain state of the art knowledge of the current
and future technologies;

➢ Investigate development tools and utilities and establishes data management standards for the
development and production environment; and

➢ Other related duties as assigned.
Qualifications:

➢ University Degree in Computer Science or related field with three years progressive working
experience within an Information Technology environment or an equivalent combination of

education and experience;
➢ Hands-on experience with data architecting, data mining, large-scale data modeling, and business

requirements gathering/analysis.
➢ Demonstrated experience and expertise in data management platforms, Business Intelligence

and Analytics systems (e.g., SAP BW and SAP Business Objects platforms);
➢ Experience with memory and columnar databases and appliances (e.g. SAP HANA)

➢ Experience with SAP ECC transactional system including various modules such Finance, HR, etc

➢ Experience with SAP Data Services platform.

➢ Experience with databases platforms (e.g. Oracle, SQLServer) as well as relational database
design;

➢ Experience in design and development of OLAP functionality;

➢ Experience with reporting, analysis and dashboard tools (e.g., SAP BEX tools) as well as SAP
Business Objects Crystal Reports and Web Intelligence, Analysis Edition for OLAP and Microsoft

Office, Lumira Designer and Lumira Discovery;
➢ Experience with data connections, data foundations, semantic layers, universes and Information

Design Tool;
➢ Knowledge of ITOA systems such as SPLUNK;

➢ Knowledge of Big Data technologies(e.g. Hadoop), client/server and web technologies and
architectures along with the understanding of Web Services (SOAP, XML,WSDL)

➢ Knowledge of database development methodologies and lifecycles;

➢ Strong interpersonal skills to maintain a cooperative working relationship with other members of
staff;

➢ Be resourceful and creative in designing compelling, visually attractive analytics solutions.

➢ Demonstrated ability to be a team player and work well independently as well as in a team.

➢ Demonstrated ability to make effective presentations to clients and committees of the Board;

➢ Successful experience providing service to clients with a customer service focus;

➢ Good oral, written and organizational skills;

➢ Good documentation skills.

➢ Strong analytical, reasoning and problem solving skills;

➢ Proven ability to work under pressure and consistently meeting deadlines;

➢ Proven ability to be open, transparent and accountable

➢ Good project management and time management skills.


Special Requirements:

➢ Require some travel across TDSB sites;

➢ Available on call evenings, weekends and extended vacation periods;

➢ Vacation restrictions during project implementation; and

➢ Must be available to work overtime as required.

Location: 140 Borough Drive (wheelchair accessible).

Hours: 35 hours per week


Work Year: 12 months
Notes:

1. It is anticipated that interviews will take place within two weeks after the closing date of this
competition.

2. It is anticipated that the successful applicant will commence as soon as possible and practical.


Please note:
Applications must be submitted:
1. in résumé form with a covering letter to: application.submission@tdsb.on.ca

2. with competition # CUPE C-22-0091UE in the subject line

3. Apply no later than 4:30pm on April 11, 2022

Only applicants selected for an interview will be contacted. Applications will not be acknowledged in writing.

We strive to meet the accommodation needs of persons with disabilities. Applicants are encouraged

to make their needs for accommodation known in advance during the hiring process.",Toronto Catholic District School Board,https://ca.indeed.com/cmp/Toronto-Catholic-District-School-Board?campaignid=mobvjcmp&from=mobviewjob&tk=1g03pb2niptvg800&fromjk=f339228019a3cfea,$42.90 an hour,NA,NA,NA,94 reviews,4.1
