Title,Company,Location,JobLink,CompanyLink,DatePosted,ExtractDate,Description,Salary,JobType,Remote,Reviews,Stars
Analyst in Immunochemistry,Charles River Laboratories,"Senneville, QC",https://ca.indeed.com/rc/clk?jk=c4aab6cdc26a9e08&fccid=b5f9cabef0362658&vjs=3,https://ca.indeed.com/cmp/Charles-River-Laboratories?campaignid=mobvjcmp&from=mobviewjob&tk=1g675jcgph4cg800&fromjk=c4aab6cdc26a9e08,2022-06-17,2022-06-22,"For 70 years, Charles River employees have worked together to assist in the discovery, development and safe manufacture of new drug therapies. When you join our family, you will have a significant impact on the health and well-being of people across the globe. Whether your background is in life sciences, finance, IT, sales or another area, your skills will play an important role in the work we perform. In return, we’ll help you build a career that you can feel passionate about.


IMPORTANT: In order to be considered for this position, a resume/CV must be uploaded and submitted during the application process. Please make sure work history and education are added correctly.
 




We are currently seeking to hire an Analyst for our Immunochemistry team located in Ville St-Laurent. 
 How will you create an impact?  The Immunochemistry department mainly analyzes serum, plasma, and tissue samples to verify the concentration, toxicity, and stability of assay substances (large molecules) in order to determine the safety and efficacy of drugs.


Why Charles River?  We offer an excellent integration program for our new employees as well as opportunities for internal growth and career development. Our other perks include:


As of Day 1:

Competitive benefits & we pay 90% of premiums (health and dental coverage).
Access to a savings and retirement program with employer contribution.
Vacation and Personal Day Policy.
Free telemedicine app for you and your family.


 
Transportation:

Shuttle service from the Sainte-Anne-de Bellevue train station and from John Abbott College to the Senneville location.
Free parking.


 
Work Schedule & Salary:

Starting salary rate of $19.50/HR.
Permanent, full-time position from Monday to Friday.
Please note that training will be conducted at our Senneville location (West of Montreal).





What will you work on?




Working in our newly renovated laboratories, you will perform sample analysis work using various assays and techniques such as ELISA, Electrochemiluminescence, hybridization, and extractions. You will also perform data analysis to determine if results are within expectations; all in accordance with Good Laboratory Practices (GLP). 
 Who are we looking for?  We are seeking a motivated individual with either a DEC in Science (Biotechnology, Medical Laboratory, or equivalent) or a BAC in Science (Immunology, Biology, Biochemistry) who works with precision and strives for quality work. A self-starter with a collaborative and positive attitude. Must be comfortable working under English conditions, bilingualism is an asset. 
 If you are interested in contributing to the well-being of our communities, not only across the country but around the world, please join us and BE THE DIFFERENCE!

 



IMPORTANT: A resume is required to be considered for this position. If you have not uploaded your resume in your candidate profile, please return to upload field and attach your resume/CV. 
About Safety Assessment Charles River is committed to helping our partners expedite their preclinical drug development with exceptional safety assessment services, state-of-the-art facilities and expert regulatory guidance. From individual specialty toxicology and IND enabling studies to tailored packages and total laboratory support, our deeply experienced team can design and execute programs that anticipate challenges and avoid roadblocks for a smooth, efficient journey to market. Each year approximately 120 investigational new drug (IND) programs are conducted in our Safety Assessment facilities.",$19.50 an hour,NA,NA,782 reviews,3.2
Business and Functional Analyst - Project Accounting,Innergex,"Longueuil, QC",https://ca.indeed.com/rc/clk?jk=d91c82610eb0bb47&fccid=7352dc16e2caf1d4&vjs=3,https://ca.indeed.com/cmp/Innergex-Renewable-Energy-Inc-1?campaignid=mobvjcmp&from=mobviewjob&tk=1g675jiapihnt800&fromjk=d91c82610eb0bb47,2022-06-15,2022-06-22,"Do you want to be part of a growing company and an emerging IT team motivated by challenges?
 Why should you join our team?
 Innergex Renewable Energy Inc. is an independent renewable energy producer with an extensive and growing portfolio of assets in Canada, the United States, France and Chile. The Corporation develops, acquires, owns and operates hydroelectric facilities, wind farms, solar farms and energy storage facilities.
 For more than 30 years, Innergex has believed in a world where abundant renewable energy promotes healthier communities and creates shared prosperity. We are convinced that generating power from renewable sources will lead the way to a better world. We remain committed to responsible growth that balances people, our planet, and prosperity. We believe in offering an engaging, inclusive and supportive work environment where each team member can thrive.
 Your contribution!
 Reporting to the Senior Director - IT, the incumbent will be responsible for analyzing, designing, documenting, and recommending solutions for business processes based on market best practices. He/she will have to understand the requirements of the company and internal customers. In addition, he/she will be responsible for the evolution of the IT systems.
 Your day-to-day!

 Responsible for understanding the business needs of internal customers and transforming them into technical solutions;
 Translate business requirements into functional specifications;
 Propose best business practices and identify value-added solutions to internal customers;
 Participate in the analysis, design, documentation and implementation phases of computerization solutions and digitalization projects;
 Responsible for the evolution of systems, i.e. managing change requests and evolution cycles by establishing project plans, schedules, cost estimates, and defining business specifications;
 Document key business processes in the form of user requirements and software specifications;
 Evaluate data conversion strategies, develop and execute data conversion plans to migrate to new applications. Assist end users in developing training plans;
 Maintain system documentation for security and access management in accordance with regulatory requirements;
 Manage assigned projects and initiatives;
 Support users in best practices for using the systems.

 Your skills, our requirements!

 College or university degree or equivalent experience;
 Studies in administration or accounting, an asset;
 Minimum of 3 years experience in IT development or in a similar position;
 Training or certification in project management is an asset;
 Experience with solutions, applications and ERP modules specifically related to accounting: general ledger, chart of accounts, accounts payable, accounts receivable, asset management, internal controls and SOX;
 Experience with systems and applications integrated with the Enterprise Resource Planning (ERP) system;
 Demonstrates in-depth knowledge of integrated enterprise systems (ERP - SAP/Oracle)
 Understanding of the IT systems development lifecycle;
 Experience in ERP implementation projects and/or project management - both traditional and agile approaches an asset;
 Knowledge of a ticketing tool is an asset (e.g. Jira);
 Experience working with accounting and finance teams an asset;
 Fluently bilingual (French and English), both verbal and written knowledge of Spanish an asset.

 Additional considerations!

 The position is based at the company’s head office located in Longueuil, steps away from the Longueuil-Université de Sherbrooke metro station.

 Our benefits!

 Opportunity to contribute to building a better world;
 Competitive wages;
 Group benefits;
 Career development opportunities;
 Ongoing training;
 Dynamic work environment;
 Work from home policy.

 Innergex is an equal opportunity employer that values each person’s unique background, diversity, experiences, perspectives and talents. Innergex is committed to providing employees with a work environment free of discrimination and harassment and bases all employment decisions on business needs, job requirements and individual qualifications. The key to our success as a global company is to recruit, develop and retain the most talented people from a diverse candidate pool.


 www.innergex.com

 Please note that only candidates selected for an interview will be contacted
 #Innergex22
 800",NA,NA,Remote,10 reviews,3.3
Payroll Analyst,CarePartners,"Kitchener, ON",https://ca.indeed.com/rc/clk?jk=68c87aab39664182&fccid=4c956e9439f6f860&vjs=3,https://ca.indeed.com/cmp/Carepartners?campaignid=mobvjcmp&from=mobviewjob&tk=1g675jpv1is1v800&fromjk=68c87aab39664182,2022-06-10,2022-06-22,"Location: 
    Kitchener, ON.
  

    Job Type: 
    Full-Time
  

    Posting Date: 
    06/10/2022
  

    Closing Date: 
    07/29/2022
  


 
Payroll Analyst
 We are currently looking for someone to join our team in the permanent role of Payroll Analyst. This position is based out of our corporate office located in Kitchener Ontario, with remote working options also available. 
Reporting to the Director of Finance, the Payroll Analyst, will be supporting the roll out and implementation of our new payroll system. This person will work closely with the payroll team and the Director of Finance to ensure a successful transition to the new system while using creative measures to troubleshoot and improve efficiencies. 
The ideal candidate will have solid experience implementing systems, has a thirst for knowledge, exceptional excel and report building skills, an enthusiastic go-getter attitude, with a strong focus on attention to detail and finding solutions.
 To apply, please email a copy of your resume to: Recruiter.Lindsay@CarePartners.ca


 WHY JOIN OUR TEAM?
 In addition to a competitive salary and access to group benefits and RRSP programs, your future colleagues want to tell you that you’ll enjoy… 

“working within a knowledgeable and collaborative team” 
“working within a learning environment and having an opportunity to gain skills” 
“work life balance and flexibility” 
“working for a company that provides essential health care and positively impacts the lives of so many Ontarians”



 WHAT THE ROLE ENTAILS:

Supporting the implementation and deployment of the new payroll system (PDS Vista)
Acting as the subject matter expert for PDS Vista and the payroll functions within
Being able to identify and map current and desired future state processes with the payroll team
Acting as the lead payroll implementation specialist to support configuration of the new system
Building and developing training materials for end-users and trainers
Guiding users to use the system to full potential while troubleshooting issues and challenges
Monitoring key indicators in the payroll processes and relaying information
Identifying areas for improvement and work collaboratively with the teams to enhance the system
In collaboration with the team, ensuring oversight on pieces that impact payroll such as government reporting, employee federal and provincial income taxes, employment insurance, workplace safety insurance, unions, benefit and pension payments
Implementing contract changes in payroll system
Assist in troubleshooting application issues, and perform enhanced trouble shooting with internal stakeholders and external partners, as required
Working with stakeholders to, document, test and monitor the system while keeping record of the changes 
Evaluate and recommend changes to applicable CarePartners’ policies and procedures
Performing other duties as assigned

WHAT YOU BRING:

1+ years related work experience in an analyst role with some background in payroll or finance
Bachelor's degree in accounting, finance, technology or a related field.
You will be a Master at Excel! You'll be analyzing data.
Excellent analytical and problem-solving skills with a strong attention to detail.
Comprehension and understanding of payroll legislation (PCP preferred). 
Strong HRIS, payroll or finance systems experience (Sage preferred).
Excellent written and verbal communication skills.
Advanced Excel skills and demonstrated ability to produce high quality reports. 
Proficiency in MS Office software applications.
Comprehension and understanding of payroll legislation (PCP preferred). 
Strong HRIS, payroll or finance systems experience (Sage preferred).
Knowledge of government funded, community home health care industry considered an asset.
Excellent interpersonal skills with demonstrated ability to build, establish and maintain collaborative relationships with the payroll team, internal and external stakeholders.



 CarePartners promotes and facilitates, as appropriate, the immunization of employees in order to provide a safe working environment for its employees, to deliver safe care to patients and to fulfill its commitment to evidence- based health promotion. In accordance with Public Health and Government directives CarePartners has implemented safety protocols to prevent the spread of infectious diseases such as COVID-19. All employees will be required to wear appropriate Personal Protective Equipment as directed by CarePartners and mandated by public health authorities. All new hires of CarePartners are required at this time to demonstrate that they have been fully vaccinated against COVID-19, in accordance with our policies and procedures.


 CAREPARTNERS IS IN YOUR COMMUNITY
 In addition to providing home-based personal support, rehabilitation and therapy, nursing and palliative care across Ontario, CarePartners also serves the community through clinics, transitional care units, and provides relief in nursing homes and shared care settings.
 Through our outreach program, we’ve been organizing medical care and clinics in countries with poor access to health care since 2009.
 CarePartners welcomes and encourages applicants from people with disabilities, accommodations are available on request for candidates taking part in all aspects of the hiring process.",NA,Full-time,NA,579 reviews,2.9
Senior Analyst – Energy Market Operations,Rodan Energy,"Mississauga, ON",https://ca.indeed.com/rc/clk?jk=f53aa679b359e317&fccid=004c21babf510f39&vjs=3,https://ca.indeed.com/cmp/Rodan-Energy?campaignid=mobvjcmp&from=mobviewjob&tk=1g675jv0428it002&fromjk=f53aa679b359e317,2022-06-10,2022-06-22,"Rodan Energy is a leading North American provider of solutions that help our customers meet their goal of having a reliable, sustainable supply of power. Together, we are making sustainable, attainable!
 Rodan is recognized as one of Canada’s Top Small & Medium Employers for three years in a row! This is a terrific place to learn and grow in your career. Our team of energy analysts, engineers, and metering experts, combined with our industry-leading energy intelligence software platforms, are helping energy users and power companies navigate the energy transition.
 We have an exciting opportunity available for Senior Analyst, Energy Market Operations. Reporting into the Manager, Energy Market Operations, you will support delivery of energy solutions that provide clients with opportunities to maximize their market revenues, reduce their total energy spend, and enhance overall system efficiency. Rodan is looking for an ambitious individual who takes initiative to solve problems and meet deadlines and is looking to grow their knowledge base of the various Independent Systems Operator (ISO) electricity markets.
 This role will start your career in helping build a sustainable energy future!
 **This is a flexible hybrid role where you are required to work both remotely and in person depending on business needs. You will be required to work at our Corporate HQ in Mississauga to attend and participate in workshops, projects, or team meetings.**
 Main Responsibilities & Duties:

Manage all aspects of demand management programs for the Northeast U.S. ISO markets and utility programs (“own your market”)
Support U.S. business development activities through customer information analysis to assess suitability of clients for available monetization and savings opportunities
Responsible for Rodan portfolio performance in meeting DR/Capacity Auction program commitments
Managing all aspects of client registration, metering and data management for ISO/utility program
Develop/foster relationships with applicable ISO/utility staff.
Support development of best-in-market solutions, leveraging experience across jurisdictions
Work closely with Rodan Regulatory Affairs Team to ensure efficient transfer of knowledge, solutions and ideas
Other duties as required

Requirements:

Post-secondary education in business, engineering, project management or related field – or equivalent in training, experience and education
5+ years of in-depth understanding of energy and capacity markets, particularly in demand response activities
Quick and accurate modelling and analysis of large sets of financial and other customer data
Knowledge of electricity market rules and energy savings/incentive programs
Strong data analysis skills
Advanced computer skills (MS Office, Outlook)
Willingness to travel within North America

Qualifications & Skills:

Strong technical, analytical, and financial or mathematical aptitude
Ability to accurately summarize information
Excellent verbal and written communication skills
High level of commitment to exceptional customer service and experience
Capacity to form effective relationships with users
Highly organized and able to prioritize tasks
Proven ability to work well under pressure and meet all deadlines
Ability to adjust and be flexible to meet changing work needs and demands
Resourceful, self-starter who takes initiative to solve problems and meet deadlines
Strong organization and time-management skills
Strong analytical and problem-solving skills
Strong attention to detail
Easily liaises and interacts with all types of personalities

RODAN BENEFITS:

Competitive salary, commensurate with experience
Health benefits after probationary period (medical, dental, vision, health care spending, life insurance, LTD, AD&D,)
3 weeks vacation
RRSP annual contribution top up
Employee assistance program (24/7 benefits to address problems that are personal or work related ie. psychological, financial, legal and parental support services)
Teledoc (24/7 access to Doctors by phone, video or app)

Rodan Energy is strongly committed to diversity and equality of opportunity. We strive to create an environment that is welcoming and inclusive for everyone.
 Note: As part of the initial recruitment screening process, applicants must confirm that they are Fully Vaccinated against COVID-19. If Applicants are not Fully Vaccinated, they will be asked to identify any accommodation needs pursuant to a protected ground under the Code. If no such accommodation is identified, the Applicant will not be eligible to proceed through the recruitment process.
 We thank all applicants for their interest, however, only those selected for an interview will be contacted.",NA,NA,NA,NA,NA
Lead Security Analyst,opentext,"Mississauga, ON",https://ca.indeed.com/rc/clk?jk=ea818a9d00ebb791&fccid=c908408e676247d6&vjs=3,https://ca.indeed.com/cmp/Opentext?campaignid=mobvjcmp&from=mobviewjob&tk=1g675k4u4jm5o802&fromjk=ea818a9d00ebb791,2022-06-12,2022-06-22,"OPENTEXT - THE INFORMATION COMPANY  As the Information Company, our mission at OpenText is to create software solutions and deliver services that redefine the future of digital. Be part of a winning team that leads the way in Enterprise Information Management.

 Lead Security Analyst (Threat Hunting and Detection Engineering)
 ENABLING THE DIGITAL WORLD
 OpenText enables the digital world by simplifying, transforming, and accelerating enterprise information needs, on premises or in the cloud. We embrace all things digital and are committed to being the Best Place to Work for our Employees in over 140 locations around the world.  We obsess over our customers to ensure they are wildly successful in embracing the Digital World. Our customers entrust us with their most important information, we need to be their most trusted partner. What we do, we do well. What we create, we do purposefully to impact the world. If you believe in this and are passionate about enabling the Digital World then let OpenText turn your career vision into reality. 
 The Opportunity:
 The Threat Hunting Analyst is a key member of Open Text’s Cyber Security team and will posses strong operational and analytical experience in Threat Hunting and Detection Engineering. This position is also focused on maturing the Threat Hunting program. The successful candidate will develop threat detection and analysis techniques from Threat Intelligence, threat trends and security tools to drive improvements in security monitoring and alerting capabilities. This hands-on role requires deep technical knowledge of security monitoring, security operations, network and systems analysis, threat modeling and threat detection.

 You are great at:


 Researching and understanding Cybersecurity threats, threat actors, trends in adversary activities, attack vectors and Tactics, Techniques and Procedures (TTPs).
 Using threat modeling and attack frameworks to develop advanced detection mechanisms for a variety of security tools and technologies to identify, detect and respond to malicious activity.
 Leveraging intelligence derived from Threat Hunting to improve overall Security Operations, tool visibility, threat awareness, and detection and response.
 Driving the implementation and consistent operation of the Threat Hunting program. 
Leading security program improvements and efficiencies across security technologies, processes, and services.
 Optimizing security tools deployment and introducing scalable security services. 
Building and coordinating plans for transition and integration of an acquired company’s security operations, tools, services, and processes.
 Continually building automation and tooling capabilities for the deployment and management of our internal security services.
 Driving continuous improvement of the acquisition security integration playbook.
 Proactively search for Threats to prevent or minimize Cybersecurity attacks.
 Ability to communicate to technical and management levels.
 Interpret and analyze data from multiple sources, providing key analytics.
 Document findings in an easy-to-read format.
 Perform other duties and responsibilities necessary.


 What it takes:

 BS in Computer Science, Cyber Security, Information Assurance, or Information Security preferred.
 7+ years of experience and demonstrated success in technology leadership with emphasis on security and infrastructure and cloud.
 3+ years technical management experience, including experience leading large-scale, demanding, and information security projects.
 Technical skills with IT security components, including firewalls, UTM, ATP, TVM, IAM, security analytics, server operating systems, and other industry-standard techniques and practices.
 Hands-on experience in forensic science, data analysis, intelligence analysis, malware reversing, network and endpoint security, adversary tracking, and other security-related tasks.
 Demonstrated experience generating metrics to measure service and program effectiveness.
 Strong written and presentation skills with the ability to communicate effectively with diverse technical and non-technical groups, spanning all organizational levels.
 Must be able to work in a fast paced and changing environment while handling multiple tasks, priorities, and directives. Capable of working under pressure. 
CISSP, GCIH, CISA, CISM, or other industry certifications preferred.
 Experience with MITRE ATT&CK framework preferred.


 Work Location
 
The location for the position is in Canada, Alpharetta, GA, Brook Park, OH, other US locations.

 
OpenText's efforts to build an inclusive work environment go beyond simply complying with applicable laws. Our Employment Equity and Diversity Policy provides direction on maintaining a working environment that is inclusive of everyone, regardless of culture, national origin, race, color, gender, gender identification, sexual orientation, family status, age, veteran status, disability, religion, or other basis protected by applicable laws. Should you require accommodations during the selection process, please contact accommodationrequests@opentext.com).

 Subject to applicable laws and regulations, OpenText’s global vaccination policy requires all employees to be fully vaccinated against COVID-19 to enter an OpenText office. Accommodations may be available for specific roles.",NA,NA,NA,473 reviews,3.5
