Title,Location,Extract_date,Link,Desc,Company,CompanyLink,Salary,Job_Type1,Job_Type2,Remote,Reviews,Stars
Sr. Data Warehouse and BI Specialist,"Toronto, ON",2022-04-07,https://ca.indeed.com/rc/clk?jk=3c5fe8d45b967b81&fccid=f78ca8d4fb00e9c2&vjs=3,"Job Description: Sr. Data Warehouse and BI Specialist MyHealth Centre
 Reporting to: IT Manager
 The Sr Data Warehouse and BI Specialist is a critical role in the MyHealth technology framework, and a senior member of the IT services team. In this role, you are primarily accountable for the MyHealth Centre SQL server data warehouse, as well as all business intelligence (BI) reports, dashboards, and other analytic products. In this capacity, the Sr Data Warehouse and BI Specialist will be fully accountable for the development, testing, implementation, and maintenance of all SQL server enterprise data warehouse components (including Fact and Dimension Tables, ETL /SSIS, Analytic Cubes/SSAS), any all Microsoft or other BI products (Power BI/SSRS) utilized within MyHealth Centre.


 Responsibilities: 


Review and document the current SQL Server Data Warehouse and BI Architecture within MyHealth Centre, including the data warehouse table structures, data models, ETL (SSIS), and all current BI reporting products.
Work with the Director, IT Services, and the User Experience Lead, to identify and prioritize future data warehouse and BI requirements.
Work with the Director, IT Services, and the User Experience Lead, to define and design any future state enterprise data warehouse and BI architecture products.
Interpret and analyze source system data to determine SSIS design (including identifying, analyzing, and interpreting trends or patterns in complex data sets).
Prepare high-level data warehouse design documents (data flow diagrams and data models), and ETL mapping specifications.
Architect SQL server database structures and objects, fine tune SQL queries for performance and monitor latencies during batch processes.
Design and develop all Fact and Dimension Tables (SQL Server Enterprise).
Design and develop Analysis Services Cubes (SSAS).
Design and develop all ETL to extract source data and load the Data Warehouse Tables, and Cubes (SSIS).
Prepare manual and automated test scripts to test SSIS, SSAS, and Data Loading.
Design End User Reports and Dashboards (Power BI, SSRS or other OLAP Reporting Tools)
Troubleshoot and fix issues in all aspects of data warehouse and BI.
Determine methods to evolve and optimize data warehouse processes.
Identify, analyze, and interpret trends or patterns in complex data sets and collaborate with management to prioritize business and information needs, and support complex analytics.
Establish and maintain Master Data Library and work with Data Stewards to ensure conformance to Master Data Management Standards.




 Qualifications, Experience & Requirements: 


5-8 years as SQL Programmer with hands-on experience in Microsoft BI/SQL Server Enterprise stack (2008-2016, TSQL, SSIS, SSAS, SSRS, Power BI)
5+ years hands-on development of data warehouse solutions in a SQL Server Enterprise (2008-2016) environment (SQL Server Mgmt. Studio, Visual Studio, etc)
5+ years hands-on experience developing ETL using SQL Server Integration Services (with proven ability to write, tune and debug T-SQL, including tables, indexes, views, stored procedures, functions and triggers)
5+ years hands-on experience developing cubes using SQL Server Analysis Services
5+ years hands-on experience developing OLAP components (including dashboards and reports) using SSRS, Power BI and/or other OLAP Tools
Strong data warehouse design and physical data modeling skills
Excellent communication skills and ability to work under continual deadline constraints.
Ability to quickly troubleshoot issues and work on multiple tasks in parallel.
Excellent coding and debugging skills.




 Personal: 


Have a cheerful, positive attitude and the ability to work effectively with others as well as the ability to work independently. Provide the best possible care for the patient and treat each one with respect, dignity and kindness.",WELL Health Technologies Corp,https://ca.indeed.com/cmp/Well-Health-Technologies-Corp?campaignid=mobvjcmp&from=mobviewjob&tk=1g03pb6vk2pv8000&fromjk=3c5fe8d45b967b81,NA,Full-time,NA,NA,NA,NA
Full-time Retail Data Analyst - Food Services,"Ottawa, ON",2022-04-07,https://ca.indeed.com/rc/clk?jk=1efc724190fc5319&fccid=0656da7d92a7f8ed&vjs=3,"Please Note: If you are a current Algonquin College employee, apply to this job via the Workday application. 

Department: Food & Conference Services (Mary Baxter) 
  
Position Type: Full-Time Support 
  
Salary Range: $26.21-$30.39-Hourly 
  
Sc heduled Weekly Hours: 40 
  
Anticipated Start Date: May 02, 2022 
  
Length of Contract: n/a 
  
Posting Information Employees who are full-time internal candidates, as defined by the Support Staff Collective Agreement, will be given first consideration. 
  
Posting Closing Date: April 18, 2022 
  
Please note: jobs are posted until 12:01 am on the job closing date. 

Job Description: 

***Please note that applicants must submit their application by the evening before the closing date mentioned above. The posting closes at 12:01am on the morning of the closing date*** 

Reporting to the General Manager, the incumbent provides financial, administrative and technical support to the Food & Conference Services Department on a day-to-day basis. The incumbent’s responsibilities include administration of the Meal Plan program, Food Service cash activity and cashier processes, invoice coding and tracking, department asset audits and daily financial reporting. They are the department resource person for the programming, implementation of systems, maintenance and monitoring of Food Service Point of Sale. Utilizing sales data, the individual participates in evaluation of retail activity in conjunction with the Management team to improve business practices. The incumbent is the main liaison for the Food & Conference Service Department between the Finance Department and the Residence. 

Duties and Responsibilities: 

Responsible for compiling and monitoring the daily sales reconciliations. Ensure financial information is accurate and shared with the required departments in a timely manner. Correspond and resolve any revenue and banking discrepancies with the Finance Department or Point of Sale supplier. Maintain and monitor required records and reporting for financial activity. 
Participates in lean evaluations of systems, in consultation with other subject matter experts throughout the department, in regards to processes in which they are responsible for. 
Monitor daily cashier activity reports to ensure all Food Service Cash Policies and Procedures are being followed in accordance to College Finance Standards. Inform appropriate manager of any cashier trends or variances. 


Meal Plan Administration 

Monitors the Meal Plan program on a daily basis utilizing department Point of Sale. Ensure the financial integrity of the meal plan system is maintained, maintaining required records. Work closely with manager to assist in development and implementation of communication strategies for the meal plan program, researches necessary data to contribute to these strategies. 
Monitors all financial activity performed on the Meal Plan data base on a daily basis. Reconciles payments with finance and other integrated systems, resolving any discrepancies. Assess all current and delinquent meal plan accounts 
Monitoring and responding appropriately to meal plan enquiries received in person, by phone, or by email 
Applying payments or changes to meal plan accounts, monitors import and resolves issues, Administering, assessing, and issuing appropriate meal plan refunds. Monitor and administer Meal Plan accounts receivable and any modified payment plans 
Maintain close communication with Residence Mangers to ensure accurate and smooth meal plan service delivery. Correspond with Residence staff and managers concerning any student information, or financial discrepancies. Resolve these discrepancies with Residence staff 


POINT OF SALE (POS) 

The key resource person for solving POS terminal and mobile ordering difficulties. Frequently assembles, disassembles POS hardware in order to trouble shoot issues. Act as a liaison between the POS software provider, banking provider, Card Services and College ITS department when trouble shooting POS issues. Investigate and solve POS related issues brought forth by cashiers and staff. Set up Banquet cashes as needed. 
Utilizing POS reporting, ensure weekly and monthly retail tracking and analysis are completed. This includes, but is not limited to, transactions, revenue, product sales mix, transfers, feature programming tracking and meal plan usage. 
Initiate ongoing communication with the Finance Department, Residence and Card Services to continue improving processes, features, and programs that meet the changing needs of our customer and industry. The incumbent would be the main resource person in the development, implementation and monitoring of these new features or processes, developed in cooperation with our POS supplier. 
Consult with management, POS software providers, banking providers or Card Services before performing updates in order to minimize business and customer disruption. Assists with updates as required with ITS, banking, and other integrated partners 
Monitor back of house POS operations to ensure proper security controls and cashier information is accurate 
Enter customer profiles, department information, menu items and categories, payment options, cashier and register updates, as required, ensuring integrity of data and tax compliance within the POS. Communicate changes to the appropriate department or manager. Ensure cash registers and labels align with POS updates when required. 


Required Qualifications: 

Minimum two (2 ) year diploma or equivalent with a concentration in a business-related program an asset, accounting courses required. 
Minimum two (2) years experience entering data, retrieving and reporting information from a database system (POS experience an asset), comfortable utilizing and understanding technology 
Minimum two (2) years experience working in a “high demand” client service areas resolving client service problems and developing improved client service procedures. 
Ability to work well within tight timeframes and deadlines; 
Self-motivated with strong attention to details; 
Proven ability to prioritize activities; 
Strong written and oral communications skills; 
Strong inter-personal skills; 
Client-focused attitude; 
Experience working with MS Office software Outlook, Word, and Excel would be an asset; 



This position is paid at Payband E 
Vacancy is for P01902 


This position is subject to the terms of the Support Staff Collective Agreement: https://www.algonquincollege.com/hr/files/2019/04/2018-2022_college_support_ft.pdf 

This job requires regular onsite work in accordance with Policy HS 16 . 
HS16 Policy-Mandatory COVID-19 Vaccination 
HS16 Policy-Mandatory-Use-of-Masks 
HS16 Policy COVID-19 Workplace Recovery 

Full vaccination against COVID-19 is a condition of hire (subject only to any legislation or legal principles that may apply) for all positions that need to come on campus, including fully onsite 5 days per week, hybrid 1-4 days per week, and ad-hoc meetings on campus. This applies to all classifications of employees. Official proof of COVID-19 vaccination in the form of a copy of an Ontario Ministry of Health vaccination certificate (or its equivalent from another jurisdiction) must be submitted prior to the commencement of employment. 

Algonquin College values diversity and is an equal opportunity employer. We offer an inclusive work environment and encourage applications from all qualified individuals. Internal candidates will receive first consideration based on qualifications. If you require accommodation during the recruitment process please contact the Human Resources department at humanresources@algonquincollege.com. While we thank all those who apply, only those to be interviewed will be contacted.",Algonquin College,https://ca.indeed.com/cmp/Algonquin-College?campaignid=mobvjcmp&from=mobviewjob&tk=1g03pb7rgk265800&fromjk=1efc724190fc5319,$26.21 - $30.39 an hour,NA,NA,NA,238 reviews,4.3
Senior Data Analyst BHJOB13022_12127,NA,2022-04-07,https://ca.indeed.com/rc/clk?jk=8f27fec9ab791d2e&fccid=e671f6b2e57dc9e3&vjs=3,"Senior Data Analyst (Customer Analytics) – Contract position in Surrey (100% Remote):
On behalf of our client in Surrey, Ignite Technical Resources is looking for a Senior Data Analyst (Customer Analytics) with our client for a contract opportunity.

Role Description:
The Sr. Analyst, Customer Analytics plays a key role in applying Business Intelligence to better understand customer segments, behavior, and opportunities. In delivering robust customer analytics, insights, and propensities, the enterprise will be empowered to enhance customer experience and build a share of the wallet. The incumbent will collaborate with Marketing and support the VP in driving direct marketing strategy including direct mail, outbound calling, email, and sales process. This direct marketing strategy will include a dynamic ""test and learn"" methodology critical in optimizing return on investment. This position will also contribute to corporate development strategy including branch location, expansion, and growth opportunities.

Responsibilities:
Responsible for understanding business and growth objectives to effectively build data and analytically driven solutions.
Partner with Marketing and support VP to build and execute direct marketing discipline including champion and challenger testing to build CRM capability across the enterprise.
A strong focus on the customer to define customer segments and intimately understand corresponding values and needs.
The key deliverable is to build an analytical process to define customer segment, values, and product propensity and effectively leverage knowledge to cross-sell customers. Mandate to leverage data to build statistical propensity models.
Recommend and execute the development and delivery of CRM capability including collaborating with internal teams to optimize process and effectiveness.

Requirements:
Minimum 7 – 9 Years of Job-Related Experience.
Bachelor's Degree or a diploma requiring 3 - 4 years of full-time study.
Strong knowledge and experience with SAS and SQL.
Experience working with CRM systems.
Strong mathematical skills including model building experience.
Strong knowledge of Microsoft Office toolset.
AWS Experience is an asset.
Financial services experience is an asset.

Due to the volume of resumes, only those candidates being considered will be contacted.

Based in Vancouver and proudly Canadian, Ignite Technical Resources has been providing Top Technical Talent to organizations across Canada since 2005.

Ignite. Wired for people.

Follow Ignite on Twitter @ignitetechnical and become a fan on Facebook for up-to-date information about our company including job postings!

About Ignite Technical Resources.:

Founded in 2005 and headquartered in Vancouver BC, Ignite Technical Resources has been the preferred IT Staffing provider for many of Canada’s largest and well-known organizations for over 15 years.By specializing in Information Technology, we ensure that our processes are focused exclusively on providing qualified IT Professionals and our commitment to speed ensures your teams and projects are staffed quickly and efficiently. Our years of experience provide us with one of the most well-developed networks of candidates in the Canadian market. Come see why Ignite Technical is one of Canada’s premier providers of IT Professionals On-Demand.Ignite Technical Resources – Your Source for Top Talent",Ignite Technical Resources.,https://ca.indeed.com/cmp/Ignite-Technical-Resources?campaignid=mobvjcmp&from=mobviewjob&tk=1g03pb8t7r097800&fromjk=8f27fec9ab791d2e,NA,NA,Fixed term contract,Remote,NA,NA
