error,timestamp,query,companyUrl,companyName,jobTitle,jobLocation,postedAt,appliesClosedAt,jobDescription,jobId,workplaceType,jobPosterProfileUrl,jobPosterName,companyLogoUrl,applyUrl,experienceLevel,applicantsCount,viewsCount,companyStaffCount,companyDescription,jobIndustries,jobFunctions,remoteAllowed,jobState,jobType
Invalid input,2023-01-28T04:47:22.145Z,jobUrl,,,,,,,,,,,,,,,,,,,,,,,
,2023-01-28T04:47:24.215Z,https://www.linkedin.com/jobs/view/3450803300/,https://www.linkedin.com/company/bstocksolutions,B-Stock Solutions,"Data Analyst, Customer Success",Canada,2023-01-26T16:57:24.000Z,2023-02-25T16:57:24.000Z,"JOB SUMMARY
As Data Analyst, you will function as an analytics partner and a central resource to the Account Management organization. You will become an expert in B-Stock data and will provide analyses to cross-functional team members. You will also create visuals illustrating data trends and train business teams on how to use reports.We are looking for an analytics enthusiast that has a strong bias towards action, enjoys finding patterns amidst chaos, and has demonstrated success in using analytics to drive business impact.

ESSENTIAL JOB DUTIES AND RESPONSIBILITIES 
Advise business partners on user behavior patterns and relationships in the data to guide strategy.Conduct thorough analyses and provide actionable recommendations and best practices for the client(s) and/or B-Stock internal teams.Drive interpretation, socialization, and adoption of analytics insight.Provide support to improve the efficiency of our marketplaces and internal business processes.Develop and maintain reports. Be the first point of contact for any updates requested by Account Managers.Develop a deep understanding of available data and how they can be used for different analyses to answer questions and solve problems.Problem solve, synthesize, and effectively communicate findings to all levels in the organization.Own multiple concurrent projects and drive initiatives.

MINIMUM QUALIFICATIONS, JOB SKILLS, ABILITIES
2+ years of experience in a data analytics, business analytics, consulting, or other quantitative roleBachelor’s Degree in Analytics/Mathematics/Statistics/Data Science or equivalent degreeAdvanced knowledge writing and optimizing SQL queries, and working with large and complex data setsExperience with analytics tools (Python/R) and data visualization (Tableau)

EMPLOYEE BENEFITS
Competitive compensation packages including bonus and optionsMedical, dental, and vision benefitsPaid Time Off, telecommuting and flexible schedule optionsSupport for continuing educationTeam off-sites, social events and extracurricular activities are a stapleSnacks, drinks, and the occasional box of donuts

THE COMPANY
B-Stock is the world's largest B2B recommerce marketplace for excess [or surplus] merchandise. Businesses of all sizes leverage the B-Stock platform to sell and buy customer returns, overstock and other excess merchandise - ranging from top brands and retailers who want best-in-class inventory management to entrepreneurs looking to source valuable merchandise for their resale businesses.
Tens of thousands of small business owners all over the globe use B-Stock to launch and power their resale business. We take pride in empowering these innovators and entrepreneurs of commerce.
In 2020 we sold 120 million items across our platform, giving a second life to this otherwise would be “waste” merchandise. In fact, we kept 400 million pounds of goods in use and saved millions from the landfill. It feels good to be B-Stock!
The amount of returned or unsold inventory continues to grow each year, and in 2020, it was estimated at over $1 trillion worth worldwide. We know there is tremendous value in and demand for this inventory - no matter the category, condition, or location. The B-Stock platform gives buyers a simple way to buy brand-name merchandise directly from top retailers and manufacturers. At the same time, we offer companies an automated, trusted replacement for traditional liquidation while boosting operational efficiency, recovery rates, and cycle time.
Led by eBay veterans and backed by top investors including Spectrum Equity, True Ventures, and Susquehanna Growth Equity, B-Stock shows no signs of slowing down. Our core values have shaped the company we are today and will continue to drive our success for many years to come.
For more information, visit bstock.com/careers/

OUR VALUES
Make Each Dollar Count Whether it’s the recovery amount or a buyer’s budget, money matters to all of our clients. And because each dollar matters to them, it matters to us.
Take Our Work Seriously, Not OurselvesEverything at B-Stock continues to grow - everything but our egos, that is. We’re not afraid to let loose and laugh (often at ourselves).
Do The Hard Things Today That Will Pay Off TomorrowWe’re willing to sacrifice and endure, fail and adapt to reach our long-term goals. 
Use Trust As The Best Measure Of SuccessThe trust we earn along the way is more valuable than money. Without trust from both our buyers and sellers, our business won’t succeed.
Find Strength In NumbersUse our passion for data to provide value to our customers, improve ourselves, and develop new ways to delight our buyers and sellers.


No applicant will face discrimination/harassment based on race, color, ancestry, national origin, religion, age, gender, marital domestic partner status, sexual orientation, gender identity, disability status, or veteran status. Above and beyond discrimination/harassment based on “protected categories,” B-Stock also strives to prevent other, subtler forms of inappropriate behavior (e.g., stereotyping) from ever gaining a foothold in our office. Whether blatant or hidden, barriers to success have no place at B-Stock.
Work Authorization required.",3450803300,Remote,https://www.linkedin.com/in/anneslayton1234,Anna Slayton,https://media.licdn.com/dms/image/C4E0BAQGniaetWq-qjg/company-logo_400_400/0/1519912242751?e=1683158400&v=beta&t=EAPOpJt_At7BbTRuJx31LDkN6w1NlqDAA-CMy1LIp8Q,https://grnh.se/00a9dce84us?source=LinkedIn,Associate,329,1031,201,"B-Stock offers the world’s leading auction platform for returned, excess, and other liquidation inventory. We believe there is tremendous value in and demand for returned, excess, and other liquidation inventory - no matter the category, condition, or location.

By connecting this inventory directly to the right business buyers through a transparent sales platform we enable controlled transactions, fair market prices, less carbon footprint, and a faster sales cycle.

To become a part of the world’s largest network of liquidation marketplaces, please visit: www.bstock.com and sourcing.bstock.com.",Internet,Analyst,true,LISTED,Full-time
,2023-01-28T04:47:30.599Z,https://www.linkedin.com/jobs/view/3452625724/,https://www.linkedin.com/company/brexhq,Brex,"Data Scientist, Analytics (Remote)",Canada,2023-01-27T01:49:10.000Z,2023-02-26T01:49:10.000Z,"Why join us
Brex empowers the next generation of businesses with an integrated corporate card and spend management software. We make it easy for our customers to manage every aspect of spending and empower their employees to make better financial decisions from anywhere they live or work. Brex proudly serves tens of thousands of growing businesses, from early-stage startups to enterprise leaders.
Working at Brex allows you to push your limits, challenge the status quo, and collaborate with some of the brightest minds in the industry. We’re committed to building a diverse team and inclusive culture and believe your potential should only be limited by how big you can dream. We make this a reality by empowering you with the tools, resources, and support you need to grow your career.
Data at Brex
The Data organization develops infrastructure, statistical models, and products using financial data. Our Scientists and Engineers work together to make data—and insights derived from data—a core asset across the company. Our work is ingrained in Brex’s decision-making process, in the efficiency of our operations, in our risk management policies, and in the second-to-none experience we provide our consumers.
What You’ll Do
The Data Science, Analytics team builds out strategic initiatives to optimize profitability across the business, as well as improve efficiency and build out automation that touch nearly all the functions at Brex.
Responsibilities
Clean, manipulate and analyze large, complex data sets, spanning a wide variety of sources. Meet the analytical needs of teams such as operations, marketing, finance, accounting and product.Drive the direction of the company through a mix of meticulous research and creativity.Research and recommend actionable solutions to nebulous business problems based on often unclean data.Generate and maintain reports and dashboards for internal and external consumers.Alongside business stakeholders and engineers, reconcile crucial data integrity issues.Communicate analysis results with effective storytelling.Inform our other data science and data engineering teams of broader business needs.
Requirements
Experience with SQL to pull, join and explore data generated by many disparate sourcesStrong communication skills and have worked with different business functions and stakeholders outside of analyticsComfort in tackling very broad data domainsExpertise of SQL queries, A/B Testing, and statistical analysis with statistical packages, such as R or Python4+ years experience in a data science or related data analytics position",3452625724,Remote,,,https://media.licdn.com/dms/image/C560BAQEjLvdaYcyQrg/company-logo_400_400/0/1629744129780?e=1683158400&v=beta&t=UlMTsrVslMxMti20QpK3xma7nBKZKTP9c4XKE4POc_8,https://www.brex.com/careers/job?gh_jid=6588801002&gh_src=a894a5ff2,Entry level,362,1618,1265,We're empowering employees anywhere to make better financial decisions. Email us at support@brex.com for help.,Financial Services,"Engineering, Information Technology",true,LISTED,Full-time
,2023-01-28T04:47:33.555Z,https://www.linkedin.com/jobs/view/3450324708/,https://www.linkedin.com/company/silvercreek-software-ltd,SilverCreek,Data Governance Analyst,Canada,2023-01-26T02:15:17.000Z,2023-07-25T02:15:17.000Z,"Overview
This role will encompass ensuring the delivery of data management capabilities and data governance artifacts. The Data Governance Analyst will be responsible for leading data governance operations and coordinating communication with stakeholders to further the maturation of data and information assets. The project requires the ability to conduct a deep analysis of the information needs of various stakeholders across the client organization.
The successful candidate will be well-organized, self-motivated, and proficient in all areas of the software development life cycle. They shall have strong analytical, problem-solving, and decision-making skills, as well as the demonstrated ability to explain complex technological concepts to both technical and non-technical audiences. Only individuals with an extensive track record of specializing in the data governance discipline will be considered.
The Data Governance Analyst will perform a variety of functions, including:Applying concepts and best practices coupled with analyzing client needs to identify and evaluate approaches that support data governance and data management improvements.Provide leadership in the procurement and implementation of data governance related tools and technologies.Develop, document, and evolve frameworks, standards, processes, guidelines, and user guides for data governance operations.Review data governance artifacts and provide peer reviews and guidance.Lead the recruitment and onboarding processes for data stewardship roles.Develop content for data governance training materials.Develop and maintain an inventory of data governance assets.Formulate and adopt agreements with internal and external stakeholders.Facilitate cross-departmental data discussions.Ensure adherence to data quality requirements.Develop KPIs and conduct data governance maturity assessments.Assist in the identification and implementation of changes for continuous program improvement.Analyze data trends to ensure alignment with industry best practices and continuously improve data maintenance techniques to meet information needs.
Candidates with previous experience working in the financial domain are strongly preferred.
QualificationsMinimum 4 years of previous management experience with data governance and/or data managementBachelor’s degree or diploma in Computer Science, Engineering, Management Information Systems, or equivalent combination of education and experience2+ years of direct Data Governance experience8+ years of experience in the data analysis and business analysis arenas5+ years of experience in implementing tools and technologies associated with data integrationHigh-level expertise with SAS Data Management toolsProven ability to determine the maturity level of organizational data governance and data management practicesDemonstrated skill in creating data warehouse business rules based on data profilingSkilled in implementing Excel data analysis functionsIn-depth expertise with the core functions of data management (ETL processes, data quality management, data security, metadata management, data architecture management, and master data management)Functional knowledge of Business Intelligence and Data Warehousing practicesAdvanced SQL expertiseFamiliarity with Data Management Maturity Assessment methodologiesComprehensive knowledge of data modelling (including logical and dimensional modelling)Functional knowledge of privacy legislation and Personal Identifiable Information (PII) categorizationAbility to analyze complex business requirements and interpret data mapping documentationExperience working in a SharePoint library environmentAbility to take on leadership activities such as the facilitation of meetings, workshops, and interviews with various executive levels in additionProven ability in leading organizational change management activities related to data governance and data management policiesDemonstrated expertise gathering data governance and data management requirementsDemonstrated expertise creating and implementing data management strategies, data governance frameworks, and related roadmapsDemonstrated expertise developing data policies, processes, and standardsDemonstrated expertise creating and leveraging data governance measures, KPIs, and reportsExperience supporting and administering an enterprise data management programExperience implementing and supporting data quality programsExperience managing public sector projects and/or programsExperience managing complex projects within the context of an overall program
Desirable AttributesExperience in the development of training and educational materialsExperience working in the financial sectorAbility to facilitate knowledge transfer between the contracted resources and staffExperience leveraging DMBOK version 2 knowledge areasDemonstrated familiarity with data visualization tools, preferably Power BIData Governance and Data Management certifications are strong assets
About Us
Since 1998, SilverCreek has delivered our expertise in business intelligence, analytics and data integration services, developing a reputation for a higher standard of service, product delivery and client engagement. Our approach to BI and data roadmaps identifies high-value business outcomes while leveraging an agile delivery and creating value.
We align the best BI and data solutions to business needs and goals.
Coupled with an unmatched commitment, our skilled staff bring multifaceted technical expertise to meet your business challenges. As individuals and as a team, we attain the highest productivity and performance to deliver excellence.
We value long-term relationships in all spheres of business. When it comes to taking care of our energetic and highly skilled roster, we take no shortcuts. We offer a wide array of benefits that are both integral and exceptional. On top of the essential perks such as extended health care, dental insurance, and disability insurance, we are committed to providing the tools and guidance needed to increase ease of performance and elevate the individual career potential of each employee. Our complimentary equipment allowance includes a smartphone of your choice that comes with a fully paid plan, and all team members are provided with the latest Asus laptops and monitors to bolster maximum efficiency. We are strong proponents of balancing work and life while rewarding those who go the extra mile - all overtime hours are paid on top of salary.
As an organization dedicated to future innovation, SilverCreek provides an extensive training program that gives employees free access to renowned and professional online learning platforms like EdX and Pluralsight. With an annual 40 paid hours of training, you will be provided an opportunity to take your career to next level through the pursuit of further skill development.",3450324708,Remote,https://www.linkedin.com/in/ben-steem-949b591,Ben Steem,https://media.licdn.com/dms/image/C4E0BAQHELQXHoI8oBQ/company-logo_400_400/0/1578506588533?e=1683158400&v=beta&t=B4iXwzCvp-OhG3ykPSbCAX0tqD29qUgdwp1ui8UeRIE,https://www.linkedin.com/job-apply/3450324708,,215,1504,44,"Since 1998, SilverCreek has delivered our expertise in business intelligence, analytics and data integration services, developing a reputation for higher standards of service, product delivery, and client engagement. Our approach to BI and data roadmaps identifies high-value business outcomes while leveraging an agile delivery that creates value.

We align the best BI and data solutions to help organizations achieve innovative goals. 

With an unmatched commitment and body of experience, our skilled staff bring multifaceted technical expertise to address business challenges. As individuals and as a team, we attain the highest levels productivity and performance to deliver excellence.",,,true,LISTED,Full-time
,2023-01-28T04:47:37.150Z,https://www.linkedin.com/jobs/view/3451950779/,https://www.linkedin.com/company/telusinternationalaidatasolutions,TELUS International AI Data Solutions,Online Data Analyst - French Speaker,Canada,2023-01-24T09:04:10.000Z,2023-02-23T09:04:09.000Z,"TELUS International AI-Data Solutions partners with a diverse and vibrant community to help our customers enhance their AI and machine learning models. The work of our AI Community contributes to improving technology and the digital experiences of many people around the world. Our AI Community works in our proprietary AI training platform handling all data types (text, images, audio, video and geo) across 500+ languages and dialects. We offer flexible work-from-home opportunities for people with passion for languages. The jobs are part-time, and there is no fixed schedule. Whoever you are, wherever you come from, come join our global AI community. www.telusinternational.com
We are hiring freelance English and French speaking Online Data Analysts for a project aimed at improving the content and quality of digital maps, which are used by millions of users globally. The job would suit someone who is detail-oriented, likes doing research and has a good knowledge of national and local geography.  This is a freelance position on a flexible schedule - you can work in your own time whenever work is available. You will be completing research and evaluation tasks in a web-based environment, eg verifying and comparing data, determining the relevance and accuracy of information. You will be provided with guidelines for each task, which need to be followed. The project offers a variety of tasks, and work is paid per task. 
RequirementsFull Professional Proficiency in English and FrenchYou must be living in Canada for the last 2 consecutive yearsAbility to follow guidelines and do research online using search engines, online maps and website informationYou must have familiarity with current and historical business, media, sport, news, social media and cultural affairs in CanadaBeing open to work across a diverse set of Task Types (e.g. News, Audio tasks, Relevance)Applicants must be 18 years or over. 
Working on this project will require you to go through a standard recruitment process (including passing an open book assessment). This is a long-term project and your work will occasionally be subject to quality assurance checks. 
Why Join the TELUS International AI Community? Earn extra incomeAccess to our community wellbeing initiative Remote work & Location IndependenceBe your own bossFlexible Hours to fit in with your lifestyle Be a part of an online community",3451950779,Remote,https://www.linkedin.com/in/katherine-cura-38a898207,Katherine Cura,https://media.licdn.com/dms/image/C4E0BAQFbk29MG-bWYg/company-logo_400_400/0/1658243938099?e=1683158400&v=beta&t=qIb2Dg7w84Uho4Q16HajEyLf1LYIx3k10BTYmwqIa4o,https://jobs.telusinternational.com/en_US/careers/PipelineDetail/Online-Data-Analyst-Canada-French-Language/21410,Entry level,30,328,1544,"TELUS International AI Data Solutions partners with a diverse and vibrant community to help our customers enhance their AI and machine learning models. The work of our AI Community contributes to improving technology and the digital experiences of many people around the world. Our AI Community works in our proprietary AI training platform handling all data types (text, images, audio, video and geo) across 500+ languages and dialects. We offer flexible work-from-home opportunities for people with passion for languages. The jobs are part-time, and there is no fixed schedule. Whoever you are, wherever you come from, come join our global AI Community. www.telusinternational.com
",Information Technology & Services,"Information Technology, Administrative, Analyst",true,LISTED,Part-time
