error,timestamp,query,companyUrl,companyName,jobTitle,jobLocation,postedAt,appliesClosedAt,jobDescription,jobId,workplaceType,jobPosterProfileUrl,jobPosterName,companyLogoUrl,applyUrl,experienceLevel,applicantsCount,viewsCount,companyStaffCount,companyDescription,jobIndustries,jobFunctions,remoteAllowed,jobState,jobType
,2023-01-28T04:52:29.000Z,https://www.linkedin.com/jobs/view/3450201381/,https://www.linkedin.com/company/air-canada,Air Canada,Analyste principal - Données - Senior Data Analyst,"Montreal, QC",2023-01-23T15:37:18.000Z,2023-02-22T15:37:18.000Z,"L’analyste principal – Données et Analytique (responsable) devra diriger les aspects techniques des projets de données et des projets commerciaux qui ont une composante de données, et établir ainsi que documenter les normes techniques et les meilleures pratiques. Il incombera à la personne titulaire du poste de documenter, de fournir et de tenir à jour les spécifications des données et la pratique des applications après le lancement de nouveaux projets. Pour ce faire, il conviendra de respecter l’architecture, les exigences commerciales, les modèles et les normes d’Air Canada, afin de maintenir une qualité d’analyse élevée partout. La personne titulaire de ce poste mettra constamment à jour les pratiques visant à améliorer l’évolution de notre écosystème de données. 
La personne relèvera du chef de service – Données et Analytique.

PRINCIPALES FONCTIONS
• Analyser les objectifs de l’entreprise et élaborer des solutions de données pour répondre aux besoins des clients. • Déterminer la cause fondamentale des lacunes en matière d’intégrité des données et fournir des solutions appropriées en matière de résolution des données et de processus. • Élaborer des approches novatrices et efficaces pour résoudre les problèmes de l’organisation au moyen de l’analytique des données, et communiquer les résultats et les méthodologies. • Concevoir et administrer des outils de collecte de données, nettoyer, fusionner et gérer des ensembles de données existants, et établir et maintenir des procédures visant la qualité des données pour en assurer l’exactitude et l’opportunité. • Fournir le bon mappage de données pour les spécifications ETL (extraire, transformer, charger) ou divers processus d’absorption des données.• Définir et documenter les dépendances de données et les schémas de flux de données de la solution élaborée.• Entreprendre l’analyse des données et cerner les occasions stratégiques qui ont une incidence positive sur les activités.• À titre de ressource technique clé au sein de l’équipe, diriger, guider et encadrer les membres de l’équipe, selon les besoins; cela comprend aider l’équipe à améliorer le travail d’examen, d’essai et de documentation des codes, et fournir l’encadrement technique.• Travailler en étroite collaboration avec les parties prenantes concernées, afin de recueillir des renseignements et de les utiliser pour améliorer le rendement opérationnel et commercial.• Assurer une collaboration synergique et la réalisation des objectifs communs dans un sous-secteur fonctionnel.• Fournir à la gestion des renseignements sur les répercussions économiques et les problèmes de conformité qu’apporteraient des décisions opérationnelles importantes. • Soutenir activement l’élaboration et l’amélioration des processus, des priorités et des objectifs pour le secteur fonctionnel.
EXIGENCES• De six à huit ans d’expérience en TI ou en exploitation dans une grande entreprise • Diplôme universitaire ou certification technique pertinente, ou expérience pertinente et proportionnelle au poste• Certifications en technologies de mégadonnées (Hadoop), en gestion et en analytique des données, en science des données et en intelligence d’affaires• Capacité à travailler efficacement sous pression, dans un environnement en constante évolution, ou dans des conditions incertaines• Habilité à agir à titre de leader avec les développeurs – ETL, les développeurs – Intelligence d’affaires et les différentes parties prenantes• Capacité à résoudre des problèmes complexes de façon logique, systématique et séquentielle• Capacité à assumer la responsabilité des résultats et de l’orientation future de l’organisation • Capacité à analyser un problème de façon logique, systématique et séquentielle
Veuillez consulter la page carrières d'Air Canada pour connaître tous les détails du poste.
PURPOSE:The Senior Analyst, Data & Analytics, lead will be responsible for leading the technical aspects of data projects and business projects that have a data component and establishing and documenting technical standards and best practices. This role is responsible for documenting, delivering, and maintaining data specifications and practice of applications following the introduction of new projects. This is to be accomplished by adhering to Air Canada’s architecture, business requirements, templates, and standards to ensure a high-quality analysis is maintained throughout. The incumbent will constantly update the practices to enhance the evolution of our data ecosystem. 
This position will be reporting to the Manager, Data & Analytics.

KEY FUNCTIONS:
• Analyze business objectives and develop data solutions to meet customer needs • Determine root cause for data integrity gaps and provide appropriate data resolution and process remedy solutions • Develop innovative and effective approaches to solve business problems through data analytics approaches and communicate results and methodologies • Design and administer data collection tools, clean, merge and manage existing data sets as well as establish and maintain data quality procedures to ensure accuracy and timeliness of data • Provide the appropriate data mapping for the ETL specifications and/or for various data ingestion processes• Define and document data dependencies and data flow diagrams of the solution developed• Initiate data analysis and identify strategic opportunities that creates a positive impact on business• Recognized as a key technical resource in the team and will lead, guide, and mentor team members when needed, this includes helping to improve the team through code reviews, testing, documentation, and technical guidance• Work closely with relevant stakeholders to collect and use information for improved business and operational performance• Responsible for working within a sub-functional area to ensure synergistic collaboration and attain shared goals• Provide management with economic impact and compliance issues surrounding key business decisions • Responsible for actively supporting the development and enhancement of processes, priorities, and goals for a functional area
REQUIREMENTS:• 6-8 years of IT technology or operations experience in a large company • A relevant University degree/technical certification, and/or relevant experience commensurate to the role• Certifications in Big Data Hadoop, Data Management and Analytics, Data Science, Business Intelligence• Ability to work effectively under pressure and in rapidly changing environments or uncertain conditions• Ability to act as a leader facing the ETL developers, the BI developers, and the different stakeholders• Capable of solving complex problems by using a logical, systematic, and sequential approach• Takes responsibility for the results and future direction of the organization. • Able to approach a problem by using a logical, systematic, sequential approach
Please refer to the Air Canada Careers page for full job details.",3450201381,Hybrid,,,https://media.licdn.com/dms/image/C560BAQFWMhSisz6qkQ/company-logo_400_400/0/1657045252885?e=1683158400&v=beta&t=38eAtixsn9-FiqS1eMB-nMww00yyUwNRIR8hc_VYD9M,https://carrieres.aircanada.com/jobs/11856258-analyste-principal-donnees,Associate,53,542,18360,"Canada's largest airline, the country’s flag carrier and a founding member of Star Alliance, the world's most comprehensive air transportation network celebrating its 25thanniversary in 2022, Air Canada provides scheduled passenger service directly to 51 airports in Canada, 51 in the United States and 86 internationally. It is the only international network carrier in North America to receive a Four-Star ranking from Skytrax, which in 2021 gave Air Canada awards for the Best Airline Staff in North America, Best Airline Staff in Canada, Best Business Class Lounge in North America, and an excellence award for its management of the COVID-19 pandemic. 

**

Air Canada est la plus importante société aérienne du Canada, le transporteur national du pays et un membre cofondateur du réseau Star Alliance — le plus vaste regroupement mondial de sociétés aériennes, qui célèbre son 25e anniversaire en 2022. Les lignes passagers régulières d’Air Canada relient sans escale 51 aéroports au Canada, 51 aux États-Unis et 86 sur le reste du globe. En Amérique du Nord, Air Canada constitue le seul transporteur aérien d’envergure internationale offrant une gamme complète de services à détenir la cote quatre étoiles de Skytrax qui, en 2021, lui a décerné les prix Meilleur personnel au sol et à bord en Amérique du Nord, Meilleur personnel au sol et à bord au Canada, Meilleur salon de classe affaires en Amérique du Nord ainsi qu’un Prix d’excellence pour sa gestion de la pandémie de la COVID-19.",Airlines/Aviation,Management,false,LISTED,Full-time
,2023-01-28T04:52:35.374Z,https://www.linkedin.com/jobs/view/3455486967/,https://www.linkedin.com/company/beachhead-inc,BeachHead,Business Data Analyst  – (SQL/ SSIS/ SSAS),"Toronto, ON",2023-01-26T18:34:52.000Z,2023-02-25T18:34:52.000Z,"Working with one of the top financial clients this role calls for a Business Data Analyst – (SQL/ SSIS/ SSAS) who will be responsible for performing Data Analysis, Verification, and Data Mapping. This candidate will produce technical documents of ‘where data originates’. The ideal candidate is a recent grad with about 2 years of experience or Coop experience working with a tier-1 bank.Desired Skill Set:2 years of experience with SQL Data2 years of expertise in Data MappingStrong understanding of Queries, Look Ups and the ability to perform joinsAbility to generate new tables in SQLNice To Have:Hands-on experience with SSAS or SSISExperience working in the Banking industry with a preference of Tier-1Exposure to data analysis projectBeachHead is an equal opportunity agency and employer. We advocate for you and welcome anyone regardless of race, color, religion, national origin, sex, physical or mental disability, or age.",3455486967,Hybrid,,,https://media.licdn.com/dms/image/C560BAQGIaJlvRkk8bg/company-logo_400_400/0/1657016454732?e=1683158400&v=beta&t=xjRIEjZYGnVGJpFiKlnxnaHLLGhwc1yXywzF6uTeDOw,https://www.linkedin.com/job-apply/3455486967,Associate,294,636,35,"BeachHead is a premier and specialized consultancy and staffing firm focused on the Canadian Finance marketplace. We specialize in providing the highest quality of service for both our clients and professional Financial Candidates. Our unique business model supports a direct relationship with senior hiring business executives and stakeholders.

The BeachHead system is designed to capture intimate knowledge of both the client opportunity and qualified candidates, ensuring that each client/candidate is properly and competitively positioned in the marketplace.","Banking, Information Technology & Services, Financial Services","Information Technology, Finance",false,LISTED,Contract
,2023-01-28T04:52:42.201Z,https://www.linkedin.com/jobs/view/3367191811/,https://www.linkedin.com/company/moneymart,Money Mart Financial Services,Data Analyst - Collections and Delinquency,"Toronto, ON",2023-01-21T12:39:34.000Z,2023-03-18T20:58:48.000Z,"Company Description
Momentum Financial Services Group, formerly Money Mart Financial Services is a leading provider of financial services in North America. For 40 years we've been committed to providing financial solutions that meet the evolving needs of consumers and business owners. Backed by a retail network of over 450 locations and robust digital and mobile platforms, we provide access to cash and related products to help our customers achieve their goals. We operate retail locations in local communities and cities across Canada under the Money Mart® brand and in Quebec as Insta Cheques® and in United States as Money Mart® and The Check Cashing Store®.
Our highly skilled workforce puts customers first in everything we do. We serve millions of people annually with diverse and innovative financial products and services. Through this ever-evolving suite of services, we empower customers to manage their finances and improve their lives. Wherever customers are on their financial journey, Momentum Financial Services Group provides solutions.
We believe in giving back to the communities where we live and work. With the generous support of our customers and staff, we proudly contribute over two hundred & fifty thousand dollars annually to charities and non-profit organizations, along with using our time and talent to serve in local communities throughout Canada and the United States. We are looking for aspiring, passionate people who are dedicated to understanding and providing our customers with the right financial solutions utilizing a growing menu of products and services. We embrace diversity and offer a fast-paced work environment.
Job Description
GENERAL FUNCTION 
The Collections Analytics team is looking for a business analyst to perform analysis and reporting related to the company’s overdue payment collections efforts and strategies. This person will perform analysis, develop reporting, and identify/recommend collection strategy enhancements.
Duties/Responsibilities
Analyze delinquency and loss trends through ad hoc analyses (using SQL and other relational database tools) and reporting (using reporting/visualization tools such as Tableau and/or Excel).Work with functional partners to deploy tests, collect data, analyze results, and make strategic recommendations related to the company’s collections efforts and programs.Establish and maintain effective collections performance tracking ensuring that strategies are performing as expected and provide recommendations of changes in a timely manner.Present findings and recommendations to business partners and senior management.Analyze collections-related factors such as concentrations, product mix, delinquency, loss trending, and process optimization.Create segmentations to differentiate customer behavior and collectability, as well as optimize treatment, timing, and message.Identify key risk drivers, analytically segment the customer portfolio along these factors, and assess concentrations, exposures, and exception levels.Work with central modeling teams to build new scorecards and validate existing scoring models as they pertain to use in collection strategies.Work with internal and external partners to develop and evolve digital methods for collections and debt recovery operations.
Qualifications
EDUCATION 
Required: A Master’s degree or higher in a quantitative field such as Data Science, Decision Science, Business Analytics, Mathematics, Statistics, Computer Science, Engineering, Finance, or Economics.
Experience
Required: At least 5 years of experience using analytics tools/applications, including SQL. (Additionally, experience with R, Python, and/or Tableau is preferred, but not required.)Required: At least 2 years of experience solving business problems with data/analytics within an analytics-related functional area, such as marketing analytics or credit risk analytics.Preferred (but not required): Experience within collection analytics and/or credit/risk functions of a financial services company.
Skills
We’re looking for someone who is highly skilled at the following:Performing data analysis using a range of languages, such as SQL, SAS, R, and Python.Giving meaning, insight, and purpose to information driving key business decisions.Explaining complex information to both technical and non-technical audiences.Approaching ambiguous business problems with sound business judgment and creativity.Effectively managing and prioritizing projects and tasks, from multiple stakeholder groups, across project lifecycle stages (ideation, planning, execution, and go-to-market).
Benefits
Additional Information
Medical / Dental/ Vision benefits available Company paid life insurancePaid holidaysPTO / 401K / Tuition ReimbursementAll your information will be kept confidential according to EEO guidelines.
We invest in our employees, and offer extensive training, and development programs to set you up for future success. If we sound like a fit and you’re ready to start an exciting career with an organization that encourages employee growth, apply today! We look for bright, energetic, motivated individuals who are interested in learning and developing their career.",3367191811,Remote,,,https://media.licdn.com/dms/image/C4D0BAQE1CtV-m_HAuw/company-logo_400_400/0/1644554450306?e=1683158400&v=beta&t=9i31CwzEFTGQym1L3ZR0cLuGUYn_cv4U876p-9lhj-A,https://jobs.smartrecruiters.com/MomentumFinancialServicesGroup/743999866158581-data-analyst-collections-and-delinquency?trid=2d92f286-613b-4daf-9dfa-6340ffbecf73,Associate,353,2048,1266,"Momentum Financial Services Group, formally Money Mart Financial Services, has been providing financial solutions to underbanked consumers for over four decades. 
From the time we opened our doors until now, our main priority and primary duty has stayed the same - to empower customers to manage their finances and reach their financial goals. We have enlisted the help of smart, savvy, driven and personable people to help us achieve that goal, and we hold ourselves to the highest standards of customer service. 
For nearly 40 years, Momentum Financial Services Group, formally Money Mart Financial Services, has been committed to providing financial solutions that meet the evolving needs of consumers and business owners in our communities. Backed by a retail network and robust digital and mobile platforms, we serve 2 million people annually with diverse and innovative financial products such as loans, check cashing, money transfer and prepaid cards. Wherever customers may be on their financial journey, we have a suite of products and offerings that serve their needs. 
Today we are a team of more than 2,000 people serving customers in communities across Canada and the United States. Our employees’ personal and professional goals are important to us and we invest in learning and development to help our people thrive. We offer amazing training programs, competitive benefit packages, great personal incentives and lots of other cool perks. Visit our Money Mart USA, Money Mart Canada, InstaCheques and The Check Cashing Store pages to know more about our brands, products and other offerings.
Are you ready for a challenging and rewarding career in financial services? See current opportunities under our Jobs tab, or visit http://mfsg.com/careers to apply today!
Money Mart Canada: www.moneymart.ca
Money Mart USA: www.moneymart.com
InstaCheques: www.instacheques.ca
The Check Cashing Store: www.thechequecashingstore.com
",Financial Services,Finance,true,LISTED,Full-time
