error,timestamp,query,companyUrl,companyName,jobTitle,jobLocation,postedAt,appliesClosedAt,jobDescription,jobId,workplaceType,jobPosterProfileUrl,jobPosterName,companyLogoUrl,applyUrl,experienceLevel,applicantsCount,viewsCount,companyStaffCount,companyDescription,jobIndustries,jobFunctions,remoteAllowed,jobState,jobType
,2023-01-28T04:49:20.452Z,https://www.linkedin.com/jobs/view/3424553367/,https://www.linkedin.com/company/kruger-inc-,Kruger Inc.,Analyste de données,"Montreal, QC",2023-01-25T13:36:03.000Z,2023-03-04T16:14:57.000Z,"À PROPOS DE   KRUGER 
Chez Kruger, nous voyons l’excellence en toi. Nous savons que de grandes choses se produisent lorsque des personnes partageant la même vision travaillent ensemble avec passion pour rendre la vie quotidienne plus confortable pour nos consommateurs. Fabriquer des produits essentiels de manière éco-responsable qui suscitent la confiance et l’amour des Nord-Américains est ce qui nous motive et ce que nous faisons de mieux. C’est l’une des nombreuses raisons pour lesquelles nous sommes reconnus comme l’un des meilleurs lieux de travail au Canada.
 POSITION SOMMAIRE Vous cherchez un stage motivant
Dans un environnement stimulant qui utilisent les concepts et technologies vertes du futur?
Axé sur l’autonomie, la polyvalence, la flexibilité, le travail d’équipe et la collaboration ?
Où tu auras la chance d’apprendre, de partager et d’exceller?
Si oui, nous sommes à la recherche d’une personne comme toi afin de compléter notre dynamique équipe d’Électrification des Transports chez Kruger Énergie. Kruger s’est engagé à verdir ses opérations, notamment à travers ses besoins en transport et logistique. Pour arriver à ses objectifs, il est nécessaire de passer par l’adoption d’une mobilité plus durable. C’est pourquoi Kruger Énergie déploie des camions semi-remorques 100% électriques.
Afin d’accélérer cette transition, il est nécessaire de collecter, d’ordonner et d’analyser les données transmises par les différentes unités d’affaires pour identifier les prochains déploiements. Parallèlement, il s’agit de faire l’analyse des données générées par les véhicules et bornes de recharge en opérations pour en extraire des paramètres de performances.
Avec ton background en analyse de données, tu participeras au déploiement de camions 100% électriques sur les routes Kruger en Amérique du Nord. Es-tu prêt(e) à relever ce défi?!
 RESPONSABILITÉS 
 Collecter et compiler les données sur les opérations de transports auprès des unités d’affaires Kruger. Travailler avec des collègues et des experts pour implémenter des paramètres clés de performances des technologies déployées. Analyser les données générées par les camions et les bornes pour obtenir des indicateurs de performance. Analyser les variables qui influence la performance. (ex: Analyse de régression linéaire). Développer du code ou des scripts et intégrer ceux-ci aux outils et plateformes. S’assurer de valider leur fonctionnement et de documenter l’outil et la méthodologie pour faciliter leur utilisation.
Qualifications
Diplôme universitaire en génie informatique ou logiciel (en cours), industriel, informatique ou expérience équivalente
 EXPÉRIENCE  Expérience avec divers langages de programmation
 requis : Python, SQL/No-SQL, PowerBi (ou autre outil de visualisation), Sharepoint, Jupyter Notebook 
 APTITUDES 
 Curieux, débrouillard et autonome  Flexible et s’adapte à l’ambiguïté  Analyse de régression, Analyse statistique  Être en mesure de présenter des résultats  Très bonne communication 
 LANGUE 
 Français et anglais, parlé et écrit.",3424553367,On-site,,,https://media.licdn.com/dms/image/C510BAQG20u0jlyW6xQ/company-logo_400_400/0/1519874512178?e=1683158400&v=beta&t=2kcPxCVHJWyEAaUsO_rdYYB0F1lRhcuVy9YINmdhyjU,https://tre.tbe.taleo.net/tre01/ats/careers/v2/viewRequisition?org=KRUGER2&cws=76&rid=1680,Entry level,115,610,1265,"A forward-looking and progressive company since its very foundation over a century ago, the Kruger organization is constantly evolving and looking for the best talent for its establishments located across Canada and the US. 

In addition to its traditional industry sectors where the Company built a solid reputation worldwide, namely pulp and paper, paperboard and packaging, Kruger Inc. is now active in such diverse sectors as green energy, tissue products, recycling and biomaterials. 

We put sustainable development and the responsible use of resources at the core of our success and several of our establishments and practices are certified under the strictest industry standards.",Paper & Forest Products,Information Technology,false,LISTED,Full-time
,2023-01-28T04:49:27.223Z,https://www.linkedin.com/jobs/view/3304963136/,https://www.linkedin.com/company/societe-generale,Societe Generale,Quantitative Advisor (Analyst),"Greater Montreal, QC",2023-01-21T13:44:54.000Z,2023-04-04T17:31:11.000Z,"Job Reference ID:
22000LDP
Responsibilities
Quantitative Model Validation Analyst in the Model Risk Management structure embedded within the Risk Management function in 2nd Line-of-Defense of SG Americas will:
Conduct independent model validation of relevant models that are used in SG Americas;Perform independent conceptual and theoretical review, benchmarking, independent implementation of the models employed;Quantifying model risk and reporting of the findings;Close interaction and collaboration with the model developers in the First Line-of-Defense;Work with front office, model developers and risk managers with day-to-day model support and review;Contribute to a body of knowledge of local and global regulatory requirements for model risk and be aware of market environment.
Profile Required
Minimum of a Bachelors Degree in a quantitative area in Science, Technology, Engineering and/or Mathematics,3+ years of experience in Financial Model Development or Validation or Front Office Quant role or a Master Degree in a relevant subjectExperience of building or working with financial modeling Excellent mathematical and statistical ability to solve financial problems that require a quantitative approachExcellent coding skills in a computer/statistical programming language (e.g. Python, R, C++...)Good communication skills with the ability to work with front office, model developers and other internal risk management non-quant staffIndependently performs advanced quantitative analyses to drive decision-making by running independent quantitative review-and-challenge strategies; makes recommendations based on analysesAnalyzes new model frameworks, monitors and reviews existing models. Conducts on-going communication with model owners and model developers during the course of the review. Works with large, complex datasets to create challenger modelsPerforms quantitative analysis and develops complex reports. Performs qualitative and quantitative assessments of all aspects of models including theoretical aspects, model design and implementation as well as data quality and integrity. Analyzes complex data and associated quantitative analysis. Makes recommendations based on findings from data analyticsUses quantitative tools and techniques to measure and analyze model risks and reaches conclusions on strengths and limitations of the modelPrepares and analyzes detailed documents for validation and regulatory compliance, using applicable templatesKnowledge of techniques, roles, and responsibilities in providing technical or business guidance to clients, both internal and external; ability to apply this knowledge appropriately to diverse situationsUnderstanding of effective communication concepts, tools and techniques; ability to effectively transmit, receive, and accurately interpret ideas, information, and needs through the application of appropriate communication behaviorsKnowledge of and ability to plan, implement and manage model testing strategies that assure the independent review and challenge of models
 Business insight
Quantitative Model Validation Analyst (Credit Risk and Compliance models)
We are an equal opportunities employer and we are proud to make diversity a strength for our company. Societe Generale is committed to recognizing and promoting all talents, regardless of their beliefs, age, disability, parental status, ethnic origin, nationality, gender identity, sexual orientation, membership of a political, religious, trade union or minority organisation, or any other characteristic that could be subject to discrimination.",3304963136,Hybrid,,,https://media.licdn.com/dms/image/C4E0BAQEGbq0lpQiZXA/company-logo_400_400/0/1625071140848?e=1683158400&v=beta&t=K6UljJcH9uI-us4kbZ5YzFfYuLDxPL8Xo8rJ5pH5YIQ,https://careers.societegenerale.com/en/job-offers/quantitative-advisor-analyst-22000LDP-en?src=JB-14381,Entry level,34,378,44584,"Societe Generale is one of the leading European financial services groups. Based on a diversified and integrated banking model, the Group combines financial strength and proven expertise in innovation with a strategy of sustainable growth. Committed to the positive transformations of the world’s societies and economies, Societe Generale and its teams seek to build, day after day, together with its clients, a better and sustainable future through responsible and innovative financial solutions.

Active in the real economy for over 150 years, with a solid position in Europe and connected to the rest of the world, Societe Generale has over 117,000 members of staff in 66 countries and supports on a daily basis 25 million individual clients, businesses and institutional investors around the world by offering a wide range of advisory services and tailored financial solutions. The Group is built on three complementary core businesses:

- French Retail Banking which encompasses the Societe Generale, Credit du Nord and Boursorama brands. Each offers a full range of financial services with omnichannel products at the cutting edge of digital innovation;

- International Retail Banking, Insurance and Financial Services, with networks in Africa, Central and Eastern Europe and specialised businesses that are leaders in their markets; 

- Global Banking and Investor Solutions, which offers recognised expertise, key international locations and integrated solutions.

Societe Generale is included in the principal socially responsible investment indices: DJSI (Europe), FTSE4Good (Global and Europe), Bloomberg Gender-Equality Index, Refinitiv Diversity and Inclusion Index, Euronext Vigeo (Europe and Eurozone), STOXX Global ESG Leaders indexes, and the MSCI Low Carbon Leaders Index (World and Europe). 
","Financial Services, Investment Banking",Other,false,LISTED,Full-time
,2023-01-28T04:49:30.121Z,https://www.linkedin.com/jobs/view/3455269436/,https://www.linkedin.com/company/maplesgroup,Maples Group,Client Billing & Data Analyst / Analyste de la facturation des clients et des données – Services aux entités mondiales,"Montreal, QC",2023-01-26T16:07:39.000Z,2023-02-25T16:07:39.000Z,"Position: Client Billing and Data Analyst – Global Entity ServicesLocation: Montreal, Canada 
The Maples Group looks to add to add a Montreal, Canada-based Client Billing and Data Analyst to our team and invites eager and qualified candidates to apply. Recognised as one of Montreal's top employers, we are committed to diversity, inclusion and equality of opportunity as we attract, retain and develop world-class talent. 
Who We SeekOur merit-based culture suits professionals in pursuit of boundless careers and lives. Beyond their acumen, team members are collaborative and conscientious, bringing a healthy sense of drive and purpose to each interaction and to all aspects of their work. 
About the RoleThe ideal candidate, working with both local and global teams, will contribute directly to delivering first class service to our clients who are leading international private equity groups. Primary responsibilities include: 
Ensuring data is maintained accurately, and in accordance with service agreements and protocols, through analysis using various tools to look for exceptions and issues; Managing the billing and revenue data for the various client portfolios, and liaising with clients on the same 
What You BringIn addition to indisputably high ethical standards and autonomy, the ideal candidate possesses the following: 
The aptitude and commitment to continue to learn various IT platforms and additional software skills is essential.This role is ideal for an organized, detail-oriented individual with well-developed critical thinking skills and possesses the ability to manage multiple tasks in a fast-paced environment;The ideal candidate will have an innate desire to consistently strive for excellence, take pride in carrying out their responsibilities efficiently and with impeccable execution, and proactively looks for opportunities to recommend improvements to systems and processes;The individual must also be a self-starter who works well within a team, is energized by a continuous learning environment and possesses an ability to work well under the pressure of deadlines;This role is suited for an individual with a College Diploma or equivalent, preferably with a business or legal concentration, and 1-2 years’ of experience in a professional services environment;Strong written and verbal skills are required;Working knowledge of Microsoft Excel, Word and Outlook is preferred;The aptitude and commitment to continue to learn various IT platforms and additional software skills is essential;Fluency in English is required. 
Poste : Analyste de la facturation des clients et des données – Services aux entités mondialesEmplacement : Montréal, Canada 
Le Groupe Maples cherche à ajouter un analyste de la facturation des clients et des données à son équipe à Montréal, au Canada, et invite les candidats enthousiastes et qualifiés à poser leur candidature. Reconnus comme faisant partie des meilleurs employeurs de Montréal, nous nous engageons à favoriser la diversité, l’inclusion et l’égalité des chances en attirant, en maintenant en poste et en perfectionnant des talents de classe mondiale. 
Candidats recherchésNotre culture axée sur le mérite convient aux professionnels en quête d’une carrière et d’une vie sans limites. En plus de leur expertise, les membres de l’équipe sont coopératifs et consciencieux. Ils possèdent une grande motivation et se fixent des buts à atteindre, ce qui se reflète dans chacune de leurs interactions et dans tous les aspects de leur travail. 
À propos du posteLe candidat idéal, travaillant avec des équipes locales et mondiales; contribuera directement à la prestation de services de première classe à nos clients qui dirigent des groupes internationaux de fonds de capital-investissement. Les principales responsabilités du candidat retenu seront les suivantes : 
Veiller à ce que les données soient conservées avec précision et conformément aux ententes de service et aux protocoles, par l’entremise d’analyses utilisant divers outils pour rechercher les exceptions et les problèmes; Gérer les données relatives à la facturation et aux revenus pour les différents portefeuilles de clients, et assurer la liaison avec les clients à ce sujet. 
Votre contributionEn plus d’une autonomie et de normes en matière d’éthique incontestablement élevées, le candidat idéal possédera ce qui suit : 
L’aptitude et l’engagement de continuer à apprendre diverses plateformes en TI et à acquérir des compétences relativement à d’autres logiciels sont essentiels;Ce poste convient parfaitement à une personne ayant le sens de l’organisation, le souci du détail et une pensée critique bien développée, ainsi que la capacité de gérer plusieurs tâches dans un environnement évoluant rapidement;Le candidat idéal a un désir inné de viser l’excellence de façon constante; il est fier d’assumer ses responsabilités de façon efficace et de les accomplir de façon impeccable. Il cherche activement des occasions de recommander des améliorations aux systèmes et aux processus;Cette personne doit avoir un grand sens de l’initiative et savoir s’intégrer à une équipe; elle est stimulée par un environnement où l’apprentissage fait partie du quotidien et elle peut continuer de bien travailler sous la pression des échéances;Ce poste convient à une personne possédant un diplôme d’études collégiales ou l’équivalent, préférablement avec une concentration en commerce ou en affaires juridiques, ainsi qu’une année ou deux d’expérience dans un environnement de services professionnels;De solides compétences sont requises en communication écrite et verbale;Une connaissance pratique des applications Excel, Word et Outlook de Microsoft est préférable;L’aptitude et l’engagement de continuer à apprendre diverses plateformes en TI et à acquérir des compétences relativement à d’autres logiciels sont essentiels;La maîtrise de l’anglais est requise.",3455269436,Hybrid,https://www.linkedin.com/in/aliz%C3%A9e-leizerovici-902a36163,Alizée Leizerovici,https://media.licdn.com/dms/image/C560BAQExvjCZ3Eb9gg/company-logo_400_400/0/1632334856016?e=1683158400&v=beta&t=f2GzOMIzKJPouIR7RQ-MJP2fXahLE4iVPF4kZwJfHJo,https://app.jobvite.com/j?aj=omwLlfwI&s=LinkedIn&__jvst=Job+Board&__jvsd=LinkedIn,Associate,15,99,2280,"The Maples Group is a leading service provider offering clients a comprehensive range of legal services on the laws of the British Virgin Islands, the Cayman Islands, Ireland, Jersey and Luxembourg, and is an independent provider of fiduciary, fund services, regulatory and compliance, and entity formation and management services.  The Maples Group distinguishes itself with a client-focused approach, providing solutions tailored to their specific needs.  Its global network of lawyers and industry professionals are strategically located in the Americas, Europe, Asia and the Middle East to ensure that clients gain immediate access to expert advice and bespoke support, within convenient time zones.",Financial Services,Finance,false,LISTED,Full-time
,2023-01-28T04:49:36.522Z,https://www.linkedin.com/jobs/view/3447516984/,https://www.linkedin.com/company/publicis-worldwide,Publicis Worldwide,"CRM Data Analyst (6 months contract, Flexible Locations)","Windsor, ON",2023-01-23T22:49:50.000Z,2023-02-22T22:49:49.000Z,"The CRM Data Analyst is an active member of the Publicis Data & Insights Team. The CRM Data Analyst will be responsible for aggregating, analyzing and providing insights that help monitor, optimize and deliver data driven recommendations to our clients on a regular (weekly, monthly, and quarterly) and ad-hoc basis. This candidate must strive to ensure that the data used in the analytics process is accurate and robust. Candidates must also think strategically to identify issues that need to be optimized or resolved. The CRM Data Analyst will always work proactively to prioritize resources in order to deliver on the tasks.

As CRM Analyst, you will:

Contribute to analytics projects of varying sizes and complexity, including report automation, data visualization, tool implementation requirements gathering and documentation, split testing, and ad hoc analysisCreate and/or maintain dashboards within Qliksense, Data StudioContribute and complete to regular reporting, scorecards, and dashboards (weekly, monthly, quarterly and ad-hoc requests)Create complex data models using Qliksense to meet client ad hoc requestsDrive industry leading insights and recommendation on email, SMS, push campaignsAssist with efforts to optimize the client’s CRM business.

Qualifications

You are an ideal candidate for this role if you:

Think strategically in everything you doAre intrinsically-driven and celebrate every successEnjoy a variety of workAre a logical thinker with creative problem-solving skillsSet high quality standards for yourself and aim to get every detail rightDo what it takes to deliver on your commitmentsEnjoy working in a fast-paced, challenging, and rewarding environmentWelcome and volunteer constructive feedbackAre able to work within both traditional and agile methodologies/processesThrive in a collaborative work environment that has an “open door” policy since we literally have no doors in our office.Are able to maintain constant and effective communication within multidisciplinary project teamsBelieve in continuous learning and improvementDesired Skills & Experience

Experience in CRM analytics, ideally within an agency settingExperience in writing industry leading insights based on marketing campaign resultsExperience with SQL and structured datasetsExperience with Braze and/or SFMCExperience with structured datasets using SQL, or PythonKnowledge A/B or multivariate testing and analysis for CRM campaignsA big plus if you have had experience with Qliksense or similar data visualization tools.

Additional Information

Publicis Canada is committed to building a diverse workforce representative of our community. We encourage and are pleased to consider all qualified candidates, without regard to race, colour, citizenship, religion, sex, marital / family status, sexual orientation, gender identity, aboriginal status, age, disability or persons who may require an accommodation, to apply. If you require a specific accommodation please contact Human Resource

",3447516984,On-site,,,https://media.licdn.com/dms/image/C510BAQFLk3tl_TDtkg/company-logo_400_400/0/1519925032146?e=1683158400&v=beta&t=rizf62jvhy5_eNFsiyqe6TmeT8GegzcobeBy0M9ap4M,https://jobs.smartrecruiters.com/PublicisGroupe/743999880361112-crm-data-analyst-6-months-contract-flexible-locations-?source=Linkedin,Entry level,22,94,88,"Publicis Worldwide is a global creative network enabling our clients to Lead The Change in their marketing and business transformation. In a world of accelerated change in which new technologies emerge every day, Publicis Worldwide provides strategic creative ideas leveraged by data and technology to help clients succeed in their marketing transformation. With over 16,000 employees in 110 countries, clients include AXA, Carrefour, Cartier, Citi, Diesel, Heineken, L'Oréal, Nestlé, Orange, Procter & Gamble, Renault, Sanofi, UBS, and Walmart. In 2021, Publicis Worldwide was ranked by Cannes Lions as the 4th most creative network. 

Publicis Worldwide is the creative agency network solution hub within Publicis Groupe.

Twitter: @PublicisWW 
Facebook: www.facebook.com/Publicis-Worldwide
Instagram: @publicis_ww",Marketing & Advertising,Analyst,false,LISTED,Full-time
