Title,Location,Extract_date,Link,Desc,Company,CompanyLink
HR Data Analyst,"Emera Inc.38 reviewsHalifax, NS",2022-04-06,https://ca.indeed.com/rc/clk?jk=a6aea85b04f4c894&fccid=2282f20565edc684&vjs=3,"Reference Number: 9751
Job Title: HR Data Analyst
Business Unit: Emera Corporate Human Resources (HR)
Location: Halifax, NS
Type of Employment: Regular, Full Time
Anticipated Start Date: As soon as possible

The opportunity:

We are currently looking for a HR Data Analyst to join our Corporate HR team on a permanent basis. Reporting to the Manager, HR Process & Analytics, the HR Data Analyst will be responsible for collaborating with HR and Business team members across Emera’s international affiliated businesses to develop reporting and provide analytics expertise in support of our talent and business strategy. The HR Data Analyst serves as a cross-functional subject matter expert to the Corporate HR group, continuously assessing our data for insights, innovation of processes, and industry trends. In this exciting new role, you will be encouraged to innovate, modernize, and act as a thoughtful leader.

Accountabilities:
More specifically, in this role you will:

Support and assist in developing a data strategy for the business;

Serve as a subject matter expert in HR Data and Analytics, Technology, and related processes;

Manage the delivery of analytics and insights by compiling and analyzing large sets of workforce data (e.g. headcount, recruitment, development, turnover, hires, promotions, diversity, exit interviews, workforce demographic, engagement);

Understand our business processes and translate them into measurable data or reporting requirements including content, frequency, and data source;

Review reporting processes and its results to ensure value and customer satisfaction;
Continuously seek opportunities to innovate and improve while creating efficiencies;

Provide input into the design of new systems and applications, participate in testing and support deployment to our end users.

Skills, Competencies and Experience:

As the ideal candidate you recognize yourself in most of the following competencies, and possess or are working towards the desired skills and experience listed below:

A Bachelor’s Degree in a Data Science-related field: preferably with a quantitative focus, such as Engineering, Statistics, Applied Mathematics, Economics, or Computer Science or equivalent experience;

Proven analytical skills through education or 5+ years’ experience in a data analytics/information management field;

Previous experience working in a Human Resources environment and HRIS systems (e.g. Peoplesoft) would be beneficial;

Strong proficiency in MS Excel including experience with advanced formulas, Excel VBA/macros, Python, SQL;
Previous experience with BI and data visualization tools such as Tableau, including Tableau Prep Builder and Tableau Server, considered an asset;
A self-motivated individual who brings strong quantitative skills and high attention to detail;

Strong communication skills and demonstrated ability to present to a diverse group in a compelling and influential manner;

Superior decision making and problem-solving skills with the ability to develop, recommend and implement innovative solutions;

A strong collaborator and team player who excels at facilitating outcomes with the needs of various stakeholders in mind while effectively prioritizing and managing multiple priorities in a fast-paced dynamic environment while meeting deadlines;

Proven ability to manage sensitive and confidential data;

Other combinations of related education and experience may be considered.

We will assess the above qualifications using one of more of the following tools: written examination, standardized tests, oral presentations, interview(s), and reference checks.

Why join Emera?

Emera is one of Atlantic Canada’s largest publicly traded companies, and a North American Top 20 utility. Our ability to serve more customers in more places is thanks to the commitment of our 7,100 employees in Canada, the USA, and the Caribbean. As we develop, we are excited to welcome new team members who are committed to our purpose and our approach to business. Emera values people who believe that safety and health, relationships, and excellence are integral to how we work. In return, we value the diversity of our people and invest in their growth through:

competitive compensation packages: including a comprehensive pension and benefits plan and employee-sponsored saving plans;

opportunities for career growth: including a strategic focus on employee development plans, opportunities to advance within and between our affiliate companies, sponsored education programs;

giving back to communities: including corporate investments in the places where our people live and work; employee dollars-for-doers and fundraising-matching programs, scholarships for children of employees.

At Emera our employees are our greatest strength. Our Leadership Competencies set standards that advance our business strategy, deliver results for customers, and provide career development for employees. As the ideal candidate, you are a strong leader who works to advance a safety culture by placing safety, health, and wellness above any business objective. You understand the importance of strong inclusive teams and develop employees to take on challenges and opportunities. As the HR Data Analyst, you encourage innovation, lead change to ensure continuous improvement demonstrating integrity, and set clear expectations for a high standard of work performance for yourself and the Corporate HR team. Lastly as the successful candidate it is your responsibility to connect every decision to the company strategy and apply sound judgment to translate new ideas into actions.

Reports to: Manager, HR Process & Analytics

Application Requirement: To apply, please click on the blue ‘APPLY NOW’ button in this job posting, complete all required information fields, and attach your cover letter and resume into one single file to the online form.

Salary: Commensurate with qualifications and experience.

Application Deadline: We encourage you to apply at your earliest opportunity but no later than Wednesday April 20, 2022. Late applications may not receive consideration.

Recruitment and Promotion Policy: When filling vacant positions, we are determined to hire the best candidates available. We are committed to providing employees with a fair and equal opportunity to compete for jobs. Hiring and promotion of employees is based on skills, capabilities, knowledge and demonstrated abilities.

In accordance with Emera’s occupational health and safety program and the Emera Vaccine Program, subject to any approved accommodation, all employees are required to be fully vaccinated against COVID-19. For clarity, “fully vaccinated” means having the number of doses or combination of doses of a vaccine approved by Health Canada or local public health agencies in the jurisdiction in which they will be employed.

At Emera we value diversity, equity, and inclusion. We strongly encourage applications from all qualified candidates, including persons who identify as racially visible, Indigenous, persons with disabilities, women in underrepresented roles and members of the LGBTQ+ community. Applicants from these equity groups may self-identify through the on-line application process. Emera supports candidates and employees with access and accommodation needs.",Emera Inc.,https://ca.indeed.com/cmp/Emera-Inc.?campaignid=mobvjcmp&from=mobviewjob&tk=1g00g7f1hpkkr800&fromjk=a6aea85b04f4c894
Data Analyst,"[<div class=""companyLocation"">Remote in Vancouver, BC</div>, <div class=""companyLocation"">Montréal, QC</div>, <div class=""companyLocation"">Hybrid remote in Toronto, ON</div>, <div class=""companyLocation"">Waterloo, ON</div>, <div class=""companyLocation"">Markham, ON</div>, <div class=""companyLocation"">Toronto, ON</div>, <div class=""companyLocation"">Charlottetown, PE</div>, <div class=""companyLocation"">Temporarily Remote in Kingston, ON</div>, <div class=""companyLocation"">Hybrid remote in North Vancouver, BC</div>, <div class=""companyLocation"">Toronto, ON</div>, <div class=""companyLocation"">Toronto, ON</div>, <div class=""companyLocation"">Toronto, ON</div>, <div class=""companyLocation"">Remote in Winnipeg, MB</div>, <div class=""companyLocation"">North Vancouver, BC</div>, <div class=""companyLocation"">Remote in London, ON</div>]",2022-04-06,https://ca.indeed.com/pagead/clk?mo=r&ad=-6NYlbfkN0BOnCCN2IrCMInChj3DA7ShcjI4lskYsCJGgPxzEZ6mI9ChjkqHdKxkxcE7lOYQHQN57a6eSEf_HKSqxiYeLc5SO8634kyHo_sJ6dUXFWze7-CMDZJZV3v_dGdzUzMsHyyik37h8yOeeWgsn2QT9MVMsbacmOE5eOBR2VKrcKqOaNBT6izuY0uBEk9bKhn8YO0NR48dWzm22LG8fCnn5lmG6RKqpYIrADkzbLtYfHjmsHa2roC3ShtroGzmcvuzgTn9OtefehIsRUwCpmLWt7af4rJC10SWAsCPCGLl8KmdV_ymQwlZGV-uqJcZX_FgKoqUUzjkOlbRK7IAF_lkpyWGdPyjjVqLjwSKT4-d9q6T1P2OGq-oPuNC9fb2rI0EuWBUhkpSJeDCiEMbyh758OBLYio335YoZ9xoYLsO7U6oPIqld5rxXaOPEyJBSO1IpVdtiUQUJq3oLXnBZ9WC5Opo&p=0&fvj=0&vjs=3,"Description
Hey there, we’re Article. We’re a digital-first furniture brand that’s working to make everyday living better by providing an easy way for people to furnish their space. We don’t have brick-and-mortar stores, so we’re able to deliver better value on beautiful modern furniture. We've ranked as one of Canada’s Fastest-Growing Companies for the last three years, and we’re on the hunt for talented, enthusiastic team members who want to solve meaningful problems in pursuit of being remarkably better for our customers.
We’re looking for a Data Analyst to improve data-driven decision-making as our Marketing Team develops the Room Visualizer Tool, and assists other teams at Article with their reporting needs. You will deliver reports, dashboards, and other analyses to allow your cross-functional partners to drive data-driven decision-making. You will also seek out ways to improve the data competency of the company by offering training, office hours, and self-serve tools to less-technical colleagues.


What you'll be doing

Assist the Marketing Special Projects team in deriving insights on the Room Visualizer Tool
Test hypotheses that drive product roadmap decisions by designing purpose-built experiments and performing statistical analysis
Collaborate with other team members to implement data collection methods (ie/ analytics tags, surveys)
Utilize data collected from the Room Visualizer Tool, survey data, data from interviews, and other sources - both structured and unstructured - to assess the value of the tool and test the success of new features as they are developed
Create dashboards and reports to communicate findings with the Marketing Special Projects Team
Work with different business areas at Article to understand their data needs and the decisions they are driving
Provide information in the form of reports, and dashboards to help Article teams drive data-driven decisions
Derive analytical insights to aid future operational efficiency opportunities
Transform operational data to improve its usability
Collaborate with the Data Engineering team to continuously improve Article’s data offering
Improve Article’s data literacy by providing training, office hours, and written guides for less technical team members

Skills Knowledge and Expertise

3+ years of experience in building reports, dashboards, and analysis.
Experience with testing and experimentation (A/B Testing, Multi-Arm Bandit, etc…)
A basic understanding of qualitative research methods and an interest in growing their expertise
You will need to have a deep understanding of SQL and RDMS databases.
You will need to experience optimizing SQL queries. (We primarily use MySQL and Postgres databases)
Experience with R or Python
Nice to have: qualitative research experience (including usability testing, interviews, surveys, etc.)

Benefits

At Article, we believe in an “Ownership Mindset” where you’ll be given autonomy and the ability to own your work. Beyond a competitive salary:
We reward that ownership mindset, so we offer stock options after one year of employment
With our fast growth, we have a culture of curiosity, where learning happens on the fly — and while having a lot of fun
Access to dental and health benefits package plus a health/lifestyle spending account for your total physical and mental well-being
45% discount on our products so you can experience first-hand why our customers love Article
Your choice of state-of-the-art laptops with the tech and tools to easily collaborate
Most HQ employees are working from home due to COVID-19. When it’s safe to return to the office, we have flexible solutions if you want to be in the office a lot, sometimes, or not at all.
When our office is safe to reopen, you’ll love that:
The Article HQ is a converted warehouse with in-house photo studios, an airy open layout, an open kitchen filled with snacks, premium coffees and teas (and ALL the milks).
A dog-friendly office. We love our dog friends here at Article. If you have a well-behaved, well-socialized pup, we’d love to have them in the office too.
Onsite fitness equipment, change rooms (including towel service!) and bike storage
Regular extra-curricular activities, such as socials, open-mics, picnics... even cross-country skiing! For now, we've replaced them with creative virtual events for the time being - like virtual trivia night or a cooking class through Zoom!
Ready to become a Particle? Apply today. We're excited to meet you

#LI-Remote
#LI-VJ15
#ZR1
#INDARTICLETECH
Article is the easiest way to create a beautiful modern space.

Article started with a desire to improve efficiency and make furniture less expensive for everyone. In 2014 we had 4 employees; now we have over 1300 and have been growing rapidly.

Our head office is based in Vancouver, Canada, an office in Ho Chi Minh City, and warehouses in Seattle, Los Angeles, San Francisco, Jacksonville, Austin, Dallas, Portland, Houston, Charlotte, Miami, Chicago, Nashville, Denver, Baltimore, Toronto, Boston, and New Jersey.",Article,https://ca.indeed.com/cmp/Article?campaignid=mobvjcmp&from=mobviewjob&tk=1g00g9rmtq06t800&fromjk=c92f22329e6c93f4
IT Business Analyst,"[<div class=""companyLocation"">Remote in Vancouver, BC</div>, <div class=""companyLocation"">Montréal, QC</div>, <div class=""companyLocation"">Hybrid remote in Toronto, ON</div>, <div class=""companyLocation"">Waterloo, ON</div>, <div class=""companyLocation"">Markham, ON</div>, <div class=""companyLocation"">Toronto, ON</div>, <div class=""companyLocation"">Charlottetown, PE</div>, <div class=""companyLocation"">Temporarily Remote in Kingston, ON</div>, <div class=""companyLocation"">Hybrid remote in North Vancouver, BC</div>, <div class=""companyLocation"">Toronto, ON</div>, <div class=""companyLocation"">Toronto, ON</div>, <div class=""companyLocation"">Toronto, ON</div>, <div class=""companyLocation"">Remote in Winnipeg, MB</div>, <div class=""companyLocation"">North Vancouver, BC</div>, <div class=""companyLocation"">Remote in London, ON</div>]",2022-04-06,https://ca.indeed.com/pagead/clk?mo=r&ad=-6NYlbfkN0ChCfeBlXJp7BBWzifIhqTyXSa4GT1-XnPKGYmY8ZMBa9kNOaOuOAP11RY8H8eK9DQe5fapN-Cf6nPVMKvOxH-oJuv903T0JtjpBMIZXgOZXDZEUCD4s0q-DOOQ6x9YrrlyYTByYKlGFEPIIf3-aBJxLxQ_Oa406nyU4YqTeqXPI61_G96AcRGGDBN1BbKpaos7k7RIH7On9_P7l4UYrbo5Qcy6OYcWG6zYFwF4pVad4RBAXMf0iSWgzJFHudPaqgDQ0mEqnsS3qSdsGLx3uxOp-Bb8QwGIirhpnMn_-DyzOeKTD_35MEMfKKGdnbQFggx4Ky33ve6ge2vGoK_igqcFw20Gr6pN9ufyAIscvjd5SRQrmjlfSSB3OEvzwIIDdz1ysh28e3Gd5Z9VWCN3LDJmbbbXHkgjMyVsNQKa1lqz6ktS1F5SZrV8JCJPK8KUpA19ohy7tf3kqVi173bGVuf5p_TquNdj4732x7cbItQtNw==&p=1&fvj=1&vjs=3,"Do you want to thrive in a stimulating work environment? Join the leader in digital transformation and boost your career at Levio. We offer you a unique opportunity to develop your knowledge within a high-calibre team.The variety of challenges offered by our clients will give you the opportunity to surpass yourself and keep your expertise at the top. Share the daily life of our customers and be an important player in the most ambitious projects in terms of technology and software solutions.Position: IT Business Analyst with Data Analysis and ETL ExperienceMandate description: ​​Need an IT BA for a large project having experience withExperience in Data analysisExperience in ETL Functional mappingExperience with ETL Business rules and process flow documentationMust Have: Ideal candidate will have experience with Oracle fusion applications and finance systems8+ Technical analysis experience with high exposure to finance business language and processes2+ years inExperience in Data analysisExperience in ETL Functional mappingExperience with ETL Business rules and process flow documentationVery good understanding of project management methodology and processAbility to host brainstorming session with large and diversified audienceAbility to drive initiatives from requirement up to deliveryProficiency in working and querying large data sets using SQLGood problem-solving skills and an understanding of business dynamicsTeam-oriented and highly collaborativeExcellent verbal and written communication skills (technical users to executives)Strong AssetsKnowledge of Accounting and Financial systems processes and operations3+ years of experience in the insurance/banking/financial service industryCompletion of business analysis certificationScrum master certification or course completionHigh level working knowledge of multiple complex software and hardware platformsKey Responsibilities: Understand business requirements, translate them into technical requirements and render those as architectural models that will operate at large scale and high performance and advise on how to run these architectural models.Perform POCs on tools and provide recommendations to solve specific business needs.Deliver effective performance analysis, reporting and presentation to management.Perform the analysis of relationships between non-functional requirements and key performance measures. Proactively identify areas for further research and analysis regarding performance.Coordinate troubleshooting of performance related application issues. Conduct root cause analysis of issues and bottlenecks.Take part in all project phases to ensure completion by collaborating with users and communicating status reportsMaintain a strong business focus with an understanding of the current and strategic direction of Intact technologies.Effectively manage relationships and expectations across all management levels.Technologies required: ​JIRA, HP Service Manager---------------------------------------------------------------------------------------------------------------------Lieu de travail / Location: Toronto, ON, Montreal, QC (2020)Start Date: 2022-05-02Potential for extension: YesExtension info:​This is a large project and may need extension beyond 6 months of first contract.Languages spoken and written: English, FrenchLevel of experience: SeniorYears of experience: 8+ years experience as IT BA of which 2+ years with Data Analysis, ETL Functional Mapping, business Rules and Process flowType d'emploi : Temps plein, Permanent, Contrat à durée déterminée, Pigiste / FreelanceAvantages :Assurance DentaireAssurance InvaliditéAssurance Maladie ComplémentaireAssurance VieAssurance VisionCongés de Vacances et CompensatoiresHoraires flexiblesREER CollectifTenue DécontractéeTravail à domicileHoraire :8 HeuresLangue:Français (Souhaité)Anglais (Souhaité)",Logimethods Inc.,https://ca.indeed.com/cmp/Logimethods-1?campaignid=mobvjcmp&from=mobviewjob&tk=1g00g9tccg2cs800&fromjk=c31eb2a2e1d1fe62
