Title,Location,Extract_date,Link,Desc,Company,CompanyLink
Data Analyst (Winnipeg),"[<div class=""companyLocation"">Remote in Vancouver, BC</div>, <div class=""companyLocation"">Hybrid remote in Toronto, ON</div>, <div class=""companyLocation"">Waterloo, ON</div>, <div class=""companyLocation"">Montréal, QC</div>, <div class=""companyLocation"">Toronto, ON</div>, <div class=""companyLocation"">Markham, ON</div>, <div class=""companyLocation"">Toronto, ON</div>, <div class=""companyLocation"">Charlottetown, PE</div>, <div class=""companyLocation"">Temporarily Remote in Kingston, ON</div>, <div class=""companyLocation"">Hybrid remote in North Vancouver, BC</div>, <div class=""companyLocation"">Toronto, ON</div>, <div class=""companyLocation"">Toronto, ON</div>, <div class=""companyLocation"">Toronto, ON</div>, <div class=""companyLocation"">Remote in Winnipeg, MB</div>, <div class=""companyLocation"">North Vancouver, BC</div>]",2022-04-06,https://ca.indeed.com/company/Paradigm-Consulting-Group-Inc./jobs/Data-Analyst-b0ecb3a0c9039d67?fccid=97f7db2fb2223d41&vjs=3,"Paradigm has opportunities for a Data Analytics Consultant to employ their knowledge, skills and techniques to deliver and implement significant initiatives and enable our customers to maximize their investments in their business processes and information technology.Our customers are contemplating returning to the office. this role may begin in a work from home model but may migrate to working on site at the customer request.What you’ll do: (for the Customer)Based on the assignment, interpret data, analyze results using statistical techniques and provide ongoing reportsDevelop and implement databases, data analysis systems, data collection systems, data environments and other strategies that optimize statistical efficiency and qualityAcquire data from primary or secondary data sources and maintain databases/data systems and manage the flow of data to and from disparate data systemsIdentify, analyze, and interpret trends or patterns in complex data setsFilter and “clean” data by reviewing computer reports, printouts, and performance indicators to locate and correct code problemsWork with management to prioritize business and information needsLocate and define new process improvement opportunitiesMonitor performance and quality control plans for data analytics related processes to identify improvementsLiaise among stakeholders to identify meaningful requirements for improvements and solutionsNegotiate requirements as necessary, helping your audience discover what they need, not just what they wantPersuade internal and external stakeholders of the benefits of the deliverables produced by the initiative(s)Liaise with Project Managers to create project specific reports on tracking data analytics based business goals / business needsWhat we’d like:2+ years work experience as a Data AnalystTechnical expertise regarding data models, database design development, data mining and segmentation techniquesStrong (and demonstrable) knowledge of and experience with reporting packages (e.g. Business Objects), databases (e.g. SQL), programming (e.g. XML, Javascript, or ETL frameworks)Knowledge of statistics and experience using statistical packages for analyzing datasets (Excel, SPSS, SAS, R, Python)Strong analytical skills with the ability to collect, organize, analyze, and disseminate significant amounts of information with attention to detail and accuracyExpertise in SQL, Azure SQL is an assetExperience using SQL Server Management Studio and\or Azure Data StudioExperience designing and implementing Power BI or Tableau datasets, reports and dashboards5+ years demonstrating highly effective interpersonal, organizational, and communication skills3+ years experience in both Agile and Waterfall methodologiesStrong communication, organizational, planning and relationship skillsDelivery experience within Canada – experience in Regina, Saskatoon or Winnipeg would be a bonusBS in Mathematics, Economics, Computer Science, Information Management or Statistics is a strong assetOther relevant certifications such as aCAP \ CPADS \ CAP \ Cloudera Data Analyst \ EMCDSA \ MCADSA \ MCDAA would be an assetWhat you can expect from us: An IT and Business Consulting practice with over 30 years of experience and presence in Regina, Winnipeg and SaskatoonOpportunity to work on exciting, challenging and transformational projectsSupport for your Professional Development programCompetitive compensation, benefits, profit sharing and vacation policiesAn organization that believes in work/life balance: after seven (7) years of service, you will receive a six (6) week paid sabbatical to re-charge and relaxExciting Employee Ownership optionsAccess to a network of consultants with deep knowledge and experience to support and connect withTo learn more about our Benefits, Culture* or apply for these opportunities, please visit our website: *Careers.ParadigmConsulting.comWe thank you for your interest, however, only those selected for interviews will be contacted.Paradigm Consulting Group is committed to cultural diversity, inclusiveness and gender equity. We encourage all qualified candidates to apply.Job Type: Full-time",Paradigm Consulting Group,https://ca.indeed.com/cmp/Paradigm-Consulting-Group-Inc.-2?campaignid=mobvjcmp&from=mobviewjob&tk=1g00gdi5kq05j800&fromjk=b0ecb3a0c9039d67
Data Analyst,"[<div class=""companyLocation"">Remote in Vancouver, BC</div>, <div class=""companyLocation"">Hybrid remote in Toronto, ON</div>, <div class=""companyLocation"">Waterloo, ON</div>, <div class=""companyLocation"">Montréal, QC</div>, <div class=""companyLocation"">Toronto, ON</div>, <div class=""companyLocation"">Markham, ON</div>, <div class=""companyLocation"">Toronto, ON</div>, <div class=""companyLocation"">Charlottetown, PE</div>, <div class=""companyLocation"">Temporarily Remote in Kingston, ON</div>, <div class=""companyLocation"">Hybrid remote in North Vancouver, BC</div>, <div class=""companyLocation"">Toronto, ON</div>, <div class=""companyLocation"">Toronto, ON</div>, <div class=""companyLocation"">Toronto, ON</div>, <div class=""companyLocation"">Remote in Winnipeg, MB</div>, <div class=""companyLocation"">North Vancouver, BC</div>]",2022-04-06,https://ca.indeed.com/company/Olympic-Industries-Inc./jobs/Data-Analyst-a3cdd2f5a2ab8369?fccid=5f40fe773522c7e7&vjs=3,"Who We AreOlympic Industries ULC is a leading international forest products trading company with annual revenue exceeding $500 million. Our expertise includes importing, manufacturing, and wholesale distribution of lumber.Established in 1972, we have a strong record of success and a clear vision for our industry's sustainable future. Our office is located in the heart of the vibrant and breathtaking Lonsdale Quay.OpportunityOlympic Industries is currently searching for a highly motivated Data Analyst to join our growth-oriented team!Working closely with the Head of Derivatives & Data, you will be responsible for designing, implementing, and upkeeping analytical models and software.Specific ResponsibilitiesDevelop full-stack web framework applications for analyzing big data.Assist the Head of Derivative & Data in the analyzing and developing reports, dashboards and briefing documents for internal and external stakeholders.Build and upkeep analytical models to provide a dynamic analysis of the business.Perform code optimization in existing data projects.Create statistical and forecasting models on complex inventory and trading data.Create and improve automation processes for routine data processing tasks such as data scraping.Research and source new data from different vendors.Education and ExperienceUndergraduate or graduate degree in computer science, statistics, data science, or related technical field.Strong programming skills in one of R, Python or Java.Familiar with basic SQL query and big database pipelines.Knowledge of Google Sheets and scripting in Apps Scrip.Knowledge in web frameworks such as Django, Flask, or Shiny.Prior experience in building web-based applications considered an asset.Knowledge in machine learning, data mining, statistical modelling, and forecasting considered an asset.Knowledge or experience in working with REST API and Web Socket to extract, manipulate, and automate data considered an assetKnowledge or experience in quantitative finance or financial engineering considered an asset but not required.CompetenciesProven ability to complete work in a timely manner with exceptional accuracy and attention to detail.Outstanding verbal, written and visual communication skills.A high degree of initiative, work ethic, integrity, and honesty.Ability to listen and understand instructions and work independently or with others to complete tasks.Working knowledge of Microsoft Office, including Outlook, Word, and Excel.Ability to use strong judgement in analyzing, troubleshooting, and evaluating problems.Ability to act with good judgement and discretion: keeping sensitive business data secure.Desire and capacity to acquire new knowledge and develop new skills, specifically in the commodities trading industry.High-energy with an entrepreneurial spirit.Why Join Us?Work hard, play hard company culture where you will build meaningful relationships.Opportunity to do meaningful work that creates value to the company.On-site gym and showers.Easy access to the mountains and oceans.Apply Now! For more information on Olympic Industries, please visit our website at www.olympicind.com.We thank all applicants for their interest! However, only those selected for an interview will be contacted. At Olympic Industries, we embrace diversity and are committed to building a team that represents a variety of backgrounds, cultures, perspectives, skills, and experiences. As an equal opportunity employer, we encourage applications from all qualified individuals.Job Types: Full-time, PermanentBenefits:Company eventsDental careDisability insuranceEmployee assistance programEmployee stock purchase planExtended health careLife insuranceOn-site gymPaid time offRRSP matchVision careWellness programWork from homeSchedule:Monday to Friday",Olympic Industries ULC,https://ca.indeed.com/cmp/Olympic-Industries-Inc.-1?campaignid=mobvjcmp&from=mobviewjob&tk=1g00gdjbd38q5000&fromjk=a3cdd2f5a2ab8369
Data Analyst,"[<div class=""companyLocation"">Remote in Vancouver, BC</div>, <div class=""companyLocation"">Mississauga, ON</div>, <div class=""companyLocation"">Hybrid remote in Toronto, ON</div>, <div class=""companyLocation"">Waterloo, ON</div>, <div class=""companyLocation"">Markham, ON</div>, <div class=""companyLocation"">Toronto, ON</div>, <div class=""companyLocation"">Charlottetown, PE</div>, <div class=""companyLocation"">Temporarily Remote in Kingston, ON</div>, <div class=""companyLocation"">Hybrid remote in North Vancouver, BC</div>, <div class=""companyLocation"">Toronto, ON</div>, <div class=""companyLocation"">Toronto, ON</div>, <div class=""companyLocation"">Toronto, ON</div>, <div class=""companyLocation"">Remote in Winnipeg, MB</div>, <div class=""companyLocation"">North Vancouver, BC</div>, <div class=""companyLocation"">Remote in London, ON</div>]",2022-04-06,https://ca.indeed.com/pagead/clk?mo=r&ad=-6NYlbfkN0BOnCCN2IrCMInChj3DA7ShcjI4lskYsCJGgPxzEZ6mI9ChjkqHdKxkxcE7lOYQHQN57a6eSEf_HKSqxiYeLc5SO8634kyHo_sJ6dUXFWze7-CMDZJZV3v_dGdzUzMsHyyik37h8yOeeWgsn2QT9MVMsbacmOE5eOBR2VKrcKqOaGIJwlFNurZGpcVA8xqQsyBq-xEJnmKtaPseF1LoDwf9l45CmQ7Je8d3Yk7VlYhw7E1xouioDKg7AIOohQMax9QPsV8ZzqW28-jnSKu0kHMOlaK7atIBCe-bNRjZHiTd-abA7V9S_NZiPHkVx-Gd2rHTzNmnF9WobV1B2PmUGTQR2rwlb9SvL64m91TvFj0ZMTmjOrulT0XQWxOMVcv3R2nCZ9Vssb20RQzpXEIz213_BnD1gznWY_-5PfzaMM6IZglIfbw8SfD3eYXbldT8tw47CNA4DPNiit_q_ct-v2zB&p=0&fvj=0&vjs=3,"Description
Hey there, we’re Article. We’re a digital-first furniture brand that’s working to make everyday living better by providing an easy way for people to furnish their space. We don’t have brick-and-mortar stores, so we’re able to deliver better value on beautiful modern furniture. We've ranked as one of Canada’s Fastest-Growing Companies for the last three years, and we’re on the hunt for talented, enthusiastic team members who want to solve meaningful problems in pursuit of being remarkably better for our customers.
We’re looking for a Data Analyst to improve data-driven decision-making as our Marketing Team develops the Room Visualizer Tool, and assists other teams at Article with their reporting needs. You will deliver reports, dashboards, and other analyses to allow your cross-functional partners to drive data-driven decision-making. You will also seek out ways to improve the data competency of the company by offering training, office hours, and self-serve tools to less-technical colleagues.


What you'll be doing

Assist the Marketing Special Projects team in deriving insights on the Room Visualizer Tool
Test hypotheses that drive product roadmap decisions by designing purpose-built experiments and performing statistical analysis
Collaborate with other team members to implement data collection methods (ie/ analytics tags, surveys)
Utilize data collected from the Room Visualizer Tool, survey data, data from interviews, and other sources - both structured and unstructured - to assess the value of the tool and test the success of new features as they are developed
Create dashboards and reports to communicate findings with the Marketing Special Projects Team
Work with different business areas at Article to understand their data needs and the decisions they are driving
Provide information in the form of reports, and dashboards to help Article teams drive data-driven decisions
Derive analytical insights to aid future operational efficiency opportunities
Transform operational data to improve its usability
Collaborate with the Data Engineering team to continuously improve Article’s data offering
Improve Article’s data literacy by providing training, office hours, and written guides for less technical team members

Skills Knowledge and Expertise

3+ years of experience in building reports, dashboards, and analysis.
Experience with testing and experimentation (A/B Testing, Multi-Arm Bandit, etc…)
A basic understanding of qualitative research methods and an interest in growing their expertise
You will need to have a deep understanding of SQL and RDMS databases.
You will need to experience optimizing SQL queries. (We primarily use MySQL and Postgres databases)
Experience with R or Python
Nice to have: qualitative research experience (including usability testing, interviews, surveys, etc.)

Benefits

At Article, we believe in an “Ownership Mindset” where you’ll be given autonomy and the ability to own your work. Beyond a competitive salary:
We reward that ownership mindset, so we offer stock options after one year of employment
With our fast growth, we have a culture of curiosity, where learning happens on the fly — and while having a lot of fun
Access to dental and health benefits package plus a health/lifestyle spending account for your total physical and mental well-being
45% discount on our products so you can experience first-hand why our customers love Article
Your choice of state-of-the-art laptops with the tech and tools to easily collaborate
Most HQ employees are working from home due to COVID-19. When it’s safe to return to the office, we have flexible solutions if you want to be in the office a lot, sometimes, or not at all.
When our office is safe to reopen, you’ll love that:
The Article HQ is a converted warehouse with in-house photo studios, an airy open layout, an open kitchen filled with snacks, premium coffees and teas (and ALL the milks).
A dog-friendly office. We love our dog friends here at Article. If you have a well-behaved, well-socialized pup, we’d love to have them in the office too.
Onsite fitness equipment, change rooms (including towel service!) and bike storage
Regular extra-curricular activities, such as socials, open-mics, picnics... even cross-country skiing! For now, we've replaced them with creative virtual events for the time being - like virtual trivia night or a cooking class through Zoom!
Ready to become a Particle? Apply today. We're excited to meet you

#LI-Remote
#LI-VJ15
#ZR1
#INDARTICLETECH
Article is the easiest way to create a beautiful modern space.

Article started with a desire to improve efficiency and make furniture less expensive for everyone. In 2014 we had 4 employees; now we have over 1300 and have been growing rapidly.

Our head office is based in Vancouver, Canada, an office in Ho Chi Minh City, and warehouses in Seattle, Los Angeles, San Francisco, Jacksonville, Austin, Dallas, Portland, Houston, Charlotte, Miami, Chicago, Nashville, Denver, Baltimore, Toronto, Boston, and New Jersey.",Article,https://ca.indeed.com/cmp/Article?campaignid=mobvjcmp&from=mobviewjob&tk=1g00gj1ji38qr000&fromjk=c92f22329e6c93f4
Business Intelligence Analyst,"[<div class=""companyLocation"">Remote in Vancouver, BC</div>, <div class=""companyLocation"">Mississauga, ON</div>, <div class=""companyLocation"">Hybrid remote in Toronto, ON</div>, <div class=""companyLocation"">Waterloo, ON</div>, <div class=""companyLocation"">Markham, ON</div>, <div class=""companyLocation"">Toronto, ON</div>, <div class=""companyLocation"">Charlottetown, PE</div>, <div class=""companyLocation"">Temporarily Remote in Kingston, ON</div>, <div class=""companyLocation"">Hybrid remote in North Vancouver, BC</div>, <div class=""companyLocation"">Toronto, ON</div>, <div class=""companyLocation"">Toronto, ON</div>, <div class=""companyLocation"">Toronto, ON</div>, <div class=""companyLocation"">Remote in Winnipeg, MB</div>, <div class=""companyLocation"">North Vancouver, BC</div>, <div class=""companyLocation"">Remote in London, ON</div>]",2022-04-06,https://ca.indeed.com/pagead/clk?mo=r&ad=-6NYlbfkN0DbNJQGwjC-NEA80-qlVyEGmSv34Xx0eW4t4u9rXSv_7_tlvMU2e-Gw_wrZ47s1zPB_DbZSdLcTR8RaRiwSWYhOKcqmVAbQ5bU8uOlhqY_f45jixv6XD2E2yc-2wYfN9OcrmUZJauc49ncFCIVTmLMt56GXodbkzEHRXeRu2M24fhBYmiZOrRYLzLgF4g8RG57gGDOBdbaSpX7B6uEAXoejklBwv4KP_SqL_bvrsJJI1sB_GTG1loizaToKE72z74rSVm8M-0zgGgMhn718qVzz7ioTy74k7eynobRs43wid9srowoK7ttLAtPt6RaUDKt32qZvpH532BOgJXMaf7XzFLR7yLhF9ZvrPgnyc8_H9jzUHl6PFBekKCfTtYf6JCqGz9_vZp2m379LQrgfFtOb_vCsw2ZMFrSnIwwzkS8Vibv9vEzySKKwGADd0Bk80b0l0vtp_mUQk5x4VAZjtE53M2DFusSyhK4qkPYAU5w9jDrb59Z5qFfT&p=1&fvj=0&vjs=3,"If you are looking to join one of Canada’s fastest-growing companies, goeasy Ltd. is the place for you! Certified as a Great Place to Work®, recognized as Canada’s Most Admired Corporate Cultures, GTA's Top 100 Employers, one of Canada’s Top 50 Fintech’s and North America’s Most Engaged Workplaces, we want the best and brightest to join our team.

We are a publicly-traded company on the TSX with over 4000% shareholder return since 2001. Accredited by the Better Business Bureau, goeasy Ltd is a Canadian company that provides non-prime leasing and lending services through easyhome, easyfinancial and LendCare. We offer a wide variety of financial products and services including lease-to-own merchandise, unsecured and secured installment loans, direct-to-consumer auto loans, and point-of-sale financing to over 4,000 merchants in the powersports, automotive, retail, home improvement and health sectors. With over 30 years of experience, our 2200 employees work with our customers to help them get access to the money they need today, while they rebuild their credit and graduate to prime rates. Our omnichannel model includes over 400 retail locations and digital/mobile platforms that enable our customers to transact with us through their channel of choice.

As a member of the BI Team, the Business Intellgience (BI) Analyst will participate in scoping analyze, developing and automating BI reports and dashboard solutions and also own the process for Quality Assurance and Support for BI reports and dashboards. In addition, the Business Intelligence Analyst must ensure high levels of data quality, hygiene and accuracy.

Job Responsibilities:

Interface with the business representatives and leaders to validate and capture business requirements/requests for reporting solutions
Analyse business requirements, propose, design, develop and implement BI solutions to satisfy requirements
Participate in development datamarts, reports and data visualization solutions (dashboards) on the Business insights platform, powered by Microstrategy
Develop and execute the quality and performance testing strategy and plans for BI reports and dashboard based on detailed data analysis
Documents BI reports testing results and develops recommendations for product improvement
Perform data validation, reports testing and identify data and reporting quality issues
Communicate progress, milestones, challenges against plan, and escalation of issues
Own support and monitoring of BI platform activities, ensuring timely loads and refreshes of all reports, dashboards and subscription, and provide timely support for self-service reporting
resolve data reporting issues in a timely fashion towards a stable BI environment
Develop deep data knowledge of goeasy business by combining data sets from different system, analyzing heterogeneous data sets to come up with interesting KPIs and inform the business as needed dive deep into key metrics based on requests
Create ad-hoc queries and reports as needed along with providing on-going analytical support for these requests
Work effectively with the Business Intelligence and Data Solutions Architects, Data and BI Engineers to ensure that all approved development and deployment procedures are followed

Key Qualifications:

2-3 years full domain knowledge of BI end to end implementation
2 years experience with BI Projects and/or data/reports testing
A minimum of 2 years in-depth business reporting experience
Bachelor’s Degree in Computer Science, MIS, Computer Engineering or other Information Technology related degree
A minimum of 2 years of hands on design and development experience with BI tools (such as MicroStrategy, PowerBI, Tableau)
1-2 years working with SQL Server or comparable relational database system
Experience developing reports using documents, grids, graphs, dashboards and working in Business Intelligence or Reporting Environments
Advanced Knowledge of SQL skills to build, debug, and optimize

Inclusion and Equal Opportunity Employment

goeasy is an equal opportunity employer. In addition, goeasy is committed to providing accommodations for applicants upon request at any stage of the recruitment process in accordance with all legislative requirements throughout Canada. Please let us know if you require an accommodation due to a disability during any aspect of the recruitment process and we will work with you to address your needs.

Additional Information:

All candidates considered for hire must successfully pass a criminal background check, credit check, and validation of their work experience to qualify for hire. We thank all interested applicants, however we will only be contacting those for interview who possess the skills and qualifications outlined above.

Why should you work for goeasy?

To learn more about our great company please click the links below:

http://goeasy.com/careers/


PAID1234",goeasy,https://ca.indeed.com/cmp/Goeasy?campaignid=mobvjcmp&from=mobviewjob&tk=1g00gj3nfq6rk800&fromjk=da7f424f601802be
