Title,Location,Extract_date,Link,Desc,Company,CompanyLink
Data Analyst,"Article45 reviewsVancouver, BCRemote",2022-04-06,https://ca.indeed.com/pagead/clk?mo=r&ad=-6NYlbfkN0BOnCCN2IrCMInChj3DA7ShcjI4lskYsCJGgPxzEZ6mI9ChjkqHdKxkxcE7lOYQHQN57a6eSEf_HKSqxiYeLc5SO8634kyHo_sJ6dUXFWze7-CMDZJZV3v_dGdzUzMsHyyik37h8yOeeWgsn2QT9MVMsbacmOE5eOBR2VKrcKqOaHJ1Qa7M2T6qX1f5eR8TAXd7GoAFnxQbnWiT3o8GzxElAEjGm05Ryh2I6m8PJcjuuSzIL8ql9DtRzpol1hcVF7bmedqY6ssy0r2Q6xg4wC9_L21gCgsLrNu-C3qf_nW-LhMi1Px3ADLA6WhArCOmDiLBUULKC6slM1dPCY1bSoZvGqJku3AMfNMhOjkTvJT7AX-9N3G6uh0ajEdhbn8dsKzcYVlaynUCVELjdbWI249xe8y7ZZJK0Rl9Cqp5RGjR5IBktPhiOr7RUkb4seTrYVPipj5FIy7q8D5qn3LrC3YD&p=0&fvj=0&vjs=3,"Description
Hey there, we’re Article. We’re a digital-first furniture brand that’s working to make everyday living better by providing an easy way for people to furnish their space. We don’t have brick-and-mortar stores, so we’re able to deliver better value on beautiful modern furniture. We've ranked as one of Canada’s Fastest-Growing Companies for the last three years, and we’re on the hunt for talented, enthusiastic team members who want to solve meaningful problems in pursuit of being remarkably better for our customers.
We’re looking for a Data Analyst to improve data-driven decision-making as our Marketing Team develops the Room Visualizer Tool, and assists other teams at Article with their reporting needs. You will deliver reports, dashboards, and other analyses to allow your cross-functional partners to drive data-driven decision-making. You will also seek out ways to improve the data competency of the company by offering training, office hours, and self-serve tools to less-technical colleagues.


What you'll be doing

Assist the Marketing Special Projects team in deriving insights on the Room Visualizer Tool
Test hypotheses that drive product roadmap decisions by designing purpose-built experiments and performing statistical analysis
Collaborate with other team members to implement data collection methods (ie/ analytics tags, surveys)
Utilize data collected from the Room Visualizer Tool, survey data, data from interviews, and other sources - both structured and unstructured - to assess the value of the tool and test the success of new features as they are developed
Create dashboards and reports to communicate findings with the Marketing Special Projects Team
Work with different business areas at Article to understand their data needs and the decisions they are driving
Provide information in the form of reports, and dashboards to help Article teams drive data-driven decisions
Derive analytical insights to aid future operational efficiency opportunities
Transform operational data to improve its usability
Collaborate with the Data Engineering team to continuously improve Article’s data offering
Improve Article’s data literacy by providing training, office hours, and written guides for less technical team members

Skills Knowledge and Expertise

3+ years of experience in building reports, dashboards, and analysis.
Experience with testing and experimentation (A/B Testing, Multi-Arm Bandit, etc…)
A basic understanding of qualitative research methods and an interest in growing their expertise
You will need to have a deep understanding of SQL and RDMS databases.
You will need to experience optimizing SQL queries. (We primarily use MySQL and Postgres databases)
Experience with R or Python
Nice to have: qualitative research experience (including usability testing, interviews, surveys, etc.)

Benefits

At Article, we believe in an “Ownership Mindset” where you’ll be given autonomy and the ability to own your work. Beyond a competitive salary:
We reward that ownership mindset, so we offer stock options after one year of employment
With our fast growth, we have a culture of curiosity, where learning happens on the fly — and while having a lot of fun
Access to dental and health benefits package plus a health/lifestyle spending account for your total physical and mental well-being
45% discount on our products so you can experience first-hand why our customers love Article
Your choice of state-of-the-art laptops with the tech and tools to easily collaborate
Most HQ employees are working from home due to COVID-19. When it’s safe to return to the office, we have flexible solutions if you want to be in the office a lot, sometimes, or not at all.
When our office is safe to reopen, you’ll love that:
The Article HQ is a converted warehouse with in-house photo studios, an airy open layout, an open kitchen filled with snacks, premium coffees and teas (and ALL the milks).
A dog-friendly office. We love our dog friends here at Article. If you have a well-behaved, well-socialized pup, we’d love to have them in the office too.
Onsite fitness equipment, change rooms (including towel service!) and bike storage
Regular extra-curricular activities, such as socials, open-mics, picnics... even cross-country skiing! For now, we've replaced them with creative virtual events for the time being - like virtual trivia night or a cooking class through Zoom!
Ready to become a Particle? Apply today. We're excited to meet you

#LI-Remote
#LI-VJ15
#ZR1
#INDARTICLETECH
Article is the easiest way to create a beautiful modern space.

Article started with a desire to improve efficiency and make furniture less expensive for everyone. In 2014 we had 4 employees; now we have over 1300 and have been growing rapidly.

Our head office is based in Vancouver, Canada, an office in Ho Chi Minh City, and warehouses in Seattle, Los Angeles, San Francisco, Jacksonville, Austin, Dallas, Portland, Houston, Charlotte, Miami, Chicago, Nashville, Denver, Baltimore, Toronto, Boston, and New Jersey.",Article,https://ca.indeed.com/cmp/Article?campaignid=mobvjcmp&from=mobviewjob&tk=1g00g6u3ik27s800&fromjk=c92f22329e6c93f4
Data Analyst,"Alliance Search Partners2 reviewsToronto, ONHybrid remote",2022-04-06,https://ca.indeed.com/pagead/clk?mo=r&ad=-6NYlbfkN0B2rgPGb8iKQW7qLyTw0WXISuqlNuORLdf67EF1j2DWun8Y5AUxproWCXzzfSdXO8H6IKAXNJOLWC2Tp6PLNiXL_ME2pQ6hT6gFpMNRi2cf8WTIJl0NQqkwKEYBEyFMvAQx9nbhqA-Acyenhm5nrQOPD3km8xll_e0mW9uVyKyg0lpsmoxNF9ZfHCffNh3NHKLG2b-VTuAm351ObAd7VQFK6eK9lay7n4s6Zr5XJzehd7_Y7uE0LH_CV8LZyndiEf9vebSQ_5Auc504c5KyYQ0Tn-zecBZjeT0oMeuI3w2ZiteCxzS-MZR1EvppIQJowPgcKkM9gf1sEBdYWhr-RTzqpXOlCFyh9wiZJyzRXuMxF8QPmtJ8JPx_j6ta-KNh8tf-PUJmsxK3aLGvujOqelXqMMjtP5Rkpl_MiD2nkqdAobkqMpT2hrCaKmCu5ifoLZMl8zq2aNCdLFhvk5YnOUIJ9bzI74r_RkvwiVMw08gUxWPI2-t8c-Gd&p=1&fvj=1&vjs=3,"Start/End Dates: 4/25/2022 - 11/27/2023Work location: 81 Bay 29th Floor (hybrid model to start, will need to go into office)Job Title: IT - Data Analyst - SeniorJob Description: All employees and non-employees must be fully vaccinated against COVID-19 (2 doses required).**Job level: 7No. of Positions: 1Duration: 18 monthsLine of Business: Small Business Risk ManagementTarget Start Date: 4/25/2022Potential for this contract to be extended or converted to FTE: PossibilityWork Schedule: Monday - Friday, 9:00 am – 5:00 pm. A little flexibility with work hours. 37.5hours/week. Overtime might be possible.Interview Process: 2 rounds; 1 with HM, 2nd round with senior directorUpcoming vacation time? NAAvailability to Interview (date/time): ASAPReason the role is open: Supporting a large transformation project in small business initiated a year agoProject the contractor will be working on: variety: data analytics, strategy development, building a data repositoryGroup information: overall 8 people; 3 FT, 1 CW under HMEVP (Employee Value Proposition): Project work is interesting; onboarding a new vendor, major strategy initiative and will provide the candidate with a unique experience. Also, a great team environment: a knowledge sharing team – each team member has their own area of expertise, but expectation is to share (whether that be best practices, etc.) for the betterment of the team and gain valuable knowledge.The Candidate will Be Working with: within CIBC: small business product team, opportunity with other teams such as marketing, retail lending services, national collections teamsJob Details:Reporting to the Senior Manager, Small Business Risk Management, the successful candidate will be well versed in designing, building and implementing account acquisition and account management strategies with a focus on increasing auto-approval rates and decreasing loss rates. Expert level SAS SQL coding skills are required to extract value from data combined with strong communication skills for presentation of risk-reward analysis to Senior Management. Reporting (standard and ad hoc) will require attention to detail and accuracy.How You’ll SucceedData driven - Actively work with other business partners across the organization to ensure that work is aligned to our mandate and objectives. Lead and support in-depth client insights studies using SAS and create an analytical framework to help solve key business questions and test hypotheses. A strong understanding of reporting, analysis and data mining combined with practical industry experience is required.o Support the development of proposals/business cases for credit risk scorecards, system or rule changes that will enhance credit risk management performanceo Conduct pre- and post-analyses of strategy performance. Provide objective and sound feedback on the performance of acquisition strategies. Make specific recommendations to improve future performanceo Build deep subject matter knowledge of (i) TTD adjudication system rules, tables, and cutoffs and (ii) acquisition campaign criteria.o Experience in Excel Pivot tables, calculations, graphs and charts is essential, and candidate must be able to customize these as requested by teamContinuous improvement mindset - Strong focus on process improvement. Regularly identify, develop, and implement operational process enhancements with the goal of improving efficiencies and synergies between internal and external partners.Communication and relationship management - Lead and assist in preparing comprehensive presentations as needed to highlight key insights from deep dive analysis along with any recommendations that can be adopted to help address gaps or opportunities. Manage a number of high priority requests to support management in order to support the bank’s strategy. Interact and work effectively across multiple internal teams and establish a process to facilitate data/information sharing that ensures a consistent, common understanding of key client metrics.o A strong grasp of financial terms used in Risk as well as their interpretation is strongly preferred.Critical thinking - Apply critical thinking, creativity, and sound judgement to identify issues and opportunities. You can sort through complex and ambiguous scenarios to understand root causes and make tough but reasoned choices between competing alternatives and opinions. You seek to understand before proposing solutions and although you intuitively know something doesn’t make sense, you rely on data and fact to inform decisions and recommendations rather than opinion. Openly and frequently share your knowledge, ideas and views because you know your perspective matters.Project execution - Own and lead projects from inception to execution – such as, working with all stakeholders across the organization to develop a holistic client contribution framework & assessment to the automation of the entire process. Stay abreast of industry best practices regarding analytical methods and technologies.Must Haves:You can demonstrate experience in at least 3-5 years’ experience and strong skills in data extraction/manipulation and statistical analysis tools, including SAS SQL (required);o Must be comfortable with advanced SQL queries and must be able to use SQL to draw relevant data, integrate it and clean it in a data hub environment.o In-depth knowledge of how to work in SAS and should be comfortable understanding existing SAS code and developing their own SAS queries to pull, integrate and output data.Candidate must be able to understand and interpret complex financial data as well as spot any anomalies and inconsistencies in financial dataComfort with exploring how new and emerging data can be usedYou have a degree/diploma in a relevant bachelor’s degree in Engineering, Computer Science, or quantitative discipline such as Applied StatisticsNice to Haves:Experience creating Access/VBA based reporting databases is a strong asset.Working in applied data & analytics problems in business banking and/or retail bankingRelated banking/business/finance knowledge is considered an assetKnowledge of data visualization tools such as COGNOS, Tableau, etc.Experience is developing business requirements documents and solutions requirements documents with TechnologyJob Types: Full-time, Fixed term contract, FreelanceContract length: 18 monthsSalary: $60.00-$63.00 per hourSchedule:Monday to FridayExperience:Data analysis skills: 3 years (required)SAS and SQL: 3 years (required)Access/VBA: 3 years (required)Expected start date: 2022-04-25",Alliance Search Partners,https://ca.indeed.com/cmp/Alliance-Search-Partners?campaignid=mobvjcmp&from=mobviewjob&tk=1g00g6vb02276001&fromjk=b63ada2300a30863
"Business Systems Analyst, Data & Reporting - 336346","Procom98 reviewsWaterloo, ON",2022-04-06,https://ca.indeed.com/pagead/clk?mo=r&ad=-6NYlbfkN0BreR47D9bMWJ28XlwS8rs2_GIFY3-vSdy_Xwl-swcV-sVgEAMl2VRgb3OxKP2a3cZRjZQDjcrzpIAy9E4Ndmnwo1gy7WxxddTNf75dbe_A-nKiYaj2UTOqvH0ZFbfUXMXOtzsinhhYK6l-NR5n4kVIbjFCQlOeH3s4w-AIlCX2ikiZ3xVif1aAhC70pWsZHH2zqMEs7AdszCt3E6his8trsid4XhXOVgehPOmYfBJmLLVR92GA6AFdl_2EivRso6OYdddoJqrOm_8DtjyN2M0FHeGI1B8lTp2dx6nGdnlM4gVg8c8TB1UkSwGa4YgAjeum6NC33kgPV9y06jCwDI4Ibb2HpS30AiNFAUeXdYEIJPoCLtVNkqn51S3cb356K13bfNIi6AZq51iOV0WtBSBrLFcnQW-zSLTuHlPh0SIshdwrZ66hhf3sHS9oTHdM5rc3CEr6Ahq2vfW0-PsxOsg1KYmRuHagbZU_4_mbYqtBg4rkjs755_9VAv9r3b6Mad0RYi4-JszKuptq1lQLC_0m7RhVylSdkS0sHCo4aZMXkGBUN0YtiBZ9kk-keWImjyShAEtxuUFk4Nq3ZESdhXGQ7irDUuk9Tl57lQZySRNbPiJY8BKAkYmJSmzIoQycyhwrkOLg_x7cvw==&p=2&fvj=0&vjs=3,"Business Systems Analyst, Data & Reporting: PROCOM KW is seeking an experienced Business Systems Analyst, Data & Reporting for a permanent role with one of our clients in the Insurance Sector.
Business Systems Analyst, Data & Reporting Job Details
As a Business Systems Analyst, you will be working with a team. You will play a pivotal role to plan, design, orchestrate, and launch efficient business process and system solutions. Your focus will be on delivering business-focused insights through data analysis and driving standardization and consistency across our organization using Six Sigma and Lean methodologies.
Business Systems Analyst, Data & Reporting Responsibilities
Provide business systems analysis expertise in various business process and system integrations across the organization including implementation of multiple concurrent business initiatives to support projects and technology solutions.
Examine technical user needs and goals. Captures and assesses requirements, process, and business problems to propose solutions and recommendations that improve existing processes and promote effective and appropriate system solutions.
Build and maintains relationships with management, staff, and stakeholders including vendors to ensure requirements are being met. Engages and informs project stakeholders, SMEs and leaders which may include, identifying and contexting technology trends, defining and deriving metrics and providing or participating in cross departmental education.
Develop functional test plans and strategies and is responsible for the execution of the test plans in conjunction with business units and the project and/or initiative stakeholders
Collaborate with stakeholders to determine project scope, vision, cost benefit analysis, risk factors. Works with stakeholders to develop detailed solutions, estimates, and project plans in support of business goals and in compliance with project methodology.
Provide technical leadership to junior team members and performs other duties within the Business Systems Analyst function, as assigned.

Business Systems Analyst, Data & Reporting Must Have Skills
Five years’ experience in process design, business analysis, testing, and information technology business solutions.
Experience with BI Dashboards and data extraction experience
Experience with the Microsoft 365 suite of products including. SharePoint, Project, Power Automate is desirable.
Relevant certifications with knowledge of best practices employed by the IIBA and BABOK.

Business Systems Analyst, Data & Reporting Start Date
Immediately
Business Systems Analyst, Data & Reporting Assignment Length
Permanent Full-time",Procom,https://ca.indeed.com/cmp/Procom?campaignid=mobvjcmp&from=mobviewjob&tk=1g00g70ljpkrd802&fromjk=c010f1e91bb52a57
Data Analyst,"DecisivEdgeMarkham, ON",2022-04-06,https://ca.indeed.com/rc/clk?jk=13bd919656106fa0&fccid=545c9eef6a62be2a&vjs=3,"Data Analyst – Markham, ON


As a Data Analyst, you will be responsible for tracking key metrics through building and maintaining data pipelines and dashboards for visualization. Along with this, you will be expected to have a very good handle on different data streams and address the organization’s data requirements.

Essential Duties and Responsibilities


Gather user requirements for new reports and enhance existing reports. Interpret needs and design reports to meet end-user expectations.
Create and maintain reporting tools and applications to support all strategic and tactical needs of the company.
Dashboard development and generation for daily, weekly, monthly, and all reporting needs.
Design and develop complex data queries to move and transform data from operational data sources to analytical databases.


Qualifications

To perform this job successfully, an individual must be able to perform each essential duty satisfactorily. The requirements listed below are representative of the knowledge, skill, and/or ability required. Reasonable accommodations may be made to enable individuals with disabilities to perform the essential functions.


Education and/or Experience

Bachelor’s Degree in Computer Science or related technical discipline; and five years related professional experience; or the equivalent combination of education, technical training, and work experience.


Technical and/or Domain Knowledge

To perform this job successfully, an individual should demonstrate in-depth knowledge and understanding of and experience with the following:


Strong experience in SQL - should be able to build complex and optimized queries
Strong experience in Excel - should be comfortable with advanced functions.
Strong logical & analytical concepts in databases, schemas, dimensional modeling
Good to have: Basic understanding of scripting languages (R, Python, etc.)
Good to have: Experience with BI tools (Power BI, Tableau, QlikView, etc.)
Good to have: Working knowledge of data warehousing infra tools like Hive/ SQL",DecisivEdge,https://ca.indeed.com/cmp/Decisivedge?campaignid=mobvjcmp&from=mobviewjob&tk=1g00g726iq01f800&fromjk=13bd919656106fa0
Junior Data Analyst / Data Entry,"Strategy InstituteToronto, ON",2022-04-06,https://ca.indeed.com/company/Strategy-Institute-Inc./jobs/Junior-Data-Analyst-29bf3d1f0b974167?fccid=6ae58d2271a3b416&vjs=3,"Job descriptionWe are looking to hire a Data Analyst / Data Entry personnel to join our data team. You will take responsibility for managing our master data set, developing reports, and troubleshooting data issues. To do well in this role you need a very fine eye for detail, experience as a data analyst, and deep understanding of the popular data analysis tools and databases.Key Responsibilities and TasksMine and analyze data from company databases to drive optimization and improvement of product development, marketing techniques and business strategies.Deliver flexible, reusable and well-maintained core data repositories.Developing templates and methodologies to ensure data requirements are accurately and completely captured and can be effectively communicated to other data stakeholders.Conducting data profiling to analyze quality of incoming data & advising on any data cleansing rules.Use accelerated delivery methodologies to ensure data initiatives provide timely business value.Perform data entry of information, and make corrections, as required.Create tailored proposals for current and prospective clients.Manage and enhance daily/weekly/monthly reporting to provide results and context to deliver actionable insights, not just reporting data.Manage, prioritize, and respond to ad-hoc requests.Uncover and identify opportunities to improve the customer experience by leveraging statistical approaches against multiple sources of data including internal sales/transactions, CRMs, and external 3rd party data/benchmarks.Research, design and implement reporting infrastructure that leads to automated and flexible reporting.Perform data maintenance tasks when required to ensure ongoing data integrity.Deliver excellence in the analysis of qualitative data used in management reports.Mandatory SkillsGood verbal and written communication skills; able to effectively present analytics data to Business and Marketing users.Driven to understand the relationship between data and the business.Strong work ethic, results oriented, and accuracy / attention to detail are critical.Demonstrated initiative, able to work both independently and as a team member.Proven track record developing and maintaining complex data artifactsAble to clearly communicate complex methodologies and approaches to stakeholders, peers and management.Excellent knowledge of, and demonstrable experience with Microsoft Excel, Google Sheets, Google Docs with an emphasis on using advanced functions and macros.Experience in data manipulation with Python will be considered a strong asset.Job Type: Part-timeSalary: $15.00 per hourAbility to commute/relocate:Toronto, ON: reliably commute or plan to relocate before starting work (preferred)Education:Bachelor's Degree (preferred)Experience:Python: 1 year (preferred)Microsoft Excel: 3 years (preferred)",Strategy Institute,https://ca.indeed.com/cmp/Strategy-Institute-Inc.-1?campaignid=mobvjcmp&from=mobviewjob&tk=1g00g7354383g000&fromjk=29bf3d1f0b974167
